Region,Enterprise Type,Accreditation No,Enterprise Name,Province,Municipality,Business Address,Contact Numbers,Business Website,Accreditation Validity
REGION 6,Mabuhay Accommodation,DOT-R06-MAB-00006-2021,BORACAY TRAVELODGE BEACH RESORT INC.,BORACAY-AKLAN,MALAY,"STATION 2, BRGY. BALABAG, BORACAY ISLAND, MALAY, AKLAN",(036) 288-2659,,10/31/2026
REGION 6,Mabuhay Accommodation,DOT-R06-MAB-00105-2021,BORACAY UPTOWN RESORT,BORACAY-AKLAN,MALAY,"BRGY. BALABAG, BORACAY ISLAND, MALAY, AKLAN",9189634992,,10/31/2026
REGION 6,Mabuhay Accommodation,DOT-R06-MAB-02573-2024,CANVAS INN,BORACAY-AKLAN,MALAY,"SITIO BOLABOG, ZONE V BRGY. BALABAG, BORACAY ISLAND, MALAY AKLAN",036 288 3898 / 09192466522,,10/31/2026
REGION 6,Mabuhay Accommodation,DOT-R06-MAB-00040-2021,CASA FIESTA RESORT,BORACAY-AKLAN,MALAY,"STATION 1,BRGY. BALABAG, BORACAY ISLAND, MALAY, AKLAN",9178080789,,10/31/2026
REGION 6,Mabuhay Accommodation,DOT-R06-MAB-01651-2023,CASA STA. FE,BORACAY-AKLAN,MALAY,"STATION 1, BRGY. BALABAG, BORACAY ISLAND, MALAY, AKLAN",2.88E+06,,10/31/2026
REGION 6,Mabuhay Accommodation,DOT-R06-MAB-03482-2024,CASITAS DE BORACAY BEACH RESORT,BORACAY-AKLAN,MALAY,"SITIO MANGGAYAD, BRGY. MANOC-MANOC, BORACAY ISLAND, MALAY, AKLAN",9177030083,,10/31/2026
REGION 6,Mabuhay Accommodation,DOT-R06-MAB-02591-2024,CASTLE ROCK APARTELLE,BORACAY-AKLAN,MALAY,"SITIO DINIWID, BRGY. BALABAG, BORACAY ISLAND, MALAY, AKLAN",9177188159,,10/31/2026
REGION 6,Mabuhay Accommodation,DOT-R06-MAB-01509-2022,"CHILL OUT HOSTEL, INC",BORACAY-AKLAN,MALAY,"ZONE 5A, BOLABOG STREET, BRGY. BALABAG, BORACAY ISLAND, MALAY, AKLAN",362886662,,10/31/2026
REGION 6,Mabuhay Accommodation,DOT-R06-MAB-01673-2023,CLUB BORACAY APARTELLE,BORACAY-AKLAN,MALAY,"BOLABOG ROAD 1-A EXTENSION, BRGY. BALABAG, BORACAY ISLAND, MALAY, AKLAN",(036) 288-6613,,10/31/2026
REGION 6,Mabuhay Accommodation,DOT-R06-MAB-01410-2022,CON-ELS APARTELLE,BORACAY-AKLAN,MALAY,"ZONE VII, BRGY. BALABAG, BORACAY ISLAND, MALAY, AKLAN",0362889029 / 09177143894,,10/31/2026
REGION 6,Mabuhay Accommodation,DOT-R06-MAB-01556-2022,COOL STAY INN,BORACAY-AKLAN,MALAY,"ZONE 5A, SITIO BOLABOG, BRGY. BALABAG, BORACAY ISLAND, MALAY, AKLAN",9.38E+09,,10/31/2026
REGION 6,Mabuhay Accommodation,DOT-R06-MAB-02215-2023,CORALYN'S PLACE,BORACAY-AKLAN,MALAY,"0472 ZONE V, SITIO BOLABOG, BRGY. BALABAG, BORACAY ISLAND, MALAY, AKLAN",036 288-1888,,10/31/2026
REGION 6,Mabuhay Accommodation,DOT-R06-MAB-01771-2023,CROWN REGENCY COURTYARD RESORT,BORACAY-AKLAN,MALAY,"STATION 2, SITIO MANGGAYAD, BRGY. BALABAG, BORACAY ISLAND, MALAY, AKLAN",9178429362,,10/31/2026
REGION 6,Mabuhay Accommodation,DOT-R06-MAB-01205-2022,D.J.F. BRITON PROPERTIES INC.- CAIPIRINHA VILLA,BORACAY-AKLAN,MALAY,"DINIWID HILLS, BRGY. YAPAK, BORACAY ISLAND, MALAY, AKLAN",36 288 3222,,10/31/2026
REGION 6,Mabuhay Accommodation,DOT-R06-MAB-00028-2021,DAKONG AMIHAN-HOME,BORACAY-AKLAN,MALAY,"STATION 2 MANGGAYAD , BRGY.BALABAG BORACAY ISLAND, MALAY, AKLAN",9219849189,,10/31/2026
REGION 6,Mabuhay Accommodation,DOT-R06-MAB-01411-2022,DEE AND TIMMY COTTAGES,BORACAY-AKLAN,MALAY,"MANGGAYAD, BRGY. MANOC-MANOC, BORACAY ISLAND, MALAY, AKLAN",(036) 288-1829,,10/31/2026
REGION 6,Mabuhay Accommodation,DOT-R06-MAB-01945-2023,DELNORA ACCOMMODATION RESERVATION SERVICES,BORACAY-AKLAN,MALAY,"BRGY. BALABAG, MALAY, AKLAN",9776064195,,10/31/2026
REGION 6,Mabuhay Accommodation,DOT-R06-MAB-01300-2022,DENNIS GUEST HOUSE,BORACAY-AKLAN,MALAY,"BRGY. MANOC-MANOC, BORACAY ISLAND, MALAY, AKLAN",9177992029,,10/31/2026
REGION 6,Mabuhay Accommodation,DOT-R06-MAB-01872-2023,DINIVIEW VILLA RESORT,BORACAY-AKLAN,MALAY,"SITIO DINIWID BALABAG, BORACAY ISLAND, MALAY, AKLAN",9506181131,,10/31/2026
REGION 6,Mabuhay Accommodation,DOT-R06-MAB-01259-2022,DOUBLE DIAMOND INN,BORACAY-AKLAN,MALAY,"STATION 2, D’TALIPAPA, ZONE VI, MANGGAYAD, BRGY. BALABAG,BORACAY ISLAND, MALAY, AKLAN",9812949921,,10/31/2026
REGION 6,Mabuhay Accommodation,DOT-R06-HTL-04159-2025,ECL RESORT HOTEL,BORACAY-AKLAN,MALAY,"STATION 3 MAIN ROAD BRGY. MANOC MANOC, BORACAY ISLAND, MALAY, AKLAN",(036)2886352/09176246471,,10/31/2026
REGION 6,Mabuhay Accommodation,DOT-R06-MAB-01413-2022,EL CENTRO BEACH RESORT INC.,BORACAY-AKLAN,MALAY,"ZONE 7, SITIO MANGAYAD, BRGY. BALABAG, BORACAY ISLAND, MALAY, AKLAN",036 288 3382,,10/31/2026
REGION 6,Mabuhay Accommodation,DOT-R06-MAB-01384-2022,ERIKO'S HOUSE,BORACAY-AKLAN,MALAY,"STATION 2, BRGY. BALABAG, BORACAY ISLAND, MALAY, AKLAN",288-2659,,10/31/2026
REGION 6,Mabuhay Accommodation,DOT-R06-MAB-00016-2021,ESTACIO UNO BORACAY LIFESTYLE RESORT BUILDING B,BORACAY-AKLAN,MALAY,"BRGY. BALABAG, BORACAY ISLAND, MALAY, AKLAN",0917-920-6519,,10/31/2026
REGION 6,Mabuhay Accommodation,DOT-R06-MAB-01371-2022,FAITH VILLAGE GARDENS,BORACAY-AKLAN,MALAY,"SITIO AMBULONG, BRGY. MANOC-MANOC, BORACAY ISLAND, MALAY, AKLAN",2885562/09177068894,,10/31/2026
REGION 6,Mabuhay Accommodation,DOT-R06-MAB-03493-2024,FAT JIMMY'S RESORT BORACAY,BORACAY-AKLAN,MALAY,"0221 BRGY. BALABAG, BORACAY ISLAND, MALAY, AKLAN",9661640953,,10/31/2026
REGION 6,Mabuhay Accommodation,DOT-R06-MAB-03386-2024,FEATHERSTONE APARTMENT,BORACAY-AKLAN,MALAY,"139 ZONE 1, BRGY. YAPAK, BORACAY ISLAND, MALAY, AKLAN",0921-234-6765,,10/31/2026
REGION 6,Mabuhay Accommodation,DOT-R06-MAB-03839-2025,FELINESS RESORT,BORACAY-AKLAN,MALAY,"SITIO TAMBISAAN, BRGY. MANOC-MANOC, BORACAY ISLAND, MALAY, AKLAN",9994341406,,10/31/2026
REGION 6,Mabuhay Accommodation,DOT-R06-MAB-01385-2022,FIESTA HAUS RESORT,BORACAY-AKLAN,MALAY,"STATION 1, BRGY. BALABAG, BORACAY ISLAND, MALAY, AKLAN",0945-883-9820,,10/31/2026
REGION 6,Mabuhay Accommodation,DOT-R06-MAB-03844-2025,FLORESSENCE APARTMENT,BORACAY-AKLAN,MALAY,"UNIT 4F-M CLUSTER A, OCEAN GARDEN VILLAS, NEWCOAST DRIVE, BORACAY, BRGY.YAPAK, MALAY, AKLAN",0910-701-2808,,10/31/2026
REGION 6,Mabuhay Accommodation,DOT-R06-MAB-03517-2024,FRENDZ BORACAY HOSTEL,BORACAY-AKLAN,MALAY,"BRGY. BALABAG, BORACAY ISLAND, MALAY, AKLAN",9173248181,,10/31/2026
REGION 6,Mabuhay Accommodation,DOT-R06-MAB-03898-2025,GIULIUS BORACAY ITALIAN RESORT,BORACAY-AKLAN,MALAY,"BRGY.BALABAG, BORACAY ISLAND,STATION 2, MALAY, AKLAN",9274280063,,10/31/2026
REGION 6,Mabuhay Accommodation,DOT-R06-MAB-03598-2024,GRAND BLUE BEACH HOTEL,BORACAY-AKLAN,MALAY,"SITIO ANGOL, STATION 3, BRGY. MANOC-MANOC, BORACAY ISLAND, MALAY, AKLAN",9175256268,,10/31/2026
REGION 6,Mabuhay Accommodation,DOT-R06-MAB-01184-2022,GREENYARD INN,BORACAY-AKLAN,MALAY,"SITIO ANGOL, BRGY. MANOC-MANOC, BORACAY ISLAND, MALAY, AKLAN",9850821245,,10/31/2026
REGION 6,Mabuhay Accommodation,DOT-R06-MAB-03345-2024,GROSPE RESORT BORACAY,BORACAY-AKLAN,MALAY,"3687 AMBULONG ROAD, BRGY. MANOC-MANOC, BORACAY ISLAND, MALAY, AKLAN",9475639984,,10/31/2026
REGION 6,Mabuhay Accommodation,DOT-R06-MAB-01856-2023,GUMAMELA RESORT-BRANCH 1 BOLABOG,BORACAY-AKLAN,MALAY,"ZONE V, SITIO BOLABOG, BRGY. BALABAG, BORACAY ISLAND, MALAY, AKLAN",0905 363 5412,,10/31/2026
REGION 6,Mabuhay Accommodation,DOT-R06-MAB-01506-2022,HAPPY'S HOMESTAY,BORACAY-AKLAN,MALAY,"TAMBISAAN BEACH BRGY. MANOC-MANOC, BORACAY ISLAND, MALAY, AKLAN",2882824,,10/31/2026
REGION 6,Mabuhay Accommodation,DOT-R06-MAB-00464-2021,HARLAN BEACH VILLA BORACAY,BORACAY-AKLAN,MALAY,"ZONE 3 PINAUNGON BRGY. BALABAG, BORACAY ISLAND, MALAY, AKLAN",036-2885401,,10/31/2026
REGION 6,Mabuhay Accommodation,DOT-R06-MAB-02613-2024,HEYJUDE BULABOG HOUSE RENTAL,BORACAY-AKLAN,MALAY,"RD1-A BOLABOG, BRGY. BALABAG, BORACAY ISLAND, MALAY, AKLAN",9688812112,,10/31/2026
REGION 6,Mabuhay Accommodation,DOT-R06-MAB-00113-2021,INDILA BORACAY RESORT,BORACAY-AKLAN,MALAY,"ZONE 7, SITIO MANGGAYAD, BRGY. BALABAG, BORACAY ISLAND, MALAY, AKLAN",9850797063,,10/31/2026
REGION 6,Mabuhay Accommodation,DOT-R06-MAB-03739-2025,ISLA DEL MAR BEACH HOTEL,BORACAY-AKLAN,MALAY,"STATION 1, BRGY. BALABAG, BORACAY ISLAND, MALAY, AKLAN",(036) 288-6797/0977-846-5791,,10/31/2026
REGION 6,Mabuhay Accommodation,DOT-R06-MAB-01395-2022,ISLA GECKO RESORT,BORACAY-AKLAN,MALAY,"0224 STATION 2, BRGY. BALABAG, BORACAY ISLAND, MALAY, AKLAN",9177750445,,10/31/2026
REGION 6,Mabuhay Accommodation,DOT-R06-MAB-01253-2022,ISLAND INN,BORACAY-AKLAN,MALAY,"STATION 2, BRGY. BALABAG, BORACAY ISLAND, MALAY, AKLAN",0920-478-3002,,10/31/2026
REGION 6,Mabuhay Accommodation,DOT-R06-MAB-03109-2024,ISLAND VIEWPOINT PLACE,BORACAY-AKLAN,MALAY,"SITIO BANTOD, BRGY. MANOC-MANOC, BORACAY ISLAND, MALAY, AKLAN",9171226178,,10/31/2026
REGION 6,Mabuhay Accommodation,DOT-R06-MAB-01223-2022,JEFFREY S HOTEL,BORACAY-AKLAN,MALAY,"BOLABOG RAOD, BRGY. BALABAG, BORACAY ISLAND, MALAY, AKLAN",0929-389-1540,,10/31/2026
REGION 6,Mabuhay Accommodation,DOT-R06-MAB-01414-2022,JEROME BUNGALOW,BORACAY-AKLAN,MALAY,"1179 MANGGAYAD, BALABAG, BORACAY ISLAND, MALAY, AKLAN",(036) 288-3363; 288-9428; 288-9429,,10/31/2026
REGION 6,Mabuhay Accommodation,DOT-R06-MAB-01643-2023,JINJIANG INN BORACAY/MILFLORES DE BORACAY CORP.,BORACAY-AKLAN,MALAY,"STATION 1, BRGY. BALABAG, BORACAY ISLAND, MALAY, AKLAN",9630359891,,10/31/2026
REGION 6,Mabuhay Accommodation,DOT-R06-MAB-03616-2024,KAIYANA BORACAY BEACH RESORT,BORACAY-AKLAN,MALAY,"BRGY. MANOC-MANOC, BORACAY ISLAND, MALAY, AKLAN",09177077927/09177171179,,10/31/2026
REGION 6,Mabuhay Accommodation,DOT-R06-MAB-03546-2024,KALAMANSI HOUSE AND VILLAS,BORACAY-AKLAN,MALAY,"DINIWID HILLS, SITIO HAGDAN, BRGY. YAPAK, BORACAY ISLAND, MALAY, AKLAN",0907-070-2914,,10/31/2026
REGION 6,Mabuhay Accommodation,DOT-R06-MAB-02146-2023,KV PROPERTY SERVICES,BORACAY-AKLAN,MALAY,"SITIO ANGOL, BRGY. MANOC-MANOC, BORACAY ISLAND, MALAY, AKLAN",0949-338-2262,,10/31/2026
REGION 6,Mabuhay Accommodation,DOT-R06-MAB-03837-2025,L' FAMILI HOTEL,BORACAY-AKLAN,MALAY,"ZONE 7, SITIO MANGGAYAD, BRGY.BALABAG, MALAY, AKLAN",2881363,,10/31/2026
REGION 6,Mabuhay Accommodation,DOT-R06-MAB-00041-2021,LA BELLA CASA DE BORACAY,BORACAY-AKLAN,MALAY,"ZONE 4 BRGY. BALABAG, BORACAY ISLAND, MALAY, AKLAN",036 288 3818 / 09994341406,,10/31/2026
REGION 6,Mabuhay Accommodation,DOT-R06-MAB-01227-2022,LA FIESTA RESORT,BORACAY-AKLAN,MALAY,"STATION 1, BRGY. BALABAG, BORACAY ISLAND, MALAY, AKLAN",036 288 3501,,10/31/2026
REGION 6,Mabuhay Accommodation,DOT-R06-MAB-01415-2022,LA ISLA BONITA RESORT,BORACAY-AKLAN,MALAY,"BOAT STATION 3, BRGY. MANOC-MANOC, BORACAY ISLAND, MALAY, AKLAN",036 288 3501,,10/31/2026
REGION 6,Mabuhay Accommodation,DOT-R06-MAB-01415-2022,LA ISLA BONITA RESORT,BORACAY-AKLAN,MALAY,"BOAT STATION 3, BRGY. MANOC-MANOC, BORACAY ISLAND, MALAY, AKLAN",0919-293-8477,,10/31/2026
REGION 6,Mabuhay Accommodation,DOT-R06-MAB-03511-2024,LADY JEAN RESORT,BORACAY-AKLAN,MALAY,"02433 ZONE 6, SITIO MANGGAYAD, BRGY. BALABAG, BORACAY ISLAND, MALAY, AKLAN",9291541533,,10/31/2026
REGION 6,Mabuhay Accommodation,DOT-R06-MAB-03397-2024,LANTERNA HOTEL,BORACAY-AKLAN,MALAY,"ZONE V, BOLABOG ROAD, BRGY. BALABAG, BORACAY ISLAND, MALAY, AKLAN",09437312214 / (036) 2882663,,10/31/2026
REGION 6,Mabuhay Accommodation,DOT-R06-MAB-00101-2021,LES PROPRIETES INC./AGOS BORACAY ROOMS + BEDS,BORACAY-AKLAN,MALAY,"MAIN ROAD, STATION 2, BRGY. BALABAG, BORACAY ISLAND, MALAY, AKLAN",9291936441,,10/31/2026
REGION 6,Mabuhay Accommodation,DOT-R06-MAB-01751-2023,LILYVILLE LODGE,BORACAY-AKLAN,MALAY,"SITIO ANGOL, BRGY. MANOC-MANOC, BORACAY ISLAND, MALAY, AKLAN",,,10/31/2026
REGION 6,Mabuhay Accommodation,DOT-R06-MAB-01426-2022,LIME HOTEL BORACAY,BORACAY-AKLAN,MALAY,"SITIO MANGGAYAD, BRGY. BALABAG, BORACAY ISLAND, MALAY, AKLAN",0933-866-3485-0999-819-3211,,10/31/2026
REGION 6,Mabuhay Accommodation,DOT-R06-MAB-03393-2024,LM-BORACAY APARTELLE,BORACAY-AKLAN,MALAY,"SITIO TAMBISAAN, BRGY. MANOC-MANOC, BORACAY ISLAND, MALAY, AKLAN",9291232259,,10/31/2026
REGION 6,Mabuhay Accommodation,DOT-R06-MAB-01305-2022,LOLA'S LODGE,BORACAY-AKLAN,MALAY,"D’MALL, BRGY. BALABAG, BORACAY ISLAND, MALAY, AKLAN",929 425 6553,,10/31/2026
REGION 6,Mabuhay Accommodation,DOT-R06-MAB-01416-2022,LUCKY SIX PENSION HOUSE,BORACAY-AKLAN,MALAY,"SITIO ANGOL BRGY, MANOC-MANOC, BORACAY ISLAND, MALAY, AKLAN",(036) 288- 3241,,10/31/2026
REGION 6,Mabuhay Accommodation,DOT-R06-MAB-00005-2021,M & E GUESTHOUSE,BORACAY-AKLAN,MALAY,"STATION 3, SITIO AMBULONG, BRGY. MANOC-MANOC, BORACAY ISLAND, MALAY, AKLAN",9563341093,,10/31/2026
REGION 6,Mabuhay Accommodation,DOT-R06-MAB-02149-2023,MAGARBO HOTEL,BORACAY-AKLAN,MALAY,"STATION 2, BRGY. BALABAG, BORACAY ISLAND, MALAY, AKLAN",9778235406,,10/31/2026
REGION 6,Mabuhay Accommodation,DOT-R06-MAB-01207-2022,"MARGARETTA LANE PROPERTIES, INC.",BORACAY-AKLAN,MALAY,"DINIWID HILLS, SITIO HAGDAN, BRGY. YAPAK, BORACAY ISLAND, MALAY, AKLAN",9185042592,,10/31/2026
REGION 6,Mabuhay Accommodation,DOT-R06-MAB-03621-2024,MARNIN'S PLACE,BORACAY-AKLAN,MALAY,"SITIO TAMBISAAN, BRGY. MANOC-MANOC, BORACAY ISLAND, MALAY, AKLAN",(036) 288-3131 / 09514285116,,10/31/2026
REGION 6,Mabuhay Accommodation,DOT-R06-MAB-01024-2022,MARZON BEACH RESORT,BORACAY-AKLAN,MALAY,"SITIO ANGOL, BRGY. MANOC-MANOC, BORACAY ISLAND, MALAY, AKLAN",9475312000,,10/31/2026
REGION 6,Mabuhay Accommodation,DOT-R06-MAB-01507-2022,MECASA HOTEL & SPA CORP,BORACAY-AKLAN,MALAY,"MECASA HOTEL, 1A BOLABOG BRGY. BALABAG, MALAY, AKLAN",9690340309,,10/31/2026
REGION 6,Mabuhay Accommodation,DOT-R06-MAB-01425-2022,MIRAGE SUITES DE BORACAY,BORACAY-AKLAN,MALAY,"STATION 2, ZONE 7, SITIO MANGGAYAD, BRGY. BALABAG, BORACAY ISLAND, MALAY, AKLAN",288-9721,,10/31/2026
REGION 6,Mabuhay Accommodation,DOT-R06-MAB-03398-2024,MONALLAN BORACAY HOTEL INC.,BORACAY-AKLAN,MALAY,"SITIO AMBULONG, BRGY. MANOC-MANOC, BORACAY ISLAND, MALAY, AKLAN",0912-870-0769,,10/31/2026
REGION 6,Mabuhay Accommodation,DOT-R06-MAB-03836-2025,MOONLIGHT BREEZE INN,BORACAY-AKLAN,MALAY,"SITIO ANGOL ROAD, BRGY.MANOC MANOC, MALAY AKLAN",9100391691,,10/31/2026
REGION 6,Mabuhay Accommodation,DOT-R06-MAB-03624-2024,MORENOS COTTAGES,BORACAY-AKLAN,MALAY,"SITIO AMBULONG, BRGY. MANOC-MANOC, BORACAY ISLAND, MALAY, AKLAN",(036) 288-1829,,10/31/2026
REGION 6,Mabuhay Accommodation,DOT-R06-MAB-01955-2023,NIGI NIGI TOO BEACH RESORT,BORACAY-AKLAN,MALAY,"SITIO MANGGAYAD BRGY. BALABAG BORACAY MALAY, AKLAN",0933-468-2377,,10/31/2026
REGION 6,Mabuhay Accommodation,DOT-R06-MAB-01584-2022,OCEAN BREEZE INN,BORACAY-AKLAN,MALAY,"0864 SITIO AMBULONG, BRGY. MANOC-MANOC, BORACAY ISLAND, MALAY, AKLAN",9695859509,,10/31/2026
REGION 6,Mabuhay Accommodation,DOT-R06-MAB-01047-2022,"OCEANWAY SUITES B3FJ, OPC",BORACAY-AKLAN,MALAY,"UNIT 3J, CLUSTER B, OCEANWAY RESIDENCES, BRGY. YAPAK, BORACAY ISLAND, MALAY, AKLAN",362885429,,10/31/2026
REGION 6,Mabuhay Accommodation,DOT-R06-MAB-01243-2022,ONE CRESCENT PLACE,BORACAY-AKLAN,MALAY,"STATION 1, BRGY. BALABAG, BORACAY ISLAND, MALAY, AKLAN",9088867724,,10/31/2026
REGION 6,Mabuhay Accommodation,DOT-R06-MAB-01343-2022,PALASSA PRIVATE RESIDENCES,BORACAY-AKLAN,MALAY,"PALASSA PRIVATE RESIDENCES, SITIO BOLABOG, BRGY. BALABAG , BORACAY ISLAND, MALAY, AKLAN",9758944260,,10/31/2026
REGION 6,Mabuhay Accommodation,DOT-R06-MAB-01972-2023,PEREZ CABRERA APARTMENT,BORACAY-AKLAN,MALAY,"ZONE V, SITIO BOLABOG, BGY. BALABAG, BORACAY ISLAND, MALAY, AKLAN",9989038169,,10/31/2026
REGION 6,Mabuhay Accommodation,DOT-R06-MAB-03954-2025,RESIDENCIA DELA TORRE,BORACAY-AKLAN,MALAY,"SITIO KIPOT, MANOCMANOC, BORACAY ISLAND, MALAY, AKLAN",9270395367,,10/31/2026
REGION 6,Mabuhay Accommodation,DOT-R06-MAB-03624-2024,REYNACIDO INN,BORACAY-AKLAN,MALAY,"CAGBAN BOBON ZONE 1, BRGY. MANOCMANOC, BORACAY ISLAND MALAY, AKLAN",0936-958-4733,,10/31/2026
REGION 6,Mabuhay Accommodation,DOT-R06-MAB-02056-2023,ROGER'S PLACE GUESTHOUSE-BORACAY,BORACAY-AKLAN,MALAY,"0689, ZONE 1, BANTUD PROPER, BRGY. MANOC-MANOC, BORACAY ISLAND, MALAY, AKLAN",936 500 0436,,10/31/2026
REGION 6,Mabuhay Accommodation,DOT-R06-MAB-01225-2022,RONALD APARTMENT,BORACAY-AKLAN,MALAY,"GREENPOINT RESIDENCES, ANGOL ROAD, BRGY. MANOC-MANOC, BORACAY ISLAND, MALAY, AKLAN",0977-819-8742/0964-925-7688,,10/31/2026
REGION 6,Mabuhay Accommodation,DOT-R06-MAB-03029-2024,SAMTHING GUEST HOUSE,BORACAY-AKLAN,MALAY,"ROOM 205 DANTE'S HIDEAWAY, SITIO ANGOL, BRGY. MANOC MANOC, BORACAY ISLAND, MALAY, AKLAN",9190838562,,10/31/2026
REGION 6,Mabuhay Accommodation,DOT-R06-MAB-00588-2022,"SANITARY CARE PRODUCTS ASIA, INC. - APARTELLE",BORACAY-AKLAN,MALAY,"SITIO BANTUD, BRGY. MANOC-MANOC, BORACAY ISLAND, MALAY, AKLAN",9175289492,,10/31/2026
REGION 6,Mabuhay Accommodation,DOT-R06-MAB-00418-2021,SECRET GARDEN RESIDENTIAL APARTMENT RENTAL,BORACAY-AKLAN,MALAY,"SITIO BOLABOG, BRGY. BALABAG, BORACAY ISLAND, MALAY, AKLAN",036 288 4888,,10/31/2026
REGION 6,Mabuhay Accommodation,DOT-R06-MAB-00586-2022,SERENE LA PLAYA,BORACAY-AKLAN,MALAY,"BORACAY ISLAND BRGY. BALABAG, MALAY, AKLAN",(036) 288-6120,,10/31/2026
REGION 6,Mabuhay Accommodation,DOT-R06-MAB-01801-2023,SHENNA'S BEACH RESORT - MAIN,BORACAY-AKLAN,MALAY,"STATION 2, BRGY. BALABAG, BORACAY ISLAND, MALAY, AKLAN",9178461746,,10/31/2026
REGION 6,Mabuhay Accommodation,DOT-R06-MAB-03383-2024,SHORE TIME HOTEL CORPORATION-DORMITEL,BORACAY-AKLAN,MALAY,"SITIO CAGBAN, BRGY. MANOC-MANOC, BORACAY ISLAND, MALAY, AKLAN",362889477,,10/31/2026
REGION 6,Mabuhay Accommodation,DOT-R06-MAB-03396-2024,SIGNATURE BORACAY BLUE,BORACAY-AKLAN,MALAY,"SITIO ANGOL, BRGY. MANOC-MANOC, BORACAY ISLAND, MALAY, AKLAN",(036)288-6740,,10/31/2026
REGION 6,Mabuhay Accommodation,DOT-R06-MAB-01516-2022,SIGNATURE HOTELS CORPORATION-SIGNATURE BORACAY PUNTA ROSA,BORACAY-AKLAN,MALAY,"SITIO PINAUNGON, BRGY. BALABAG, BORACAY ISLAND, MALAY, AKLAN",288 34 00,,10/31/2026
REGION 6,Mabuhay Accommodation,DOT-R06-MAB-00854-2022,SULU PLAZA LODGE,BORACAY-AKLAN,MALAY,"AMBULONG STATION 3, BRGY, MANOC MANOC, MALAY, AKLAN",362889907,,10/31/2026
REGION 6,Mabuhay Accommodation,DOT-R06-MAB-02286-2024,SUNSHINE'S RESORT,BORACAY-AKLAN,MALAY,"BRGY. BALABAG, BORACAY ISLAND, MALAY, AKLAN",0929-600-9863,,10/31/2026
REGION 6,Mabuhay Accommodation,DOT-R06-MAB-00824-2022,SUNVILLA BEACHFRONT HOTEL,BORACAY-AKLAN,MALAY,"STATION 1, BRGY. BALABAG, BORACAY ISLAND, MALAY, AKLAN",9198202922,,10/31/2026
REGION 6,Mabuhay Accommodation,DOT-R06-MAB-01228-2022,SWAHILI APARTELLE,BORACAY-AKLAN,MALAY,"BRGY. BALABAG, BORACAY ISLAND, MALAY, AKLAN",9812953387,,10/31/2026
REGION 6,Mabuhay Accommodation,DOT-R06-MAB-02019-2023,THE CENTRAL INN BORACAY ISLAND,BORACAY-AKLAN,MALAY,"BRGY. BALABAG, BORACAY ISLAND, MALAY, AKLAN",9177008571,,10/31/2026
REGION 6,Mabuhay Accommodation,DOT-R06-MAB-01421-2022,THE LAZY DOG BED AND BREAKFAST/THE LAZY DOG COTTAGES,BORACAY-AKLAN,MALAY,"SITIO BOLABOG, BRGY. BALABAG, BORACAY ISLAND, MALAY, AKLAN",9209723346,,10/31/2026
REGION 6,Mabuhay Accommodation,DOT-R06-MAB-00330-2021,THE ORIENT BEACH BORACAY INC.,BORACAY-AKLAN,MALAY,"SITIO HAGDAN, BRGY. YAPAK, BORACAY ISLAND, MALAY, AKLAN",(036) 288-3300,,10/31/2026
REGION 6,Mabuhay Accommodation,DOT-R06-MAB-00785-2022,THE PARAGON BORACAY SUITES,BORACAY-AKLAN,MALAY,"AMBULONG ROAD, STATION 3, BRGY. MANOC-MANOC, BORACAY ISLAND, MALAY, AKLAN",9613884087,,10/31/2026
REGION 6,Mabuhay Accommodation,DOT-R06-MAB-00042-2021,TITA MAGZ INN,BORACAY-AKLAN,MALAY,"SITIO AMBULONG, BRGY. MANOC-MANOC, BORACAY ISLAND, MALAY, AKLAN",9209019629,,10/31/2026
REGION 6,Mabuhay Accommodation,DOT-R06-MAB-00270-2021,TROPICANA OCEAN VILLAS,BORACAY-AKLAN,MALAY,"SITIO DINIWID, BRGY. BALABAG, BORACAY ISLAND, MALAY AKLAN",2883784,,10/31/2026
REGION 6,Mabuhay Accommodation,DOT-R06-MAB-01753-2023,"TRUE HOME HOTEL, INC.",BORACAY-AKLAN,MALAY,"BRGY. BALABAG, BORACAY ISLAND, MALAY, AKLAN",9362884206,,10/31/2026
REGION 6,Mabuhay Accommodation,DOT-R06-MAB-03264-2024,TURTLE INN RESORT,BORACAY-AKLAN,MALAY,"STATION 3, SITIO AMBULONG, BRGY. MANOC-MANOC, BORACAY ISLAND, MALAY, AKLAN",9150222304,,10/31/2026
REGION 6,Mabuhay Accommodation,DOT-R06-MAB-01469-2022,TWIN AP HOMES,BORACAY-AKLAN,MALAY,"0857, APO COMPOUND, SITIO SINAGPA, BRGY. BALABAG, BORACAY ISLAND, MALAY, AKLAN",9991590238,,10/31/2026
REGION 6,Mabuhay Accommodation,DOT-R06-MAB-01420-2022,VICENTE AGUIRRE COTTAGES,BORACAY-AKLAN,MALAY,"ZONE 7, ST. VICENTE COMPOUND, BRGY. MANOC-MANOC, BORACAY ISLAND, MALAY, AKLAN",0949-673-7772,,10/31/2026
REGION 6,Mabuhay Accommodation,DOT-R06-MAB-01255-2022,VILLA AMBRIA,BORACAY-AKLAN,MALAY,"693 BUKID WAY, SITIO DINIWID, BRGY. BALABAG, BORACAY ISLAND, MALAY, AKLAN",(036) 288-4421,,10/31/2026
REGION 6,Mabuhay Accommodation,DOT-R06-MAB-01683-2023,VILLA ROMERO DE BORACAY,BORACAY-AKLAN,MALAY,"STATION 3, BRGY. MANOC-MANOC, BORACAY ISLAND, MALAY, AKLAN",(036) 288-5666,,10/31/2026
REGION 6,Mabuhay Accommodation,DOT-R06-MAB-00499-2021,VILLA SUNSET BORACAY INC.,BORACAY-AKLAN,MALAY,"SITIO MANGGAYAD, BRGY. BALABAG, BORACAY ISLAND, MALAY, AKLAN",9984234650,,10/31/2026
REGION 6,Mabuhay Accommodation,DOT-R06-MAB-01418-2022,WENDYS APARTELLE / WENDYS BAR & RESTAURANT,BORACAY-AKLAN,MALAY,"BUKID TALIPAPA, SITIO MANGGAYAD, STATION 3, BRGY. MANOC-MANOC, BORACAY ISLAND, MALAY, AKLAN",362886103,,10/31/2026
REGION 6,Mabuhay Accommodation,DOT-R06-MAB-01391-2022,WHITE BEACH DE BORACAY,BORACAY-AKLAN,MALAY,"ZONE 6, STATION 1, BRGY. BALABAG, BORACAY ISLAND, MALAY, AKLAN",0961-794-6986,,10/31/2026
REGION 6,Mabuhay Accommodation,DOT-R06-MAB-03691-2025,WHITEBEACH DE BORACAY STATION1 EXTENSION HOTEL,BORACAY-AKLAN,MALAY,"BRGY. BALABAG, BORACAY ISLAND, MALAY, AKLAN",0919-820-2922,,10/31/2026
REGION 6,Mabuhay Accommodation,DOT-R06-MAB-00784-2022,WIND RIDERS INN RESORT,BORACAY-AKLAN,MALAY,"SITIO BOLABOG, BRGY. BALABAG, BORACAY ISLAND, MALAY, AKLAN",036 288 4477,,10/31/2026
REGION 6,Mabuhay Accommodation,DOT-R06-MAB-01444-2022,ZUZUNI BOUTIQUE HOTEL (GIPSEA INC.),BORACAY-AKLAN,MALAY,"ZUZUNI BOUTIQUE HOTEL FRONT BEACH STATION 1, BRGY.BALABAG, BORACAY ISLAND MALAY, AKLAN",9398044631,,10/31/2026
REGION 6,Mabuhay Accommodation,DOT-R06-MAB-01329-2022,ROYAL RIDGE RESIDENCE INN,BORACAY-AKLAN,MALAY,"SITIO BOLABOG, BRGY. BALABAG, BORACAY ISLAND, MALAY, AKLAN",9052116181,,10/31/2026
REGION 6,Mabuhay Accommodation,DOT-R06-MAB-04224-2025,BORACAY COCO HUTS,BORACAY-AKLAN,MALAY,"ZONE VI- BALABAG EXTENSION, BRGY. BALABAG, BORACAY ISLAND, MALAY, AKLAN",9273475538,,10/31/2026
REGION 6,Mabuhay Accommodation,DOT-R06-MAB-00031-2021,MORENO'S LODGING,BORACAY-AKLAN,MALAY,"STATION 3 AMBULONG, BRGY. MANOCMANOC, BORACAY ISLAND, MALAY, AKLAN",,,10/31/2026
,​,,,,,,,,
REGION 6,Homestay,DOT-R06-HMY-02618-2024,4J'S MINI INN,ANTIQUE,LIBERTAD,"NATIONAL ROAD, BRGY. CENTRO WESTE (POB.), LIBERTAD, ANTIQUE",0963-663-7309,,10/31/2026
REGION 6,Homestay,DOT-R06-HMY-02817-2024,GRJ HOMESTAY,ANTIQUE,LIBERTAD,"CORNER NATIONAL ROAD AND QUEZON STREET, BRGY. CENTRO WESTE (POB.) LIBERTAD, ANTIQUE",9857896693,,10/31/2026
REGION 6,Homestay,DOT-R06-HMY-03282-2024,OCEANVILLE HOMESTAY,GUIMARAS,NUEVA VALENCIA,"SITIO BAYBAY, BRGY. CABALAGNAN, NUEVA VALENCIA, GUIMARAS",9209284852,,10/31/2026
REGION 6,Homestay,DOT-R06-HMY-02619-2024,SG ANCESTRAL HOMESTAY,ANTIQUE,LIBERTAD,"SUGAR STREET, BRGY. CENTRO ESTE (POB.), LIBERTAD, ANTIQUE",9562634207,,10/31/2026
,​,,,,,,,,
REGION 6,Apartment Hotel,DOT-R06-APT-01762-2023,ARGONAUTA BORACAY,BORACAY-AKLAN,MALAY,"272 SITIO HAGDAN, BRGY. YAPAK, BORACAY ISLAND, MALAY, AKLAN",0917-678-2746,,10/31/2026
REGION 6,Apartment Hotel,DOT-R06-APT-00585-2022,AZALEA HOTELS & RESIDENCES BORACAY,BORACAY-AKLAN,MALAY,"ROAD C, ZONE 7, SITIO MANGGAYAD, BRGY. BALABAG, BORACAY ISLAND, MALAY, AKLAN",(036) 288-1144,,10/31/2026
,,,(8990 LEISURE AND RESORTS CORPORATION),,,,,,
REGION 6,Apartment Hotel,DOT-R06-APT-01813-2023,BORACAY AMOR APARTMENTS,BORACAY-AKLAN,MALAY,"SITIO DINIWID, BRGY. BALABAG, BORACAY ISLAND, MALAY, AKLAN",0968-800-0074,,10/31/2026
REGION 6,Apartment Hotel,DOT-R06-APT-00154-2021,E & F CONDOTEL,AKLAN,KALIBO,"318, MAGDALENA VILLAGE, BRGY. NEW BUSWANG, KALIBO, AKLAN",036 500 6778,,10/31/2026
REGION 6,Apartment Hotel,DOT-R06-APT-03756-2025,ROYAL PALAZZO ITALIAN APARTMENTS,BORACAY-AKLAN,MALAY,"BUKID WAY, SITIO DINIWID, BRGY. BALABAG, BORACAY ISLAND, MALAY, AKLAN",0956-058-8418,,10/31/2026
REGION 6,Apartment Hotel,DOT-R06-APT-00507-2021,SCANDI BORACAY,BORACAY-AKLAN,MALAY,"0179 ZONE V, SITIO BOLABOG, BRGY. BALABAG, BORACAY ISLAND, MALAY, AKLAN",(036) 288-5412,,10/31/2026
REGION 6,Apartment Hotel,DOT-R06-APT-00356-2021,UNDER THE STARS LUXURY APARTMENTS,BORACAY-AKLAN,MALAY,"SITIO TAMBISAAN, BRGY. MANOC-MANOC, BORACAY ISLAND, MALAY, AKLAN",0917-119-6424,,10/31/2026
,​,,,,,,,,
REGION 6,MICE Organizer,DOT-R06-MCO-03079-2024,PASSION 8 EVENTS AND SERVICES,ILOILO CITY,ILOILO CITY,"5931 DEMOCRACIA STREET, BRGY. MARIA CRISTINA, JARO, ILOILO CITY",0998-372-9433,,6/30/2026
REGION 6,MICE Organizer,DOT-R06-MCO-03368-2024,SEJOUR TOURS AND EVENTS,BACOLOD CITY,BACOLOD CITY,"B6 L4 STA. MONICA ST., ERORECO SUBDIVISION, BRGY. MANDALAGAN, BACOLOD CITY",9173231631,,6/30/2026
REGION 6,MICE Organizer,DOT-R06-MCO-01852-2023,T3 CENTRE EVENTS MANAGEMENT SERVICES,BACOLOD CITY,BACOLOD CITY,"L5B7 SAGITTARIUS ST., GREENSVILLE 3, BRGY. VILLAMONTE, BACOLOD CITY",0977-841-0689,,6/30/2026
REGION 6,MICE Organizer,DOT-R06-MCO-00946-2022,THE PERFECTPLANNERS CORP,ILOILO,PAVIA,"2NF FLOOR, TAMAYO BLDG., ZONE 3, BRGY. JIBAO-AN, PAVIA, ILOILO",0917-166-1929,,6/30/2026
,​,,,,,,,,
REGION 6,MICE Venue / Facility,DOT-R06-MCF-03080-2024,CAPITOL CENTRAL COMMERCIAL VENTURES CORP.,BACOLOD CITY,BACOLOD CITY,"3RD FLOOR CAPITOL CENTRAL MALL, CORNER GATUSLAO ST. & NORTH CAPITOL ROAD, BRGY. 8, BACOLOD CITY",(034) 700-7303,,6/30/2026
REGION 6,MICE Venue / Facility,DOT-R06-MCF-01134-2022,CIRCULO CONVENTION CENTER,CAPIZ,ROXAS CITY,"CIRCULO HILL COMPLEX, PUEBLO DE PANAY TOWNSHIP, BRGY. DINGINAN, ROXAS CITY, CAPIZ",0917-312-1498,,6/30/2026
REGION 6,MICE Venue / Facility,DOT-R06-MCF-04097-2025,CORAL BALLROOM (CRIMSON RESORT & SPA BORACAY),BORACAY-AKLAN,MALAY,"PUNTA BUNGA COVE., HAGDAN, BRGY. YAPAK, BORACAY ISLAND, MALAY, AKLAN",(036) 669 5888,,6/30/2026
REGION 6,MICE Venue / Facility,DOT-R06-MCF-00405-2021,ILOILO CONVENTION CENTER,ILOILO CITY,ILOILO CITY,"MEGAWORLD BLVD., BRGY. AIRPORT (TABUCAN AIRPORT), MADURRIAO, ILOILO CITY",(033) 335-117 to 76,,6/30/2026
REGION 6,MICE Venue / Facility,DOT-R06-MCF-03974-2025,KYLA'S EVENT HALL EVENTS PLACE RENTAL,NEGROS OCCIDENTAL,SIPALAY CITY,"PUROK 3, BRGY. 2 (POB.), SIPALAY CITY, NEGROS OCCIDENTAL",9684454783,,6/30/2026
