Region,Enterprise Type,Accreditation No,Enterprise Name,Province,Municipality,Business Address,Contact Numbers,Business Website,Accreditation Validity
REGION 6,Mabuhay Accommodation,DOT-R06-MAB-00762-2022,ANYAS BUROBANGLID RESORT,ANTIQUE,SEBASTE,"BRGY. CALLAN, SEBASTE, ANTIQUE",9206316066,,10/31/2026
REGION 6,Mabuhay Accommodation,DOT-R06-MAB-02681-2024,AQUATICO BEACH RESORT,NEGROS OCCIDENTAL,HIMAMAYLAN,"BRGY. TALABAN, HIMAMAYLAN CITY, NEGROS OCCIDENTAL",9985649239,,10/31/2026
REGION 6,Mabuhay Accommodation,DOT-R06-MAB-01775-2023,ARANAS-CARILLO TRAVELLERS INN,AKLAN,KALIBO,"REGINO - ROLDAN STREETS, BRGY. POBLACION, KALIBO, AKLAN",9686319371,,10/31/2026
REGION 6,Mabuhay Accommodation,DOT-R06-MAB-00156-2021,AROMAHAN BEACH RESORT,AKLAN,BATAN,"BRGY. NAPTI, BATAN, AKLAN",,,10/31/2026
REGION 6,Mabuhay Accommodation,DOT-R06-MAB-00001-2021,ASIA NOVO BOUTIQUE HOTEL INC.,AKLAN,KALIBO,"TOTING REYES ST., BRGY. NEW BUSWANG, KALIBO, AKLAN",9163491332,,10/31/2026
REGION 6,Mabuhay Accommodation,DOT-R06-MAB-00786-2022,ASIA NOVO BOUTIQUE HOTEL INC.,CAPIZ,ROXAS CITY,"BLVD. COR. MABINI ST., BRGY. INZO ARNALDO VILLAGE (CADIMAHAN), ROXAS CITY, CAPIZ",9984357806,,10/31/2026
REGION 6,Mabuhay Accommodation,DOT-R06-MAB-00482-2021,AVENUE 5 HOTEL,AKLAN,KALIBO,"3RD FLOOR LU BLDG., ROXAS AVENUE, BRGY. POBLACION, KALIBO, AKLAN",9297041788,,10/31/2026
REGION 6,Mabuhay Accommodation,DOT-R06-MAB-04180-2025,AYFARM ACCOMMODATION RESERVATION SERVICES,ILOILO,OTON,"BRGY. TAGBAC SUR, OTON, ILOILO",0925-863-9046,,10/31/2026
REGION 6,Mabuhay Accommodation,DOT-R06-MAB-01849-2023,B.C. PENSION AND LEASING CORP.,NEGROS OCCIDENTAL,CADIZ CITY,"VILLENA STREET, BRGY. 3 POB. (ZONE 3), CADIZ CITY, NEGROS OCCIDENTAL",945803917,,10/31/2026
REGION 6,Mabuhay Accommodation,DOT-R06-MAB-04021-2025,BADIANGO ISLAND RESORT,ILOILO,CONCEPCION,"SITIO DANAO-DANAO BRGY. POLOPINA, CONCEPCION, ILOILO",0917-1462525,,10/31/2026
REGION 6,Mabuhay Accommodation,DOT-R06-MAB-00829-2022,BALAY 8 SUITES,NEGROS OCCIDENTAL,SILAY CITY,"DR. JOSE LOCSIN ST, BRGY. V (POB.), SILAY CITY, NEGROS OCCIDENTAL",(00)454-0313,,10/31/2026
REGION 6,Mabuhay Accommodation,DOT-R06-MAB-03105-2024,BALAY KAUSWAGAN TRAINING CENTER,NEGROS OCCIDENTAL,SAGAY CITY,"BRGY. RIZAL, RIZAL, SAGAY CITY. NEGROS OCCIDENTAL",9498139342,,10/31/2026
REGION 6,Mabuhay Accommodation,DOT-R06-MAB-00279-2021,BALDEVIA INTEGRATED RESOURCES INC.,NEGROS OCCIDENTAL,SILAY CITY,"RIZAL-BURGOS ST. BRGY. I (POB), SILAY CITY, NEGROS OCCIDENTAL",(034) 433-8108/460-1621,,10/31/2026
REGION 6,Mabuhay Accommodation,DOT-R06-MAB-03751-2025,BALDEVIA PENSION HOUSE,BACOLOD CITY,BACOLOD CITY,"BALDEVIA BLDG. SAN JUAN CORNER SAN SEBASTIAN STREETS, BRGY. 13 (POB.), BACOLOD CITY",9971851610,,10/31/2026
REGION 6,Mabuhay Accommodation,DOT-R06-MAB-03658-2024,BANGLID II TRAVELLERS INN,ANTIQUE,SAN REMIGIO,"BRGY. ANINGALAN, SAN REMIGIO, ANTIQUE",0967-325-4081 / 467-6978,,10/31/2026
REGION 6,Mabuhay Accommodation,DOT-R06-MAB-00934-2022,BANOOCHES BED AND BREAKFAST CORPORATION,NEGROS OCCIDENTAL,CADIZ CITY,"BLOCK 2 LOT 2 VILLENA ST., BRGY. 2 POB. (ZONE 2), CADIZ CITY, NEGROS OCCIDENTAL",9637490849,,10/31/2026
REGION 6,Mabuhay Accommodation,DOT-R06-MAB-02714-2024,BANTAYAN BEACH RESORT,ILOILO,GUIMBAL,"BRGY. RIZAL-TUGUISAN (POB.), GUIMBAL, ILOILO",9071167566,,10/31/2026
REGION 6,Mabuhay Accommodation,DOT-R06-MAB-00509-2021,BASANGBASA BEACH RESORT,ILOILO,SAN JOAQUIN,"BRGY. AMBOYU-AN, SAN JOAQUIN, ILOILO",0917-865-7279,,10/31/2026
REGION 6,Mabuhay Accommodation,DOT-R06-MAB-01985-2023,BATO BUGTONG BEACH RESORT,ANTIQUE,PATNONGON,"BRGY. IGBARAWAN, PATNONGON, ANTIQUE",0933-810-9588,,10/31/2026
REGION 6,Mabuhay Accommodation,DOT-R06-MAB-01079-2022,BAYLE CAMPING GROUNDS AND MOUNTAIN RESORT,BACOLOD CITY,BACOLOD CITY,"PUROK 11, ALANGILAN, BACOLOD CITY, NEGROS OCCIDENTAL",9778333000,,10/31/2026
REGION 6,Mabuhay Accommodation,DOT-R06-MAB-00611-2022,BED AND BATH SERVICED SUITES,ILOILO CITY,ILOILO CITY,"THE B LIFESTYLE COMPLEX, DIVERSION ROAD, BRGY. CUARTERO, JARO, ILOILO CITY",0930-272-1117/(036)268-3288,,10/31/2026
REGION 6,Mabuhay Accommodation,DOT-R06-MAB-00682-2022,BEE BEE LODGE,AKLAN,KALIBO,"BRGY. BUSWANG OLD, KALIBO, AKLAN",9171784441,,10/31/2026
REGION 6,Mabuhay Accommodation,DOT-R06-MAB-03976-2025,BLOOMVILLE PENSION HOUSE,BACOLOD CITY,BACOLOD CITY,"D-53 NARRA AVE., CAPITOL SHOPPING CENTER, BRGY. VILLAMONTE, BACOLOD CITY",9157142996,,10/31/2026
REGION 6,Mabuhay Accommodation,DOT-R06-MAB-02577-2024,BONISTA BEACH RESORT,NEGROS OCCIDENTAL,ESCALANTE CITY,"SITIO BON-BON 1, BRGY. BUENAVISTA, ESCALANTE CITY, NEGROS OCCIDENTAL",9989242600,,10/31/2026
REGION 6,Mabuhay Accommodation,DOT-R06-MAB-02703-2024,BRO'S BEACH RESORT,NEGROS OCCIDENTAL,SIPALAY CITY,"PUROK KALUBIHAN, BRGY. CARTAGENA, SIPALAY CITY, NEGROS OCCIDENTAL",0999-838-8883,,10/31/2026
REGION 6,Mabuhay Accommodation,DOT-R06-MAB-02708-2024,BUENAVENTURA BEACH RESORT,NEGROS OCCIDENTAL,SIPALAY CITY,"SUGAR BEACH, BRGY. NAUHANG, SIPALAY CITY, NEGROS OCCIDENTAL",0927-821-8445,,10/31/2026
REGION 6,Mabuhay Accommodation,DOT-R06-MAB-01356-2022,"BUNKHAUS BACKPACKERS INN, CORP.",ANTIQUE,SAN JOSE DE BUENAVISTA,"RICARZE ST., BRGY. 7 (POB.), SAN JOSE DE BUENAVISTA, ANTIQUE",0918-957-9699,,10/31/2026
REGION 6,Mabuhay Accommodation,DOT-R06-MAB-03094-2024,C-CHEN BEACH RESORT,NEGROS OCCIDENTAL,SAGAY CITY,"PUROK BOUGAINVILLA, BRGY. OLD SAGAY, SAGAY CITY, NEGROS OCCIDENTAL",9297555968,,10/31/2026
REGION 6,Mabuhay Accommodation,DOT-R06-MAB-02042-2023,CABUGAN NATURE RESORT,GUIMARAS,NUEVA VALENCIA,"BRGY. TANDO, NUEVA VALENCIA, GUIMARAS",720-7055/09338741646,,10/31/2026
REGION 6,Mabuhay Accommodation,DOT-R06-MAB-01913-2023,CADIZ HOTEL INC,NEGROS OCCIDENTAL,CADIZ CITY,"VILLENA STREET, BRGY. 2 POB. (ZONE 2), CADIZ CITY, NEGROS OCCIDENTAL",9277270145,,10/31/2026
REGION 6,Mabuhay Accommodation,DOT-R06-MAB-00104-2021,CALIFORNIACORAL BEACH RESORT,GUIMARAS,NUEVA VALENCIA,"SITIO ALUBIHOD, BRGY. POBLACION, NUEVA VALENCIA, GUIMARAS",0956-144-4981,,10/31/2026
REGION 6,Mabuhay Accommodation,DOT-R06-MAB-03093-2024,"CAMP ROMA GARDEN BEACH RESORT, CO.",NEGROS OCCIDENTAL,SAGAY CITY,"PUNTA ROMA, BRGY. TABA-AO, SAGAY CITY, NEGROS OCCIDENTAL",9104120142,,10/31/2026
REGION 6,Mabuhay Accommodation,DOT-R06-MAB-00747-2022,CAPIZ LODGE,CAPIZ,ROXAS CITY,"PLARIDEL ST., BRGY. POBLACION III, ROXAS CITY, CAPIZ",9814038249,,10/31/2026
REGION 6,Mabuhay Accommodation,DOT-R06-MAB-01930-2023,CARRILLO C-9 HOTEL,AKLAN,KALIBO,"TOTING REYES ST. ANDAGAO BRGY. ADAGAW KALIBO, AKLAN",9078518578,,10/31/2026
REGION 6,Mabuhay Accommodation,DOT-R06-MAB-03340-2024,CASA ALMA LODGING HOUSE,ANTIQUE,PANDAN,"SITIO MALUMPATI, BRGY. GUIA, PANDAN, ANTIQUE",(034) 434-8446,,10/31/2026
REGION 6,Mabuhay Accommodation,DOT-R06-MAB-03676-2025,CASA MARABELLA,BACOLOD CITY,BACOLOD CITY,"YLAC AVE., BRGY. VILLAMONTE, BACOLOD CITY",0917-135-9181,,10/31/2026
REGION 6,Mabuhay Accommodation,DOT-R06-MAB-03369-2024,CASA NOSTRA BEACH RESORT,NEGROS OCCIDENTAL,ESCALANTE CITY,"BRGY. JAPITAN, ESCALANTE CITY, NEGROS OCCIDENTAL",09482595972/268-5430,,10/31/2026
REGION 6,Mabuhay Accommodation,DOT-R06-MAB-00828-2022,CASAVERDE HOMETEL,AKLAN,KALIBO,"ILANG ILANG ROAD BRGY. ANDAGAO, KALIBO, AKLAN",(036) 520-0445,,10/31/2026
REGION 6,Mabuhay Accommodation,DOT-R06-MAB-03758-2025,CASITA JUAN,CAPIZ,ROXAS CITY,"HERNANDEZ AVE., BRGY BAYBAY, ROXAS CITY, CAPIZ",0921-551-4608,,10/31/2026
REGION 6,Mabuhay Accommodation,DOT-R06-MAB-03013-2024,CELESTE HOMESTAY,NEGROS OCCIDENTAL,SAN CARLOS CITY,"PUROK NANGKA, BRGY. SAN JUAN , SAN CARLOS CITY, NEGROS OCCIDENTAL",(034) 700-9545,,10/31/2026
REGION 6,Mabuhay Accommodation,DOT-R06-MAB-00411-2021,CEMPCO INN,BACOLOD CITY,BACOLOD CITY,"COR. CIOCON RD. - MABINI ST., BRGY. 26 (POB.), BACOLOD CITY",9237492102,,10/31/2026
REGION 6,Mabuhay Accommodation,DOT-R06-MAB-00344-2021,CENTER PARKWAY PENSION HOUSE,AKLAN,KALIBO,"OSMEÑA AVE. BRGY.ESTANCIA, KALIBO, AKLAN",(034) 700-4418,,10/31/2026
REGION 6,Mabuhay Accommodation,DOT-R06-MAB-03784-2025,CENTRAL BLOCK SUITES INN,BACOLOD CITY,BACOLOD CITY,"COR. BURGOS-SAN JUAN ST., BRGY. 10, BACOLOD CITY",0923-612-1555,,10/31/2026
REGION 6,Mabuhay Accommodation,DOT-R06-MAB-01257-2022,CERBO BEACH RESORT,NEGROS OCCIDENTAL,SIPALAY CITY,"SITIO MATLAG, BRGY. 4 (POB.), SIPALAY CITY, NEGROS OCCIDENTAL",9672237110,,10/31/2026
REGION 6,Mabuhay Accommodation,DOT-R06-HTL-00111-2021,CHARLZ ANGEL INN,ILOILO,LAMBUNAO,"BURGOS ST., BRGY. POBLACION ILAWOD, LAMBUNAO, ILOILO",2623162,,10/31/2026
REGION 6,Mabuhay Accommodation,DOT-R06-MAB-01043-2022,CHATEAU 5600 CONDOTEL,AKLAN,KALIBO,"ARCHBISHOP REYES ST., BRGY. POBLACION, KALIBO, AKLAN",9199920288,,10/31/2026
REGION 6,Mabuhay Accommodation,DOT-R06-MAB-00218-2021,CHECK INN CORPORATION,BACOLOD CITY,BACOLOD CITY,"PONCE BUILDING, LUZURIAGA STREET BRGY.13 (POB.), BACOLOD CITY, NEGROS OCCIDENTAL",0985-302-2465,,10/31/2026
REGION 6,Mabuhay Accommodation,DOT-R06-MAB-02976-2024,CHICKIE'S SEASIDE PLACE,ANTIQUE,PANDAN,"BRGY. BAYBAY, PANDAN, ANTIQUE",333350166,,10/31/2026
REGION 6,Mabuhay Accommodation,DOT-R06-MAB-00667-2022,CITY CORPORATE INN,ILOILO CITY,ILOILO CITY,"C/O CITY CORPORATE INN RIZAL STREET, BRGY. MA. CLARA, ILOILO CITY",9089498981,,10/31/2026
REGION 6,Mabuhay Accommodation,DOT-R06-MAB-00827-2022,CJL CONDOTEL,AKLAN,KALIBO,VIZCARRA SUBD. BRGY. ANDAGAO KALIBO AKLAN,,,10/31/2026
REGION 6,Mabuhay Accommodation,DOT-R06-MAB-03221-2024,CLIFFSIDE VIEW RESORT,CAPIZ,IVISAN,"SITIO DINUGMAAN, BRGY. BASIAO, IVISAN, CAPIZ",034-70090-74,,10/31/2026
REGION 6,Mabuhay Accommodation,DOT-R06-MAB-01881-2023,CO-Z PENSION HOUSE,BACOLOD CITY,BACOLOD CITY,"CGC BUILDING, PUROK KALIPAYAN, CUADRA STREET, BRGY. 21 (POB.), BACOLOD CITY",0954-380-9184,,10/31/2026
REGION 6,Mabuhay Accommodation,DOT-R06-MAB-04156-2025,CONCEPCION PLAZA HOTEL,ILOILO,CONCEPCION,"SALCEDO ST. BRGY POBLACION, CONCEPCION, ILOILO",0969-033-2995,,10/31/2026
REGION 6,Mabuhay Accommodation,DOT-R06-MAB-01150-2022,CORA VERGEL RESORT,ILOILO,TIGBAUAN,"BRGY. BAROSONG, TIGBAUAN, ILOILO",9683182816,,10/31/2026
REGION 6,Mabuhay Accommodation,DOT-R06-MAB-04036-2025,DE PANAY CONDOTEL,AKLAN,KALIBO,"SANTAN ROAD, BRGY. ANDAGAW, KALIBO, AKLAN",0910-412-0142,,10/31/2026
REGION 6,Mabuhay Accommodation,DOT-R06-MAB-00572-2021,DECIMO INN,CAPIZ,ROXAS CITY,"ARNALDO BOULEVARD, BRGY. BAYBAY, ROXAS CITY, CAPIZ",0906-029-4012,,10/31/2026
REGION 6,Mabuhay Accommodation,DOT-R06-MAB-01633-2022,DJP OPC,BACOLOD CITY,BACOLOD CITY,"JP&D BLDG., HERVIAS HERITAGE SQ., BURGOS ST., BRGY. VILLAMONTE, BACOLOD CITY",036-268-4163,,10/31/2026
REGION 6,Mabuhay Accommodation,DOT-R06-MAB-03639-2024,DREAMLAND RESIDENCES HOTEL,AKLAN,KALIBO,"BRGY. NEW BUSWANG, KALIBO, AKLAN",0920-900-3663,,10/31/2026
REGION 6,Mabuhay Accommodation,DOT-R06-MAB-01853-2023,DRIFTWOOD RESORT,NEGROS OCCIDENTAL,SIPALAY CITY,"SUGARBEACH, BRGY. NAUHANG, SIPALAY CITY, NEGROS OCCIDENTAL",0907-374-5890,,10/31/2026
REGION 6,Mabuhay Accommodation,DOT-R06-MAB-03104-2024,DUQUEZA PENSION HOUSE,NEGROS OCCIDENTAL,SAGAY CITY,"QUEZON STREET, BRGY. 1 (POB.), SAGAY CITY, NEGROS OCCIDENTAL",,,10/31/2026
REGION 6,Mabuhay Accommodation,DOT-R06-MAB-01355-2022,EAGLE'S HOTEL & FUNCTION HALL,ANTIQUE,SAN JOSE DE BUENAVISTA,"BANTAYAN STREET, BRGY. 2 (POB.), SAN JOSE DE BUENAVISTA, ANTIQUE",0999-997-5759,,10/31/2026
REGION 6,Mabuhay Accommodation,DOT-R06-MAB-02866-2024,EKING'S RECREATIONAL PARK AND CAMP,ANTIQUE,PANDAN,"BRGY. SANTO ROSARIO, PANDAN, ANTIQUE",0948-488-7487,,6/30/2026
REGION 6,Mabuhay Accommodation,DOT-R06-MAB-03087-2024,EL TERADOR INN,NEGROS OCCIDENTAL,SAGAY CITY,"AGUILAR SUBD, POBLACION I (BARANGAY 1), SAGAY CITY, NEGROS OCCIDENTAL",9498249181,,10/31/2026
REGION 6,Mabuhay Accommodation,DOT-R06-MAB-04169-2025,EMERALD SHORES RESORT,NEGROS OCCIDENTAL,SAN CARLOS CITY,"PO. CAIMITO, BRGY. SAN JUAN, SAN CARLOS CITY, NEGROS OCCIDENTAL",0970-741-8761,,10/31/2026
REGION 6,Mabuhay Accommodation,DOT-R06-MAB-03083-2024,EMNACE BEACH RESORT,NEGROS OCCIDENTAL,SAGAY CITY,"PRK BOUGAINVILLA, OLD SAGAY, SAGAY CITY, NEGROS OCCIDENTAL",0919-065-8311,,10/31/2026
REGION 6,Mabuhay Accommodation,DOT-R06-MAB-03880-2025,EON CENTENNIAL EXPRESS HOTEL,ILOILO CITY,ILOILO CITY,"BRGY. NONOY, VALERIA EXTENSION, ILOILO CITY",(034) 454-0190,,10/31/2026
REGION 6,Mabuhay Accommodation,DOT-R06-MAB-03404-2024,EPSTEMPCO-VISAYAS (MULTI PURPOSE),NEGROS OCCIDENTAL,ESCALANTE CITY,"EAST AVENUE, BRGY. BALINTAWAK (POB.), ESCALANTE CITY, NEGROS OCCIDENTAL",9176360143,,10/31/2026
REGION 6,Mabuhay Accommodation,DOT-R06-MAB-01540-2022,ERNEST'S PLACE RESORT,BORACAY-AKLAN,MALAY,"SITIO BOLABOG, BRGY. BALABAG, BORACAY ISLAND, MALAY, AKLAN",9462851869,,10/31/2026
REGION 6,Mabuhay Accommodation,DOT-R06-MAB-01885-2023,ESTELITA BEACH RESORT,NEGROS OCCIDENTAL,SIPALAY CITY,"PUROK BOCANA, BRGY. NAUHANG, SIPALAY CITY, NEGROS OCCIDENTAL",(036) 500-6094,,10/31/2026
REGION 6,Mabuhay Accommodation,DOT-R06-MAB-00226-2021,ETT HOMETEL,AKLAN,KALIBO,"QUEZON AVENUE, BRGY. ESTANCIA, KALIBO, AKLAN","9,480,541,137",,10/31/2026
REGION 6,Mabuhay Accommodation,DOT-R06-MAB-00168-2021,EVA'S INN,NEGROS OCCIDENTAL,SIPALAY CITY,"BRGY. 2 (POB.), SIPALAY CITY, NEGROS OCCIDENTAL",9322055888,,10/31/2026
REGION 6,Mabuhay Accommodation,DOT-R06-MAB-02184-2023,FE-BEN TRAVELLER'S INN,NEGROS OCCIDENTAL,SAN CARLOS CITY,"ECOTOURISM HIGHWAY, DON JUAN SUBD. BRGY. POBLACION II, SAN CARLOS CITY, NEGROS OCCIDENTAL",0933-101-1777,,10/31/2026
REGION 6,Mabuhay Accommodation,DOT-R06-MAB-00894-2022,FEBE ECONO INN,NEGROS OCCIDENTAL,SAN CARLOS CITY,"BROCE ST., BRGY. IV (POB.), SAN CARLOS CITY, NEGROS OCCIDENTAL",9171254944,,10/31/2026
REGION 6,Mabuhay Accommodation,DOT-R06-MAB-03822-2025,FERIC HOTEL,ILOILO,BAROTAC NUEVO,"ZAMORA STREET, BRGY. ILAUD POBLACION, BAROTAC NUEVO, ILOILO",0963-611-9736,,10/31/2026
REGION 6,Mabuhay Accommodation,DOT-R06-MAB-03217-2024,FJ JACOBE STAYS ACCOMMODATION RESERVATION SERVICES,ILOILO,TUBUNGAN,"BRGY. TAGPU-AN, TUUNGAN, ILOILO",9177162302,,10/31/2026
REGION 6,Mabuhay Accommodation,DOT-R06-MAB-02679-2024,FOREST SPRINGS PATAG RETREAT AND CAMPING SITE RENTAL,NEGROS OCCIDENTAL,SILAY CITY,"PUROK MAHIGUGMAON BRGY. PATAG, SILAY CITY, NEGROS OCCIDENTAL",9299690494,,10/31/2026
REGION 6,Mabuhay Accommodation,DOT-R06-MAB-00545-2021,GEMENTIZA INLAND RESORT,ILOILO,BAROTAC NUEVO,"BRGY. TABUC-SUBA, BAROTAC NUEVO, ILOILO",9393318841,,10/31/2026
REGION 6,Mabuhay Accommodation,DOT-R06-MAB-03911-2025,GENARO’S BEACH RESORT,ANTIQUE,ANINI-Y,"SITIO LUBAY-LUBAY, BRGY. SAN FRANCISCO, ANINI-Y ANTIQUE",9080811912,,10/31/2026
REGION 6,Mabuhay Accommodation,DOT-R06-MAB-00422-2021,GERBI'S CONDOPLACE AT OCEANWAY RESIDENCES,BORACAY-AKLAN,MALAY,"LOWER GROUND 2F, CLUSTER D, OCEANWAY RESIDENCES, NEWCOAST,BRGY. YAPAK, BORACAY ISLAND, MALAY, AKLAN",0977-743-3745,,10/31/2026
REGION 6,Mabuhay Accommodation,DOT-R06-MAB-03850-2025,GERBO DIVE RESORT,ANTIQUE,ANINI-Y,"BRGY. NATO, ANINI-Y, ANTIQUE",0925-874-5021,,10/31/2026
REGION 6,Mabuhay Accommodation,DOT-R06-MAB-03181-2024,GERMAN UNSON HERITAGE HOUSE BED & BREAKFAST,NEGROS OCCIDENTAL,SILAY CITY,"#5 ZAMORA STREET, BARANGAY IV (POB.), SILAY CITY, NEGROS OCCIDENTAL",9270868740,,10/31/2026
REGION 6,Mabuhay Accommodation,DOT-R06-MAB-03653-2024,GIBRALTAR'S INN,ANTIQUE,SAN JOSE DE BUENAVISTA,"T.A. FORNIER STREET, BRGY. 2 (POB.), SAN JOSE DE BUENAVISTA, ANTIQUE",9631386420,,10/31/2026
REGION 6,Mabuhay Accommodation,DOT-R06-MAB-01836-2023,"GLOWMOON HOTELS AND RESORTS, INC.",AKLAN,KALIBO,"0628 MARTELINO STREET, BRGY. POBLACION, KALIBO, AKLAN",09988403563 / (033) 3350486,,10/31/2026
REGION 6,Mabuhay Accommodation,DOT-R06-MAB-01463-2022,GO HOTELS ILOILO,ILOILO CITY,ILOILO CITY,"LEDESMA STREET CORNER MABINI STREET, BRGY. ROXAS VILLAGE, ILOILO CITY",9063258404,,10/31/2026
REGION 6,Mabuhay Accommodation,DOT-R06-MAB-04140-2025,GRANDBFARM FLOWER GARDEN,ILOILO,BAROTAC NUEVO,"PUROK DELAVIKA, BRGY. SAN ANTONIO, BAROTAC VIEJO, ILOILO",0946-677-9302,,10/31/2026
REGION 6,Mabuhay Accommodation,DOT-R06-MAB-03866-2025,GREEN GARDEN BEACH RESORT,NEGROS OCCIDENTAL,SIPALAY CITY,"SITIO LANGUB, PUROK BAGUISAN, BRGY. NAUHANG, SIPALAY CITY, NEGROS OCCIDENTAL",9998870038,,10/31/2026
REGION 6,Mabuhay Accommodation,DOT-R06-MAB-01376-2022,GUISI CLEARWATER RESORT,GUIMARAS,NUEVA VALENCIA,"SITIO GUISI, BRGY. DOLORES, NUEVA VALENCIA, GUIMARAS",(036) 621-0649,,10/31/2026
REGION 6,Mabuhay Accommodation,DOT-R06-MAB-00740-2022,HALARAN PLAZA HOTEL & COFFEE SHOP,CAPIZ,ROXAS CITY,"RIZAL ST., BRGY. POBLACION VI, ROXAS CITY, CAPIZ",0998-985-1745/0939-598-4383,,10/31/2026
REGION 6,Mabuhay Accommodation,DOT-R06-MAB-03519-2024,HANDUM BEACH RESORT,NEGROS OCCIDENTAL,HINIGARAN,"PUROK 4, BRGY. GARGATO, HINIGARAN, NEGROS OCCIDENTAL",0910-412-0142,,10/31/2026
REGION 6,Mabuhay Accommodation,DOT-R06-MAB-00745-2022,HAPPY HEARTS DRIVE-IN HOTEL,CAPIZ,ROXAS CITY,"ARNALDO BOULEVARD, BRGY. BAYBAY, ROXAS CITY, CAPIZ",0909 4720 076/ 522 7823,,10/31/2026
REGION 6,Mabuhay Accommodation,DOT-R06-MAB-00570-2021,HEMINGWAY HOTEL,CAPIZ,ROXAS CITY,"HEMINGWAY STREET, BRGY. TIZA, ROXAS CITY, CAPIZ",09629086294 / 09985544013,,10/31/2026
REGION 6,Mabuhay Accommodation,DOT-R06-MAB-03927-2025,HERENICE BEACH RESORT,ANTIQUE,ANINI-Y,"BRGY NATO, ANINI-Y, ANTIQUE",0998-986-4528,,10/31/2026
REGION 6,Mabuhay Accommodation,DOT-R06-MAB-03084-2024,HI-WAY TRAVELERS INN,NEGROS OCCIDENTAL,SAGAY CITY,"NATIONAL HIGHWAY, BRGY. POBLACION II, SAGAY CITY, NEGROS OCCIDENTAL",336-0024/0919-910-2212,,10/31/2026
REGION 6,Mabuhay Accommodation,DOT-R06-MAB-02211-2023,HOME SQUARE INN & DORM,ILOILO CITY,ILOILO CITY,"E. LOPEZ ST., BRGY. MONTINOLA, JARO, ILOILO CITY",336-0034 / 0920-949-0026,,10/31/2026
REGION 6,Mabuhay Accommodation,DOT-R06-MAB-01510-2022,HOME SQUARE INN AND DORM,ILOILO CITY,ILOILO CITY,"VALERIA STREET, BRGY. DANAO, ILOILO CITY",0917-114-6489,,10/31/2026
REGION 6,Mabuhay Accommodation,DOT-R06-MAB-03257-2024,HOP INN,ILOILO CITY,ILOILO CITY,"LOT 2 DONATO PISON ROAD, BRGY. SAN RAFAEL, MANDURRIAO, ILOILO CITY",9495876323,,10/31/2026
REGION 6,Mabuhay Accommodation,DOT-R06-MAB-01654-2023,HOTEL BNL,AKLAN,KALIBO,"213 JAIME CARDINAL SIN AVENUE,BRGY. POOK, KALIBO, AKLAN",(033) 338-0044,,10/31/2026
REGION 6,Mabuhay Accommodation,DOT-R06-MAB-01254-2022,ILOILO LA FIESTA HOTEL INC.,ILOILO CITY,ILOILO CITY,"M.H. DEL PILAR STREET, BRGY. TAAL, MOLO, ILOILO CITY",9161360300,,10/31/2026
REGION 6,Mabuhay Accommodation,DOT-R06-MAB-00357-2021,ISLAND ADVENTURES TOURIST INN,NEGROS OCCIDENTAL,SIPALAY CITY,"ALVAREZ HIGHWAY, BRGY. I (POB.), SIPALAY CITY, NEGROS OCCIDENTAL",0946-957-6871,,10/31/2026
REGION 6,Mabuhay Accommodation,DOT-R06-MAB-01601-2022,JAMAGO BEACH RESORT,NEGROS OCCIDENTAL,SAGAY CITY,"PRK CAMANTIGUE, OLD SAGAY, SAGAY CITY, NEGROS OCCIDENTAL",9127240081,,10/31/2026
REGION 6,Mabuhay Accommodation,DOT-R06-MAB-02217-2023,JESA BEACH RESORT,ILOILO,CARLES,"BRGY. GRANADA, GIGANTE NORTE, CARLES, ILOILO",0945-324-4260,,10/31/2026
REGION 6,Mabuhay Accommodation,DOT-R06-MAB-03874-2025,JEWEL'S INN,NEGROS OCCIDENTAL,SIPALAY CITY,"PUROK LUBI, BRGY. MAMBAROTO, SIPALAY CITY, NEGROS OCCIDENTAL",9184501753,,10/31/2026
REGION 6,Mabuhay Accommodation,DOT-R06-MAB-00021-2021,JL PENSION HAUZ,GUIMARAS,JORDAN,"JL BLDG.BLK 10 LOT 22 CAPITOLVIEW, BRGY. SAN MIGUEL, JORDAN, GUIMARAS",3225142,,10/31/2026
REGION 6,Mabuhay Accommodation,DOT-R06-MAB-04032-2025,JM BACKPACKERS HOMETEL & LEASING SERVICES,GUIMARAS,JORDAN,"JTM BLDG. MOSQUEDA VILLAGE, NEW SITE ST., SAN MIGUEL, JORDAN, GUIMARAS",9154471415,,10/31/2026
REGION 6,Mabuhay Accommodation,DOT-R06-MAB-03972-2025,JOY & JAY SEASIDE LODGING HOUSE,NEGROS OCCIDENTAL,SIPALAY CITY,"PUNTA BALLO, BRGY. 4 (POB.), SIPALAY CITY, NEGROS OCCIDENTAL",(036) 621-2089/0938-738-0218,,10/31/2026
REGION 6,Mabuhay Accommodation,DOT-R06-MAB-01133-2022,JULIETA'S APARTELLE,CAPIZ,ROXAS CITY,"ARNALDO BVLD. BRGY. BAYBAY, ROXAS CITY, CAPIZ",0929-156-4010,,10/31/2026
REGION 6,Mabuhay Accommodation,DOT-R06-MAB-00538-2021,JUVIETA BEACH PENSION HOUSE,CAPIZ,ROXAS CITY,"BRGY. BAYBAY ROXAS CITY, CAPIZ",0919-079-2541,,10/31/2026
REGION 6,Mabuhay Accommodation,DOT-R06-MAB-03674-2025,KALAYAAN HI-WAY DORMITEL CORPORATION,BACOLOD CITY,BACOLOD CITY,"B1 L1, ARANETA STREET, BRGY. TANGUB, BACOLOD CITY",9189339963,,10/31/2026
REGION 6,Mabuhay Accommodation,DOT-R06-MAB-00531-2021,KALIBO ATI-ATIHAN PENSIONE HOUSE,AKLAN,KALIBO,"OSMENA AVENUE, BRGY. ESTANCIA, KALIBO, AKLAN",9482375046,,10/31/2026
REGION 6,Mabuhay Accommodation,DOT-R06-MAB-03388-2024,KALIBO QUEEN'S INN,AKLAN,KALIBO,"047 TOTING REYES STREET, BRGY. BUSWANG NEW, KALIBO, AKLAN",9301489485,,10/31/2026
REGION 6,Mabuhay Accommodation,DOT-R06-MAB-04020-2025,KAMALIG D' TIROL BEACH RESORT,CAPIZ,PILAR,"SITIO BANG-OGAY BRGY. NATIVIDAD, PILAR, CAPIZ",0920-329-2162,,10/31/2026
REGION 6,Mabuhay Accommodation,DOT-R06-MAB-02932-2024,KAMPO HIYANG-HIYANG MOUNTAIN RESORT,NEGROS OCCIDENTAL,TALISAY CITY,"SITIO CAMPUESTOHAN, BRGY.CABATANGAN, TALISAY CITY, NEGROS OCCIDENTAL",9468160801,,10/31/2026
REGION 6,Mabuhay Accommodation,DOT-R06-MAB-03942-2025,KENYAMA BEACH RESORT,GUIMARAS,NUEVA VALENCIA,GUISI BRGY. DOLORES NUEVA VALENCIA GUIMARAS,344458127,,10/31/2026
REGION 6,Mabuhay Accommodation,DOT-R06-MAB-03395-2024,KHOKOON INN,BACOLOD CITY,BACOLOD CITY,"MAGSAYSAY AVENUE, BRGY. SINGCANG-AIRPORT, BACOLOD CITY",0969-074-5715,,10/31/2026
REGION 6,Mabuhay Accommodation,DOT-R06-MAB-03785-2025,KING'S HOTEL,BACOLOD CITY,BACOLOD CITY,"GATUSLAO- SAN SEBASTIAN STS., BRGY. 13, BACOLOD CITY",0920-529-4750,,10/31/2026
REGION 6,Mabuhay Accommodation,DOT-R06-MAB-03465-2024,L.A BEACH RESORT,CAPIZ,IVISAN,"BRGY. BASIAO, IVISAN, CAPIZ",09338109551 / 09261236926,,10/31/2026
REGION 6,Mabuhay Accommodation,DOT-R06-MAB-03385-2024,L.O.C. TEMPLE DEV'T CORPORATION,BACOLOD CITY,BACOLOD CITY,"11TH ST., COR., TOPS ROAD, BRGY. 7, BACOLOD CITY",9568253373,,10/31/2026
REGION 6,Mabuhay Accommodation,DOT-R06-MAB-03935-2025,L’AMARA BEACH RESORT,ILOILO,SAN JOAQUIN,"BRGY. AMBOYU-AN SAN JOAQUIN, ILOILO",9976020549,,10/31/2026
REGION 6,Mabuhay Accommodation,DOT-R06-MAB-01194-2022,LA COSTA AMARI BEACH RESORT,NEGROS OCCIDENTAL,HIMAMAYLAN,"SO. BATANG BRGY.TALABAN, HIMAMAYLAN CITY, NEGROS OCCIDENTAL",036 268 9254,,10/31/2026
REGION 6,Mabuhay Accommodation,DOT-R06-MAB-00340-2021,LA ESPERANZA HOTEL,AKLAN,KALIBO,"OSMENA AVENUE, ESTANCIA, KALIBO, AKLAN",(034) 4335234/ 09173007736,,10/31/2026
REGION 6,Mabuhay Accommodation,DOT-R06-MAB-00940-2022,LA GUERTA BUILDING,NEGROS OCCIDENTAL,LA CARLOTA CITY,"120 OGATIS ST., BRGY. III (POB.), LA CARLOTA CITY, NEGROS OCCIDENTAL",0908-888-2623,,10/31/2026
REGION 6,Mabuhay Accommodation,DOT-R06-MAB-02002-2023,LA TRINIDAD PENSION HOUSE,AKLAN,KALIBO,"OSMENA AVE, BRGY. ESTANCIA, KALIBO, AKLAN",9171007331,,10/31/2026
REGION 6,Mabuhay Accommodation,DOT-R06-MAB-01611-2022,LANGUB BEACH GARDEN,NEGROS OCCIDENTAL,SIPALAY CITY,"SUGARBEACH, BRGY. NAUHANG, SIPALAY CITY, NEGROS OCCIDENTAL",9171007331,,10/31/2026
REGION 6,Mabuhay Accommodation,DOT-R06-MAB-01606-2022,LANGUB PENSION HOUSE,NEGROS OCCIDENTAL,SIPALAY CITY,"PUROK 1, BRGY. 1 (POB.), SIPALAY CITY, NEGROS OCCIDENTAL",(034) 466-6305,,10/31/2026
REGION 6,Mabuhay Accommodation,DOT-R06-MAB-01085-2022,LAURA HOTEL,NEGROS OCCIDENTAL,CADIZ CITY,"VILLENA ST., BRGY. 2 POB. (ZONE 2), CADIZ CITY, NEGROS OCCIDENTAL",9300501978,,10/31/2026
REGION 6,Mabuhay Accommodation,DOT-R06-MAB-03265-2024,LAURA SEAFRONT RESORT,NEGROS OCCIDENTAL,CADIZ CITY,"PUROK CONSING, BRGY. DAGA, CADIZ CITY, NEGROS OCCIDENTAL",(036) 272-6201/0917-322-3013/0939-921-9469,,10/31/2026
REGION 6,Mabuhay Accommodation,DOT-R06-MAB-01999-2023,LAVERO SUITES,AKLAN,KALIBO,"ARCHBISHOP GABRIEL M. REYES STREET, BRGY. POBLACIO, KALIBO, AKLAN",(034) 461-8607,,10/31/2026
REGION 6,Mabuhay Accommodation,DOT-R06-MAB-01251-2022,LE-DON RESIDENCES,BACOLOD CITY,BACOLOD CITY,"ESPERANZA DIOLA ST., BRGY. VILLAMONTE, BACOLOD CITY",9175470871,,10/31/2026
REGION 6,Mabuhay Accommodation,DOT-R06-MAB-03827-2025,LEGACY LODGING HOUSE,CAPIZ,ROXAS CITY,"SAN JOSE VILLAGE, BRGY. TIZA, ROXAS CITY CAPIZ",(034) 700-9531/(034) 445-3591,,10/31/2026
REGION 6,Mabuhay Accommodation,DOT-R06-MAB-03501-2024,LIMMAN'S CENTER INN,BACOLOD CITY,BACOLOD CITY,"CORNER ARANETA-LUZURIAGA STREETS, BRGY. 12 (POB.), BACOLOD CITY",0945-190-3619,,10/31/2026
REGION 6,Mabuhay Accommodation,DOT-R06-MAB-03746-2025,LIMMANS INN SAN JUAN,BACOLOD CITY,BACOLOD CITY,"1980 SAN JUAN ST., BRGY. 13 (POB.), BACOLOD CITY",9603959818,,10/31/2026
REGION 6,Mabuhay Accommodation,DOT-R06-MAB-03962-2025,LITTLE GLOWMOON PENSION HOUSE,AKLAN,KALIBO,"0845 F. QUIMPO STREET BRGY.POBLACION, KALIBO, AKLAN",9088120767,,10/31/2026
REGION 6,Mabuhay Accommodation,DOT-R06-RES-00073-2021,LITTLE JUNGLE AGRI-TOURISM VENTURES INC.,NEGROS OCCIDENTAL,CADIZ CITY,"MAYA SUERTE, BRGY. CABAHUG, CADIZ CITY, NEGROS OCCIDENTAL",9998623560,,10/31/2026
REGION 6,Mabuhay Accommodation,DOT-R06-MAB-03967-2025,LOLA DADANG GUESTHOUSE,NEGROS OCCIDENTAL,E.B MAGALONA,"241 FELIX MONTINOLA ST. BRGY. POBLACION I, ENRIQUE B. MAGALONA, NEGROS OCCIDENTAL",0977-078-4522/0917-157-8537,,10/31/2026
REGION 6,Mabuhay Accommodation,DOT-R06-MAB-03776-2025,LOLA NITANG'S HOTEL,NEGROS OCCIDENTAL,SAN CARLOS CITY,"LOCSIN ST., BRGY. V, SAN CARLOS CITY, NEGROS OCCIDENTAL",9218865387,,10/31/2026
REGION 6,Mabuhay Accommodation,DOT-R06-MAB-00855-2022,LOPEZ BEACH RESORT,NEGROS OCCIDENTAL,SIPALAY CITY,"BRGY. MARICALUM, CAMPOMANES BAY, SIPALAY CITY, NEGROS OCCIDENTAL",9065221600,,10/31/2026
REGION 6,Mabuhay Accommodation,DOT-R06-MAB-03605-2024,LUDY'S 2 PENSION HOUSE,ILOILO,CARLES,"BRGY. BANCAL, CARLES, ILOILO",9480966604,,10/31/2026
REGION 6,Mabuhay Accommodation,DOT-R06-MAB-03402-2024,LUDY’S PENSION HOUSE,ILOILO,CARLES,"BRGY. BANCAL, CARLES, ILOILO",(034) 435-3675,,10/31/2026
REGION 6,Mabuhay Accommodation,DOT-R06-MAB-00887-2022,MAIN STREET PENSION HOUSE,BACOLOD CITY,BACOLOD CITY,"123 LACSON EXTENSION ST., BRGY, POBLACION 40, BACOLOD CITY, NEGROS OCCIDENTAL",9173607820,,10/31/2026
REGION 6,Mabuhay Accommodation,DOT-R06-MAB-00541-2021,MAITEA BEACH RESORT,ILOILO,GUIMBAL,"BRGY. CABASI, GUIMBAL, ILOILO",9633009607,,10/31/2026
REGION 6,Mabuhay Accommodation,DOT-R06-MAB-03986-2025,MAKARIOS AQUA PARK RESORT,GUIMARAS,NUEVA VALENCIA,"SITIO PROPER BRGY. TANDO, NUEVA VALENCIA, GUIMARAS",0933-824-4679,,10/31/2026
