Region,Enterprise Type,Accreditation No,Enterprise Name,Province,Municipality,Business Address,Contact Numbers,Business Website,Accreditation Validity
REGION 6,Travel Agency,DOT-R06-TRA-04095-2025,TRAVELZANIA TRAVEL AND TOURS,ILOILO CITY,ILOILO CITY,"JORNDIN BLDG., SEN. BENIGNO AQUINO AVE., DIVERSION RD., BRGY. SAN RAFAEL MANDURRIAO, ILOILO CITY",09175354778/ 09193027998,,6/30/2026
REGION 6,Travel Agency,DOT-R06-TRA-03019-2024,TRIP PLUS TRAVEL AND TOURS,BACOLOD CITY,BACOLOD CITY,"DR. 1 CENTRUM ARCADE BLDG., BALLESTEROS ST., BRGY. 13, BACOLOD CITY",(034) 434-5077/ 704-2059,,6/30/2026
REGION 6,Travel Agency,DOT-R06-TRA-03961-2025,ZYDREI TRAVEL AND TOURS,ANTIQUE,SAN JOSE DE BUENAVISTA,"GAISANO GRAND MALL ANTIQUE, BRGY. SAN ANGEL, SAN JOSE DE BUENAVISTA, ANTIQUE",9513214480,,6/30/2026
REGION 6,Travel Agency,DOT-R06-TRA-04227-2025,ESCAPES PHILIPPINES INC.,AKLAN,KALIBO,"ACEVEDO STREET, BRGY. POBLACION, KALIBO, AKLAN",9090412860,,6/30/2026
,​,,,,,,,,
REGION 6,Tour Operator,DOT-R06-TOP-03618-2024,ATELEVI TRAVEL & TOURS SERVICES,BORACAY-AKLAN,MALAY,"ZONE 5, SITIO BOLABOG, BRGY. BALABAG, BORACAY ISLAND, MALAY, AKLAN",9295295590,,6/30/2026
REGION 6,Tour Operator,DOT-R06-TOP-02749-2024,BORACAY ADVENTURES INC,BORACAY-AKLAN,MALAY,"2ND FLOOR SUNFLOWER RESORT, BRGY. BALABAG, BORACAY ISLAND, MALAY, AKLAN",(036)-288-2032,,6/30/2026
REGION 6,Tour Operator,DOT-R06-TOP-03421-2024,G TRAVEL AGENCY,BORACAY-AKLAN,MALAY,"LAKE TOWN BUILDING, ZONE 7 BRGY. BALABAG, BORACAY ISLAND, MALAY, AKLAN",9474690040,,6/30/2026
REGION 6,Tour Operator,DOT-R06-TOP-03436-2024,JPB WORLD KOREA INC,BORACAY-AKLAN,MALAY,"PARADISE GARDEN RESORTS HOTEL & CONVENTION CENTER, BRGY. MANOC-MANOC, BORACAY ISLAND, MALAY, AKLAN",9959889627,,6/30/2026
REGION 6,Tour Operator,DOT-R06-TOP-03121-2024,KORA NUBI TRAVEL & TOURS INC.,BORACAY-AKLAN,MALAY,"ZONE V, SITIO BOLABOG, BRGY. BALABAG, BORACAY ISLAND, MALAY, AKLAN",(036) 288-2105/0938-843-2119,,6/30/2026
REGION 6,Tour Operator,DOT-R06-TOP-03027-2024,"MBG TRAVEL & TOURS, INC.",BORACAY-AKLAN,MALAY,"SITIO MANGGAYAD, BRGY. MANOC-MANOC, BORACAY ISLAND, MALAY, AKLAN",0906-399-4675,,6/30/2026
REGION 6,Tour Operator,DOT-R06-TOP-03024-2024,MEGA PARAW LAND TOUR ISLAND HOPPING AND TRAVEL SERVICES,AKLAN,MALAY,"3RD FLOOR CBTMPC BUSINESS CENTER, SITIO KANYUGAN, BRGY. CATICLAN, MALAY, AKLAN",0966-615-7425,,6/30/2026
REGION 6,Tour Operator,DOT-R06-TOP-03299-2024,MODETOUR BORACAY INC.,BORACAY-AKLAN,MALAY,"ROOM #1 3RD FLOOR , HEALING TIME ZONE V, SITIO BOLABOG, BRGY. BALABAG, BORACAY ISLAND, MALAY, AKLAN",0938-843-2119/ (036) 288-2105,,6/30/2026
REGION 6,Tour Operator,DOT-R06-TOP-01895-2023,MUONG TRAVEL AGENCY,ILOILO,CARLES,"STALL NO. 5, BANCAL PUBLIC MARKET BUILDING 2, BRGY. BANCAL, CARLES, ILOILO",0992-244-4676,,6/30/2026
REGION 6,Tour Operator,DOT-R06-TOP-03073-2024,NEMAM BORACAY TRAVEL AND TOURS,BORACAY-AKLAN,MALAY,"BRGY. BALABAG, BORACAY ISLAND, MALAY, AKLAN",0927-877-4769,,6/30/2026
REGION 6,Tour Operator,DOT-R06-TOP-03254-2024,PURPLE DIARIES TRAVEL AND TOURS,BORACAY-AKLAN,MALAY,"SITIO BOLABOG, BRGY. BALABAG, BORACAY ISLAND, MALAY, AKLAN",9457753111,,6/30/2026
REGION 6,Tour Operator,DOT-R06-TOP-03475-2024,REYBOKS TRAVEL AND TOURS,AKLAN,MALAY,"TABON PORT, BRGY. CATICLAN, MALAY, AKLAN",9381377470,,6/30/2026
REGION 6,Tour Operator,DOT-R06-TOP-03620-2024,S BORACAY CORP,BORACAY-AKLAN,MALAY,"LAKETOWN BLDG., BRGY. BALABAG, BORACAY ISLAND, MALAY, AKLAN",9171199969,,6/30/2026
REGION 6,Tour Operator,DOT-R06-TOP-01242-2022,SOSAFL CORP.-HAQQY LIFE,BORACAY-AKLAN,MALAY,"BRGY. BALABAG, BORACAY ISLAND, MALAY, AKLAN",0910-701-2808,,6/30/2026
REGION 6,Tour Operator,DOT-R06-TOP-04203-2025,JERRY TRAVEL & TOURS,BORACAY-AKLAN,MALAY,"ZONE V BOLABOG, BRGY. BALABAG, BORACAY ISLAND, MALAY, AKLAN","09509356647, 09454764649, (036) 286-9163",,6/30/2026
REGION 6,Tour Operator,DOT-R06-TOP-04222-2025,FIT TOUR SERVICES,BORACAY-AKLAN,MALAY,"JKD BORADISE S1, BRGY. BALABAG, BORACAY ISLAND, MALAY, AKLAN",9397554129,,6/30/2026
,​,,,,,,,,
REGION 6,Gallery / Museum,DOT-R06-MSM-03718-2025,MUSEO SANG BATA SA NEGROS FOUNDATION INC,NEGROS OCCIDENTAL,SAGAY CITY,"PUROK BOUGAINVILLA, BRGY. OLD SAGAY, SAGAY CITY, NEGROS OCCIDENTAL",0977-270-6151,,8/1/2026
REGION 6,Gallery / Museum,DOT-R06-SRC-04141-2025,AGATONA 1927 MUSEUM,ILOILO CITY,ILOILO CITY,"ARGUELLES ST.,BRGY ARGUELLES, ILOILO CITY",9125003883,,9/7/2026
,​,,,,,,,,
REGION 6,Rest Area,DOT-R06-TRE-03952-2025,GLENUTZ GASOLINE STATION,NEGROS OCCIDENTAL,CALATRAVA,"NATIONAL HIGHWAY BRGY.LO-OK (POBLACION), CALATRAVA, NEGROS OCCIDENTAL",9267158463,,3/28/2026
,​,,,,,,,,
REGION 6,Tourism Training Center,DOT-R06-TRC-03628-2024,BORACAY COCO ENGLISH ACADEMY,BORACAY-AKLAN,MALAY,"SITIO BANTUD, BRGY. MANOC-MANOC, BORACAY ISLAND, MALAY, AKLAN",9397933377,,6/12/2025
REGION 6,Tourism Training Center,DOT-R06-TRC-03123-2024,"METRO KOREA LANGUAGE TRAINING CENTER, INC.",ILOILO CITY,ILOILO CITY,"LOTS 43,44,45 BLOCK 44 WESTWOODS SUBDIVISION DUNGON C. MANDURRIAO, ILOILO CITY",033-329-1854,,11/7/2026
REGION 6,Tourism Training Center,DOT-R06-TRC-04238-2025,GREEN INTERNATIONAL TECHNOLOGICAL COLLEGE,ILOILO CITY,ILOILO CITY,"GREEN INTERNATIONAL TECHNOLOGICAL COLLEGE, BRGY. BANTUD, ILOILO CITY",9209815552,,8/20/2026
,​,,,,,,,,
REGION 6,Restaurant,DOT-R06-RST-02106-2023,8 VILLA BEACH HOUSE,ILOILO CITY,ILOILO CITY,"ZONE 1, BRGY. SANTO NIÑO SUR, AREVALO, ILOILO CITY",(033) 593-5334,,3/1/2026
REGION 6,Restaurant,DOT-R06-RST-04188-2025,ABOY'S INASAL & CO.,BACOLOD CITY,BACOLOD CITY,"LOT 8 BLK 2 LIROVILLE SUBD.BRGY. SINGCANG-AIRPORT, BACOLOD CITY, NEGROS OCCIDENTAL",9985686556,,7/24/2026
REGION 6,Restaurant,DOT-R06-RST-04185-2025,ABOY'S RESTAURANT,BACOLOD CITY,BACOLOD CITY,"LIROVILLE SUBD. BRGY. SINGCANG-AIRPORT, BACOLOD CITY, NEGROS OCCIDENTAL",9985686556,,7/23/2026
REGION 6,Restaurant,DOT-R06-RST-02930-2024,ALAIIA RESTAURANT,NEGROS OCCIDENTAL,SAN CARLOS CITY,"LOCSIN ST., BRGY IV, SAN CARLOS CITY, NEGROS OCCIDENTAL",9272022182,,7/15/2026
REGION 6,Restaurant,DOT-R06-RST-03423-2024,ALONSO'S CANSI & SIZZLING HOUSE,NEGROS OCCIDENTAL,KABANKALAN CITY,"ISIDRO VILLAGE, BRGY. 1 (POB.), KABANKALAN CITY, NEGROS OCCIDENTAL",9231132724,,10/24/2025
REGION 6,Restaurant,DOT-R06-RST-04191-2025,ALRAZON'S EATERY,NEGROS OCCIDENTAL,CANDONI,"PUROK ROSE, BRGY. POBLACION EAST, CANDONI, NEGROS OCCIDENTAL",9707199271,,7/28/2026
REGION 6,Restaurant,DOT-R06-RST-03178-2024,AMIGO'S RESTO BAR,NEGROS OCCIDENTAL,SILAY CITY,"SO. CABUG HIGHWAY, BRGY GUINHALARAN, BARANGAY IV (POB.), SILAY CITY, NEGROS OCCIDENTAL",0908-950-3460,,11/9/2025
REGION 6,Restaurant,DOT-R06-RST-03705-2025,AMOMA,ILOILO,SANTA BARBARA,"BRGY. BALIBAGAN ESTE, SANTA BARBARA, ILOILO",0935-681-5733,,3/1/2026
REGION 6,Restaurant,DOT-R06-RST-03728-2025,ANTONIO'S LAZE BISTRO,NEGROS OCCIDENTAL,ESCALANTE CITY,"NATIONAL HIGHWAY, BRGY. BALINTAWAK (POB.), ESCALANTE CITY, NEGROS OCCIDENTAL",0962-451-3386,,10/1/2026
REGION 6,Restaurant,DOT-R06-RST-00443-2021,ARIA BAR AND RESTAURANT,BORACAY-AKLAN,MALAY,"BRGY.BALABAG, MALAY, AKLAN",(036) 288-1808,,10/2/2026
REGION 6,Restaurant,DOT-R06-RST-03738-2025,BACOLOD GTF INC,BACOLOD CITY,BACOLOD CITY,"SAN PATRICIO BLVD., BRGY. BANAGO, BACOLOD CITY",0916-360-0604,,10/1/2026
REGION 6,Restaurant,DOT-R06-RST-03168-2024,BALIKTANAW CAFE,NEGROS OCCIDENTAL,SILAY CITY,"SENATOR LOCSIN ST., BRGY. V (POB.), SILAY CITY, NEGROS OCCIDENTAL",0927-855-5869/0966-398-7517,,11/9/2025
REGION 6,Restaurant,DOT-R06-RST-02246-2023,BAR @ SUMMER CLUB,BORACAY-AKLAN,MALAY,"ZONE 6 BRGY. BALABAG, MALAY, AKLAN",362883144,,4/29/2026
REGION 6,Restaurant,DOT-R06-RST-04112-2025,BEANS AND BUBBLES COFFEE SHOP,ILOILO,MIAGAO,"BRGY. MAT-Y, MIAGAO, ILOILO",9177188025,,5/26/2026
REGION 6,Restaurant,DOT-R06-RST-03849-2025,BELLYCIOSO,ANTIQUE,PATNONGON,"REAL ST. BRGY.POBLACION, PATNONGON, ANTIQUE",0977-825-9222,,10/2/2026
REGION 6,Restaurant,DOT-R06-RST-04221-2025,BOODIE'S BISTRO,BACOLOD CITY,BACOLOD CITY,"FOOD CENTRAL, LACSON ST. BRGY. MANDALAGAN, BACOLOD CITY, NEGROS OCCIDENTAL",9093622192,,7/7/2026
REGION 6,Restaurant,DOT-R06-RST-01401-2022,BORACAY BEACH TRUCK,BORACAY-AKLAN,MALAY,"D’MALL, BRGY. BALABAG, BORACAY ISLAND, MALAY, AKLAN",(036)2881808,,10/3/2026
REGION 6,Restaurant,DOT-R06-RST-03364-2024,BREAD BASKET BREAD AND PASTRIES SHOP,ILOILO CITY,ILOILO CITY,"THE GRID BUILDING, DONATO PISON AVE., BRGY. SAN RAFAEL, MANDURRIAO, ILOILO CITY",09512227152/09615914443,,10/21/2025
REGION 6,Restaurant,DOT-R06-RST-03800-2025,BREAKTHROUGH RESTAURANT INC.,ILOILO CITY,ILOILO CITY,"BRGY. SANTO NIÑO NORTE, AREVALO, ILOILO CITY",0917-794-2703,,1/15/2026
REGION 6,Restaurant,DOT-R06-RST-01898-2023,BUSAY RESTO,NEGROS OCCIDENTAL,LA CARLOTA CITY,"URIARTE SUBDIVISION, BRGY. III (POB.), LA CARLOTA CITY, NEGROS OCCIDENTAL",(034) 467-2298,,9/10/2025
REGION 6,Restaurant,DOT-R06-RST-04220-2025,C.H. CHICKEN HOUSE BACOLOD,BACOLOD CITY,BACOLOD CITY,"24TH LACSON ST. BRGY. 5 (POB), BACOLOD CITY, NEGROS OCCIDENTAL",4334623,,7/7/2026
REGION 6,Restaurant,DOT-R06-RST-02911-2024,CAFE DE NOTRE DAME,NEGROS OCCIDENTAL,TALISAY CITY,"BLK. 2 LOT 49, TRAFALGAR SQUARE, BRGY. ZONE 15, TALISAY CITY, NEGROS OCCIDENTAL",09603603056/ (034) 447 0844,,7/23/2026
REGION 6,Restaurant,DOT-R06-RST-00444-2021,CAFE DEL SOL,BORACAY-AKLAN,MALAY,"BRGY. BALABAG, MALAY, AKLAN",2.88E+06,,10/2/2026
REGION 6,Restaurant,DOT-R06-RST-04112-2025,CANADIANBEAVER BAR AND GRILL,CAPIZ,ROXAS CITY,"BRGY. BAYBAY, ROXAS CITY, CAPIZ",9946119043,,6/17/2026
REGION 6,Restaurant,DOT-R06-RST-00560-2021,CARMEL'S RESTAURANT,NEGROS OCCIDENTAL,SAN CARLOS CITY,"CL. LEDESMA AVE. BRGY.II POB, SAN CARLOS CITY, NEGROS OCCIDENTAL",9338181319,,7/15/2026
REGION 6,Restaurant,DOT-R06-RST-03878-2025,CASTAWAY RESTO BAR,AKLAN,NEW WASHINGTON,"BRGY. TAMBAK, NEW WASHINGTON, AKLAN",0967-254-7518,,12/2/2026
REGION 6,Restaurant,DOT-R06-RST-02983-2024,CHICK N' BELLY ROASTED CHICKEN AND LIEMPO HOUSE,NEGROS OCCIDENTAL,ESCALANTE CITY,"GAMAO ST. BRGY. BALINTAWAK, ESCALANTE CITY, NEGROS OCCIDENTAL",9055271683,,6/30/2026
REGION 6,Restaurant,DOT-R06-RST-02924-2024,CHILLIN SA BAYBAY SA DANAO SEAFOOD AND GRILL,NEGROS OCCIDENTAL,ESCALANTE CITY,"DANAO PORT BRGY. OLD POBLACION, ESCALANTE CITY, NEGROS OCCIDENTAL",9178018719,,7/28/2026
REGION 6,Restaurant,DOT-R06-RST-04217-2025,"CIBO, CAPITOL CENTRAL",BACOLOD CITY,BACOLOD CITY,"SPACE 1036 & 1051 1ST FLR. AYALA MALLS CAPITOL CENTRAL, BRGY. 8, BACOLOD CITY, NEGROS OCCIDENTAL",8911-9970,,7/7/2026
REGION 6,Restaurant,DOT-R06-RST-00426-2021,COCINA DE PUEBLO,CAPIZ,ROXAS CITY,"CIRCULO HILL COMPLEX, PUEBLO DE PANAY TOWNSHIP, BRGY. DINGINAN, ROXAS CITY, CAPIZ",9171677213,,4/7/2026
REGION 6,Restaurant,DOT-R06-RST-00426-2021,COCINA DE PUEBLO,CAPIZ,ROXAS CITY,"CIRCULO HILL COMPLEX, PUEBLO DE PANAY TOWNSHIP, BRGY. DINGINAN, ROXAS CITY, CAPIZ",0917-312-1498,,11/9/2025
REGION 6,Restaurant,DOT-R06-RST-00227-2021,COCO VERANDA BAR & RESTAURANT,CAPIZ,ROXAS CITY,"2882 SITIO LAWIS, BRGY. BAYBAY, ROXAS CITY, CAPIZ",0918-930-9087,,12/23/2025
REGION 6,Restaurant,DOT-R06-RST-03994-2025,COFFEE TALK COFFEE SHOP,NEGROS OCCIDENTAL,SAGAY CITY,"VILLA ANGELA SUBDIVISION BRGY. POBLACION II, SAGAY CITY, NEGROS OCCIDENTAL",9513444254,,4/29/2026
REGION 6,Restaurant,DOT-R06-RST-03166-2024,CUCINAITALIA INC.,BACOLOD CITY,BACOLOD CITY,"GROUND FLOOR PASEO VERDE, LACSON STREET, BRGY. MANDALAGAN, BACOLOD CITY",7032978,,11/9/2025
REGION 6,Restaurant,DOT-R06-RST-03710-2025,DADZ SEAFOOD AND GRILL,NEGROS OCCIDENTAL,SAGAY CITY,"PUROK CROSSING SAGAY, BRGY. POBLACION II, SAGAY CITY, NEGROS OCCIDENTAL",0962-485-5741,,3/1/2026
REGION 6,Restaurant,DOT-R06-RST-03861-2025,DAKU BALAY RESTOBAR,NEGROS OCCIDENTAL,CADIZ CITY,"PUROK LUMBALUMBA, M.H. DEL PILAR ST. BRGY. ZONE 6, CADIZ CITY, NEGROS OCCIDENTAL",0929-197-6763,,12/2/2026
REGION 6,Restaurant,DOT-R06-RST-03797-2025,DAPLI RESTAURANT,ILOILO CITY,ILOILO CITY,"LA SALETTE BLDG., VALERIA ST., BRGY. DANAO, ILOILO CITY",0917-794-2703,,1/15/2026
REGION 6,Restaurant,DOT-R06-RST-03798-2025,DAYNETO SEAFOOD GRILL AND RESTAURANT,ILOILO CITY,ILOILO CITY,"ZONE 6, BRGY BITOON, JARO, ILOILO CITY",0951-559-0832,,1/15/2026
REGION 6,Restaurant,DOT-R06-RST-01832-2023,DE LARROZA,ILOILO,LAMBUNAO,"PUROK 7, BRGY. MAITE GRANDE, LAMBUNAO, ILOILO",9399331276,,11/28/2025
REGION 6,Restaurant,DOT-R06-RST-03951-2025,DELCAN RESTAURANT,NEGROS OCCIDENTAL,CALATRAVA,"NATIONAL HIGHWAY BRGY. BANTAYANON, CALATRAVA, NEGROS OCCIDENTAL",9078023539,,3/28/2026
REGION 6,Restaurant,DOT-R06-RST-04161-2025,DT RESTAURANT,ILOILO,MIAGAO,"KIRAYAN NORTE, MIAGAO, ILOILO",9683728061,,7/15/2026
REGION 6,Restaurant,DOT-R06-RST-03468-2024,EL-FRIO CAFE,NEGROS OCCIDENTAL,HINOBA-AN,"J. EVANGELISTA STREET, BRGY. I (POB.), HINOBA-AN, NEGROS OCCIDENTAL",0956-511-0942,,10/25/2025
REGION 6,Restaurant,DOT-R06-RST-03249-2024,ELL BISTRO,NEGROS OCCIDENTAL,SAGAY CITY,"PUROK STAR APPLE, BRGY. VITO, SAGAY CITY, NEGROS OCCIDENTAL",9292562026,,2/10/2025
REGION 6,Restaurant,DOT-R06-RST-03185-2024,ENTING'S GRILL AND RESTAURANT,NEGROS OCCIDENTAL,SAGAY CITY,"KAUSWAGAN ROAD, BRGY. POBLACION II, SAGAY CITY, NEGROS OCCIDENTAL",0960-511-0838,,11/9/2025
REGION 6,Restaurant,DOT-R06-RST-00511-2021,EPIC BORACAY,BORACAY-AKLAN,MALAY,"D'MALL OF BORACAY, EPIC BEACHFRONT, BRGY. BALABAG, BORACAY ISLAND, MALAY, AKLAN",288-1477,,10/24/2025
REGION 6,Restaurant,DOT-R06-RST-03152-2024,EPICUREAN GROUP VENTURE INC.,BACOLOD CITY,BACOLOD CITY,"ANI BUILDING, BURI ROAD, BRGY. MANDALAGAN, BACOLOD CITY",0917-305-0388,,11/9/2025
REGION 6,Restaurant,DOT-R06-RST-02715-2024,ERON'S CANSI HOUSE,BACOLOD CITY,BACOLOD CITY,"#66 NARRA AVE., CAPITOL SHOPPING, VILLAMONTE, BACOLOD CITY, NEGROS OCCIDENTAL",9183170278,,7/23/2026
REGION 6,Restaurant,DOT-R06-RST-03804-2025,F E L I C I A ' S I N C.,BACOLOD CITY,BACOLOD CITY,"DOLL BLDG. 6TH LACSON ST., BRGY. 7 (POB.), BACOLOD CITY",(034) 433-6586,,1/21/2026
REGION 6,Restaurant,DOT-R06-RST-03854-2025,FERONIE FOOD PARK,NEGROS OCCIDENTAL,CADIZ CITY,"PUROK TAPON, BURGOS ST., BRGY. ZONE 5, CADIZ CITY, NEGROS OCCIDENTAL",(034) 493-1275,,12/2/2026
REGION 6,Restaurant,DOT-R06-RST-03258-2024,FINE DUST CAFE,ILOILO,BAROTAC NUEVO,"J.T. BRETANNA STREET ILAYA POBLACION, BAROTAC NUEVO, ILOILO",9171263162,,8/10/2025
REGION 6,Restaurant,DOT-R06-RST-04090-2025,FISHERMAN'S WHARF CA CAFE,GUIMARAS,SAN LORENZO,"BRGY.CABANO,SAN LORENZO,GUIMARAS",9177114614,,5/15/2026
REGION 6,Restaurant,DOT-R06-RST-03176-2024,FISHERS POND SEAFOOD AND GRILL,NEGROS OCCIDENTAL,SILAY CITY,"PUROK CAMUNSILAN, BRGY. BALARING, SILAY CITY, NEGROS OCCIDENTAL",0956- 403-9146,,11/9/2025
REGION 6,Restaurant,DOT-R06-RST-03969-2025,"FRESH START ORGANIC AND NATURAL STORE, INC.",BACOLOD CITY,BACOLOD CITY,SITIO ANING BRGY. PAHANOCOY BACOLOD CITY,9485877416,,3/28/2026
REGION 6,Restaurant,DOT-R06-RST-02599-2024,FUSHA FOOD HOUSE,GUIMARAS,SAN LORENZO,"PUROK PROPER BRGY. SAN ENRIQUE, SAN LORENZO, GUIMARAS",9171250016,,5/15/2026
REGION 6,Restaurant,DOT-R06-RST-03964-2025,GILIGAN'S RESTAURANT,BACOLOD CITY,BACOLOD CITY,"NORTH WING G/F, SM CITY BACOLOD BRGY.POB 12 BACOLOD CITY, NEGROS OCCIDENTAL",9223385905,,3/28/2026
REGION 6,Restaurant,DOT-R06-RST-03612-2024,GINA'S SEAFOODS RESTAURANT,BACOLOD CITY,BACOLOD CITY,"SAN JUAN STREET, BRGY. 10 (POB.), BACOLOD CITY",9204392581,,6/12/2025
REGION 6,Restaurant,DOT-R06-RST-03711-2025,GLENDA'S RESTAURANT,NEGROS OCCIDENTAL,SAGAY CITY,"MARAÑON STREET, BRGY. POBLACION II, SAGAY CITY, NEGROS OCCIDENTAL",0912-687-3306,,3/1/2026
REGION 6,Restaurant,DOT-R06-RST-03925-2025,GOLDEN 8 SKYLINE RESTAURANT,ANTIQUE,TOBIAS FORNIER,"BAGUMBAYAN, TOBIAS FORNIER, ANTIQUE",9778048023,,10/3/2026
REGION 6,Restaurant,DOT-R06-RST-03320-2024,GUIMAROAST CAFE,GUIMARAS,JORDAN,"SITIO SAL-AGAN, BRGY. POBLACION, JORDAN, GUIMARAS",09998870305/09627057590,,11/10/2025
REGION 6,Restaurant,DOT-R06-RST-00445-2021,HAMA JAPANESE CUISINE,BORACAY-AKLAN,MALAY,"D'MALL BORACAY BRGY. BALABAG, BORACAY ISLAND, MALAY, AKLAN",(036)2881808,,3/28/2026
REGION 6,Restaurant,DOT-R06-RST-03917-2025,HANZ OYSTERS HOUSE,AKLAN,NEW WASHINGTON,"BRGY.TAMBAK, NEW WASHINGTON, AKLAN",9464687799,,3/14/2026
REGION 6,Restaurant,DOT-R06-RST-03730-2025,HAPPY'S FOOD AND REFRESHMENT HUB,NEGROS OCCIDENTAL,CADIZ CITY,"SITIO MALUNHAO, BRGY. TIGLAWIGAN, CADIZ CITY, NEGROS OCCIDENTAL",0956-467-0516,,10/1/2026
REGION 6,Restaurant,DOT-R06-RST-03858-2025,HAYAHAY SEAFOOD RESTAURANT,NEGROS OCCIDENTAL,SAGAY CITY,"PUROK KULO, BRGY. VITO, SAGAY CITY, NEGROS OCCIDENTAL",0920-617-8973,,12/2/2026
REGION 6,Restaurant,DOT-R06-RST-03998-2025,HAYAHAY SEAFOODS GRILL,AKLAN,NEW WASHINGTON,BRGY. TAMBAK NEW WASHINGTON AKLAN,9090416725,,4/29/2026
REGION 6,Restaurant,DOT-R06-RST-03677-2025,HGT FOOD VENTURES CORP,BACOLOD CITY,BACOLOD CITY,"FATHER M. FERRERO STREET, BRGY. 12 (POB.), BACOLOD CITY",0933-854-5793,,3/1/2026
REGION 6,Restaurant,DOT-R06-RST-04088-2025,HUNASAN SEAFOOD HOUSE,BACOLOD CITY,BACOLOD CITY,"TENT 2, MARKETPLACE, VILLA ANGELA, BRGY. VILLAMONTE, BACOLOD CITY, NEGROS OCCIDENTAL",9101111181,,10/31/2026
REGION 6,Restaurant,DOT-R06-RST-04218-2025,INASAL DE ILONGGO GRILLHOUSE,BACOLOD CITY,BACOLOD CITY,"27TH LACSON ST. BRGY. 1 (POB), BACOLOD CITY, NEGROS OCCIDENTAL",9426808245,,7/7/2026
REGION 6,Restaurant,DOT-R06-RST-03276-2024,IZABELLA'S GRILL AND RESTAURANT,GUIMARAS,BUENAVISTA,"PUROK 5, BRGY. NEW POBLACION (CALINGAO), BUENAVISTA, GUIMARAS",9295461412,,8/10/2025
REGION 6,Restaurant,DOT-R06-RST-02663-2024,JD BAKERY CAFE,ILOILO,BAROTAC VIEJO,"LC BUILDING RIZAL ST., BRGY. POBLACION, BAROTAC VIEJO, ILOILO",9276884433,,7/15/2026
REGION 6,Restaurant,DOT-R06-RST-03165-2024,JOEY'S CAFE,NEGROS OCCIDENTAL,ESCALANTE CITY,"CARMELITE STREET, BRGY. BALINTAWAK (POB.), ESCALANTE CITY, NEGROS OCCIDENTAL",0920-540-1986,,11/9/2025
REGION 6,Restaurant,DOT-R06-RST-03360-2024,JUNCOOK RESTAURANT,ILOILO,BAROTAC NUEVO,"TERESOS, BRGY. ACUIT, BAROTAC NUEVO, ILOILO",9485934320,,10/21/2025
REGION 6,Restaurant,DOT-R06-RST-03725-2025,KALAYO RESTAURANT,NEGROS OCCIDENTAL,SIPALAY CITY,"CAMPOMANES BAY, BRGY. MARICALUM, SIPALAY CITY, NEGROS OCCIDENTAL",0917-638-6891,,10/1/2026
REGION 6,Restaurant,DOT-R06-RST-03183-2024,KAMALIG COFFEE SHOP,NEGROS OCCIDENTAL,SAGAY CITY,"PUROK 4 AGUILAR SUBDIVISION, POBLACION I (BARANGAY 1), SAGAY CITY, NEGROS OCCIDENTAL",0999-102-2561,,11/9/2025
REGION 6,Restaurant,DOT-R06-RST-03162-2024,KAPE TAMBAY,NEGROS OCCIDENTAL,SILAY CITY,"FREEDOM BOULEVARD, BRGY. III (POB.), SILAY CITY, NEGROS OCCIDENTAL",,,11/9/2025
REGION 6,Restaurant,DOT-R06-RST-03186-2024,KAPSILOGAN KIB COFFEE SHOP,NEGROS OCCIDENTAL,SAGAY CITY,"JISON STREET, BRGY. POBLACION II, SAGAY CITY, NEGROS OCCIDENTAL",0963-040-7213,,11/9/2025
REGION 6,Restaurant,DOT-R06-RST-03453-2024,KEEKA POKE BAR AND RESTAURANTS,BACOLOD CITY,BACOLOD CITY,"UNIT 102 ANI BLDG., BURI ROAD, BRGY. MANDALAGAN, BACOLOD CITY",9985373916,,10/24/2025
REGION 6,Restaurant,DOT-R06-RST-03177-2024,KOPIDOK COFFEE SHOP,NEGROS OCCIDENTAL,ESCALANTE CITY,"PUROK JASMIN, BRGY. BALINTAWAK (POB.), ESCALANTE CITY, NEGROS OCCIDENTAL",0926-680-4582,,11/9/2025
REGION 6,Restaurant,DOT-R06-RST-02083-2023,KYLA'S BAR & GRILL (MANOKAN),NEGROS OCCIDENTAL,SIPALAY CITY,"FOOD PARK, BRGY. 2 (POB.), SIPALAY CITY, NEGROS OCCIDENTAL",0968-445-4783,,10/28/2025
REGION 6,Restaurant,DOT-R06-RST-02082-2023,KYLA'S RESTAURANT,NEGROS OCCIDENTAL,SIPALAY CITY,"BRGY. 1 (POB.), SIPALAY CITY, NEGROS OCCIDENTAL",0968-445-4783,,10/28/2025
REGION 6,Restaurant,DOT-R06-RST-03420-2024,LA ANOBA RESTAURANT,NEGROS OCCIDENTAL,SIPALAY CITY,"FOOD PARK, BRGY. 2 (POB.), SIPALAY CITY, NEGROS OCCIDENTAL",9070878917,,10/24/2025
REGION 6,Restaurant,DOT-R06-RST-03727-2025,LA ANOBA RESTAURANT,NEGROS OCCIDENTAL,SIPALAY CITY,"FOOD PARK, BRGY. 2 (POB.), SIPALAY CITY, NEGROS OCCIDENTAL",0907-087-8917,,10/1/2026
REGION 6,Restaurant,DOT-R06-RST-04034-2025,LA MAISON DU LEGANES FRENCH BISTRO AND CAFE,ILOILO,LEGANES,"CALLE PROGRESO, BRGY.GUINOBATAN, LEGANES, ILOILO",9660557050,,2/5/2026
REGION 6,Restaurant,DOT-R06-RST-03940-2025,LA MARING'S RESTAURANT OPC,ILOILO,LAMBUNAO,"BRGY.GINES, LAMBUNAO, ILOILO",0917 117 8147,,10/3/2026
REGION 6,Restaurant,DOT-R06-RST-03962-2025,LA NENE RESTAURANT,NEGROS OCCIDENTAL,CALATRAVA,"MINGLANILLA STREET, BRGY. A SUBA (POB.), CALATRAVA, NEGROS OCCIDENTAL",9952398426,,3/28/2026
REGION 6,Restaurant,DOT-R06-RST-03510-2024,LANTERNA HOTEL AND RESTAURANT,BORACAY-AKLAN,MALAY,"ZONE V, BOLABOG ROAD, BRGY. BALABAG, BORACAY ISLAND, MALAY, AKLAN",0929-154-1533,,8/11/2025
REGION 6,Restaurant,DOT-R06-RST-00679-2025,LATTE COFFEE CAFE,AKLAN,KALIBO,"#53 STA. MONICA, ANDAGAO, KALIBO, AKLAN",(036) 268-8898,,12/3/2026
REGION 6,Restaurant,DOT-R06-RST-01765-2023,LATTE COFFEE CAFE,ILOILO CITY,ILOILO CITY,"RIZALINA PIZON AVENUE, BOARDWALK BRGY. SAN RAFAEL, ILOILO CITY",(036) 268-8898,,6/24/2026
REGION 6,Restaurant,DOT-R06-RST-03731-2025,LAURA JOY GRILL AND RESTO BAR,NEGROS OCCIDENTAL,CADIZ CITY,"LAURA HOTEL, VILLENA ST., BRGY. 2 POB. (ZONE 2), CADIZ CITY, NEGROS OCCIDENTAL",0956-576-9743,,10/1/2026
REGION 6,Restaurant,DOT-R06-RST-03846-2025,LISA'S OCEANSIDE RESTAURANT,GUIMARAS,SIBUNAG,"SITIO MAABAY, BRGY.SEBASTE, SIBUNAG, GUIMARAS",0917-106-2586,,10/2/2026
REGION 6,Restaurant,DOT-R06-RST-04176-2025,LOUISE CAKES AND PASTRIES,BACOLOD CITY,BACOLOD CITY,"ST. FRANCIS ST. BRYGY. TACULING, BACOLOD CITY , NEGROS OCCIDENTAL",9985686556,,7/23/2026
REGION 6,Restaurant,DOT-R06-RST-03532-2024,LOVE & KISSES PIZZA PIES,ILOILO CITY,ILOILO CITY,"JALANDONI ST., BRGY. VILLA ANITA, ILOILO CITY",9696459060,,12/11/2025
REGION 6,Restaurant,DOT-R06-RST-04000-2025,MAKARIOS RESTAURANT,GUIMARAS,NUEVA VALENCIA,SITIO PROPER BRGY.TANDO NUEVA VALENCIA GUIMARAS,9633009607,,4/29/2026
REGION 6,Restaurant,DOT-R06-RST-03275-2024,MALEIA CAFE,ILOILO,BAROTAC NUEVO,"BRGY. ACUIT, BAROTAC NUEVO, ILOILO",9208904772,,8/10/2025
REGION 6,Restaurant,DOT-R06-RST-03884-2025,MAMA AURING FOOD GARDEN RESTAURANT,NEGROS OCCIDENTAL,SAGAY CITY,"PUROK MANZANILLA, BRGY. OLD SAGAY, SAGAY CITY, NEGROS OCCIDENTAL",0920-890-2538,,2/27/2026
REGION 6,Restaurant,DOT-R06-RST-03659-2024,MANG-O IS-LAND CAFE,GUIMARAS,JORDAN,"HORIZON SOUTHPARK SPACE LEASING, BRGY. SAN MIGUEL, JORDAN, GUIMARAS",9309342742,,12/12/2025
REGION 6,Restaurant,DOT-R06-RST-03860-2025,MARNICALICIOUS EATERY,NEGROS OCCIDENTAL,SAGAY CITY,"QUEZON ST. BRGY. POBLACION I, SAGAY CITY, NEGROS OCCIDENTAL",0930-240-4595,,12/2/2026
REGION 6,Restaurant,DOT-R06-RST-03425-2024,MAU'S TRAP,ILOILO CITY,ILOILO CITY,"2/F G-PARK, GAISANO ICC, BENIGNO AQUINO AVENUE, BRGY. SAN RAFAEL, MANDURRIOA, ILOILO CITY",3398754,,10/24/2025
REGION 6,Restaurant,DOT-R06-RST-03997-2025,MAURO'S,AKLAN,NUMANCIA,"BRGY.BULWANG, NUMANCIA, AKLAN",(036) 272-7773,,4/29/2026
REGION 6,Restaurant,DOT-R06-RST-02235-2023,MIKEL AND RANDY'S TALABAHAN,AKLAN,NEW WASHINGTON,"BRGY. TAMBAK, NEW WASHINGTON, AKLAN",9855097806,,6/12/2025
REGION 6,Restaurant,DOT-R06-RST-04137-2025,MILA'S SNACKS & COMMODITY STORE,NEGROS OCCIDENTAL,HINIGARAN,"RIZAL ST. BRGY. IV POB., HINIGARAN, NEGROS OCCIDENTAL",9338790639,,9/7/2026
REGION 6,Restaurant,DOT-R06-RST-00728-2022,MIMI'S FASTFOOD AND SNACK HAUS,NEGROS OCCIDENTAL,CADIZ CITY,"ABELARDE ST., BRGY. 3 POB. (ZONE 3), CADIZ CITY, NEGROS OCCIDENTAL",9399166632,,10/24/2025
REGION 6,Restaurant,DOT-R06-RST-04194-2025,MOM ROSE GRILL AND RESTAURANT,BACOLOD CITY,BACOLOD CITY,"PUROK MAINUSWAGON, BRGY.ALIJIS, BACOLOD CITY, NEGROS OCCIDENTAL",9989818080,,7/28/2026
REGION 6,Restaurant,DOT-R06-RST-03781-2025,MOM'S SMALL HOTEL AND RESTAURANT,NEGROS OCCIDENTAL,SAN CARLOS CITY,"F.C LEDESMA AVE.,SAN JULIO SUBD., BRGY. II, SAN CARLOS CITY, NEGROS OCCIDENTAL",0927-697-3031,,10/1/2026
REGION 6,Restaurant,DOT-R06-RST-00844-2022,NATURE'S VILLAGE RESORT,NEGROS OCCIDENTAL,TALISAY CITY,"BRGY. ZONE 15 (POB), TALISAY HIGHWAY, TALISAY CITY, NEGROS OCCIDENTAL",(034)495-0808,,7/7/2026
REGION 6,Restaurant,DOT-R06-RST-04216-2025,NEGROSANON COMFORT FOODS INC./SANDOKCOMFORT FOOD,BACOLOD CITY,BACOLOD CITY,"C-20 NARRA AVE. CAPITOL SHOPPING BRGY. VILLAMONTE BACOLOD CITY, NEGROS OCCIDENTAL",034-7032513,,7/7/2026
REGION 6,Restaurant,DOT-R06-RST-00425-2021,NIGI NIGI NU NOOS 'E' NU NU NOOS BAR & RESTAURANT,BORACAY-AKLAN,MALAY,"SITIO MANGGAYAD BRGY. BALABAG BORACAY MALAY, AKLAN",362883101,,4/29/2026
REGION 6,Restaurant,DOT-R06-RST-00876-2022,NONOY BISTRO,NEGROS OCCIDENTAL,LA CASTELLANA,"NONOY ABENDAN FARM, BRGY. BIAKNABATO, LA CASTELLANA, NEGROS OCCIDENTAL",9206096168,,7/23/2026
REGION 6,Restaurant,DOT-R06-RST-03996-2025,OLIVIA'S KITCHEN & ISLAND BREW RESTAURANT OPC,GUIMARAS,JORDAN,"VN GRANDE BUILDING, ISLANDER VILLAGE BRGY. SAN MIGUEL, JORDAN, GUIMARAS",9498209735,,4/29/2026
REGION 6,Restaurant,DOT-R06-RST-03965-2025,PA-TAWHAY FOOD AND REFRESHMENT HUB,NEGROS OCCIDENTAL,SAGAY CITY,"PUROK MANZANILLA, BRGY. OLD SAGAY, SAGAY CITY NEGROS OCCIDENTAL",9630140112,,3/28/2026
REGION 6,Restaurant,DOT-R06-RST-03505-2024,PARAW BEACH CLUB,BORACAY-AKLAN,MALAY,"STATION 1, BRGY. BALABAG, BORACAY ISLAND, MALAY, AKLAN",0947-774-1835,,7/11/2025
REGION 6,Restaurant,DOT-R06-RST-02665-2024,PAULINE'S CUPE COFFEE SHOP,ILOILO,PASSI CITY,"SABLOGON BRGY. POBLACION ILAYA ,PASSI CITY, ILOILO",9502271347,,4/30/2026
REGION 6,Restaurant,DOT-R06-RST-03859-2025,PAVJ WINGS N' THINGS RESTAURANT,NEGROS OCCIDENTAL,SAGAY CITY,"MARAÑON ST. BRGY. POBLACION II, SAGAY CITY, NEGROS OCCIDENTAL",0977-755-9878,,12/2/2026
REGION 6,Restaurant,DOT-R06-RST-00969-2022,PERCY,BORACAY-AKLAN,MALAY,"ZONE IV, BRGY. BALABAG, BORACAY ISLAND, MALAY, AKLAN",(036) 288-3797,,3/1/2026
REGION 6,Restaurant,DOT-R06-RST-04192-2025,PINCH CAFE,NEGROS OCCIDENTAL,ESCALANTE CITY,"PUROK BEGONIA 2, BRGY. BALINTAWAK (POB.), ESCALANTE CITY, NEGROS OCCIDENTAL",9271564980,,7/28/2026
REGION 6,Restaurant,DOT-R06-RST-02973-2024,PIZZA FLAVORS CUISINE,ILOILO,MIAGAO,"2F NISMAL BUILDING, LAMBERTO ST. BRGY. BAYBAY NORTE (POB.), MIAGAO, ILOILO",9660524033,,11/7/2026
REGION 6,Restaurant,DOT-R06-RST-03796-2025,PLATED RESTAURANT,ILOILO CITY,ILOILO CITY,"21 Q ABETO STREET, BRGY. ABETO MIRASOL TAFT SOUTH (QUIRINO ABETO), MANDURRIAO, ILOILO CITY",0917-167-5665,,1/15/2026
REGION 6,Restaurant,DOT-R06-RST-03799-2025,PONSYON,ILOILO CITY,ILOILO CITY,"PLAZUELA DE ILOILO, DIVERSION RD., BRGY. SAN RAFAEL, MANDURRIAO, ILOILO CITY",0917-794-2703,,1/15/2026
