Region,Enterprise Type,Accreditation No,Enterprise Name,Province,Municipality,Business Address,Contact Numbers,Business Website,Accreditation Validity
Region 1,Mabuhay Accommodation,DOT-R01-MAB-00495-2021,KYLAH TRANSIENT HOUSE,Pangasinan,Alaminos City,"Highway Lucap, Alaminos City, Pangasinan",9272343953,,"October 31, 2026"
Region 1,Mabuhay Accommodation,DOT-R01-MAB-00493-2021,ED TRANSIENT HOUSE,Pangasinan,Alaminos City,"Sitio Recudo, Lucap, Alaminos City, Pangasinan",9212986642,,"October 31, 2026"
Region 1,Mabuhay Accommodation,DOT-R01-MAB-01100-2022,VIEVAN'S TRANSIENT HOUSE,Pangasinan,Alaminos City,"Bued, Alaminos City, Pangasinan",9279562764,,"October 31, 2026"
Region 1,Mabuhay Accommodation,DOT-R01-MAB-02652-2025,CASOLARES BEACH RESORT,Pangasinan,Bolinao,"PATAR, BOLINAO PANGASINAN",9451884125,,"October 31, 2026"
Region 1,Mabuhay Accommodation,DOT-R01-MAB-02659-2025,CAMP PUOR CAMPING SITE RENTAL,Pangasinan,Bolinao,"Tupa, Bolinao,Pangasinan,Phil",9564165561,,"October 31, 2025"
Region 1,Mabuhay Accommodation,DOT-R01-MAB-00304-2021,MIA AL MAR RESORT,Pangasinan,Bolinao,"Purok1 Patar Road, Patar, Bolinao, Pangasinan",9563507037,,"October 31, 2026"
Region 1,Mabuhay Accommodation,DOT-R01-MAB-00299-2021,RACNIEL BEACH HOUSE RENTAL,Pangasinan,Bolinao,"Purok 2, Ilog-Malino, Bolinao, Pangasinan",9062165691,,"October 31, 2026"
Region 1,Mabuhay Accommodation,DOT-R01-MAB-00536-2021,CAHIGAS BEACH RESORT,Pangasinan,Anda,"Tondol, Anda, Pangasinan",09260758017/09102625643,,"October 31, 2026"
Region 1,Mabuhay Accommodation,DOT-R01-MAB-02678-2025,ARLYNS SUNSET' BEACH RESORT,Pangasinan,Dasol,Purok 5 Barangay Tambobong Dasol Pangasinan,9772512255,,"October 31, 2026"
Region 1,Mabuhay Accommodation,DOT-R01-MAB-02679-2025,MERGIE'S BEACH HOUSE,Pangasinan,Anda,"Tondol, Anda,Pangasinan",9662657844,,"October 31, 2026"
Region 1,Mabuhay Accommodation,DOT-R01-MAB-02680-2025,MYKONOS RESORT,Pangasinan,Anda,"Purok 2, Tondol, Anda Pangasinan",9190900755,,"October 31, 2026"
Region 1,Mabuhay Accommodation,DOT-R01-MAB-01031-2022,KAIHANA RESORT,Pangasinan,Anda,"Purok 2, Tondol, Anda Pangasinan",9175028848,,"October 31, 2026"
Region 1,Mabuhay Accommodation,DOT-R01-MAB-02693-2025,PERTIBLE BEACH RESORT,Pangasinan,Anda,"Tondol, Anda, Pangasinan",9105285878,,"October 31, 2026"
Region 1,Mabuhay Accommodation,DOT-R01-MAB-00654-2021,MYL TRANSIENT ROOM,Pangasinan,Bolinao,"MYL'S TRANSIENT, ABRAC PATAR BEACH, PATAR, BOLINAO, PANGASINAN",9057690952,,"October 31, 2026"
Region 1,Mabuhay Accommodation,DOT-R01-MAB-02701-2025,R AND M BEACH RESORT,Pangasinan,Anda,TONDOL ANDA PANGASINAN,9216292678,,"October 31, 2025"
Region 1,Mabuhay Accommodation,DOT-R01-MAB-01654-2023,RESIDENZA CIPRES BEACH HOUSE,Pangasinan,Anda,Tondol Anda Pangasinan,912354526,,"October 31, 2026"
Region 1,Mabuhay Accommodation,DOT-R01-MAB-01061-2022,PUERTO DEL BAHER BEACH RESORT,Pangasinan,Burgos,"Sitio Cabongaoan, Brgy., Ilio Ilio, Burgos, Pangasinan",9652063331,,"October 31, 2026"
Region 1,Mabuhay Accommodation,DOT-R01-MAB-01703-2023,WESTCOAST DASOL BEACH RESORT,Pangasinan,Dasol,"PUROK UNO BRGY. TAMBOBONG DASOL, PANGASINAN",9090930178,,"October 31, 2026"
Region 1,Mabuhay Accommodation,DOT-R01-MAB-02786-2025,NABUA BEACH HOUSE,Pangasinan,Anda,"Purok 2, Tondol, Anda Pangasinan",9501088425,,"October 31, 2025"
Region 1,Mabuhay Accommodation,DOT-R01-MAB-00265-2021,ZENERIX TRANSIENT HOUSE,Pangasinan,Alaminos City,"Lucap, Alaminos City, Pangasinan",9182534095,,"October 31, 2025"
Region 1,Mabuhay Accommodation,DOT-R01-MAB-00819-2022,CASA CAROLINA BEACH RESORT,Pangasinan,Bolinao,Patar Bolinao Pangasinan,"09516772497 , 09270486584",,"October 31, 2026"
Region 1,Mabuhay Accommodation,DOT-R01-MAB-02795-2025,4AтАЩS BEACH RESORT,Pangasinan,Anda,"Purok 3, Tondol, Anda Pangasinan",9177250823,,"October 31, 2025"
Region 1,Mabuhay Accommodation,DOT-R01-MAB-01511-2023,BOLO SEACOAST RESORT,Pangasinan,Alaminos City,"Bolo II-Pandan, Alaminos City, Pangasinan",9164807613,,"October 31, 2026"
Region 1,Mabuhay Accommodation,DOT-R01-MAB-01077-2022,S&C BEACH RESORT,Pangasinan,Anda,"Purok 2, Tondol, Anda, Pangasinan",0908-8930299,,"October 31, 2026"
Region 1,Mabuhay Accommodation,DOT-R01-MAB-02810-2025,L-REY BEACH HOUSE,Pangasinan,Bolinao,"Patar, Bolinao, Pangasinan",9993707041,,"October 31, 2026"
Region 1,Mabuhay Accommodation,DOT-R01-MAB-02811-2025,VERLING'S BEACH RESORT,Pangasinan,Bolinao,"Brgy.Estanza,Bolinao Pang.",9455879734,,"October 31, 2026"
Region 1,Mabuhay Accommodation,DOT-R01-MAB-02821-2025,MAC VAN MAE BEACH RESORT,Pangasinan,Bolinao,"PATAR, BOLINAO PANGASINAN",9977959527,,"October 31, 2026"
Region 1,Mabuhay Accommodation,DOT-R01-MAB-00113-2021,LIBERTY BEACH RESORT,Pangasinan,Bolinao,"Ilog Malino, Bolinao, Pangasinan",9055314058,,"October 31, 2026"
Region 1,Mabuhay Accommodation,DOT-R01-MAB-02872-2025,KURDAPIA RESORT,Pangasinan,Bolinao,"ESTANZA,BOLINAO, PANGASINAN",9996952608,,"October 31, 2026"
Region 1,Mabuhay Accommodation,DOT-R01-MAB-00829-2022,AMS BEACH RESORT,Pangasinan,Bolinao,"Purok 2, Ilogmalino, Bolinao, Pangasinan",9994225731,,"October 31, 2026"
Region 1,Mabuhay Accommodation,DOT-R01-MAB-02879-2025,USON BEACH RESORT,Pangasinan,Alaminos City,"Bolo II, Brgy. Pandan, Alaminos City, Pangasinan",0927 425 9966,,"October 31, 2026"
Region 1,Mabuhay Accommodation,DOT-R01-MAB-02884-2025,CRIS DEL MAR RESORT,Pangasinan,Bolinao,"CABATUAN STREET, LUCIENTE 1.0, BOLINAO, PANGASINAN",9187771583,,"October 31, 2026"
Region 1,Mabuhay Accommodation,DOT-R01-MAB-01048-2022,PEARLCASA RESORT,Pangasinan,Bolinao,"Patar Bolinao, Pangasinan",9383927181,,"October 31, 2026"
Region 1,Mabuhay Accommodation,DOT-R01-MAB-00983-2022,EF-MAR BEACH RESORT,Pangasinan,Dasol,"PUROK ILANG - ILANG, Macalang, Dasol, Pangasinan",9999905133,,"October 31, 2026"
Region 1,Mabuhay Accommodation,DOT-R01-MAB-01058-2022,INSON'S PLACE ROOM RENTAL,Pangasinan,Bolinao,"BRGY. PATAR, BOLINAO, PANGASINAN",9952528179,,"October 31, 2026"
Region 1,Mabuhay Accommodation,DOT-R01-MAB-00488-2021,OSME├СA BEACH RESORT,Pangasinan,Dasol,"Purok 2, Osme├▒a, Dasol, Pangasinan",9955506432,,"October 31, 2026"
Region 1,Mabuhay Accommodation,DOT-R01-MAB-02250-2024,CASA DEL CAMBA HOTEL AND RESTAURANT,Pangasinan,Alaminos City,"San Jose Drive, Lucap, Alaminos City, Pangasinan","0756368065, 09477909186",,"October 31, 2026"
Region 1,Mabuhay Accommodation,DOT-R01-MAB-03008-2025,AUSTRALASIA RESORT,Pangasinan,Bolinao,"BALINGASAY, BOLINAO, PANGASINAN",9602607986,,"October 31, 2026"
Region 1,Mabuhay Accommodation,DOT-R01-MAB-03014-2025,JP BAYBAY VIEW RESORT,Pangasinan,Bolinao,"PATAR, BOLINAO PANGASINAN",9219125953,,"October 31, 2025"
Region 1,Mabuhay Accommodation,DOT-R01-MAB-03017-2025,CAADIANG TRANSIENT HOUSE,Pangasinan,Anda,"Purok 3 Brgy. Tondol, Anda, Pangasinan",09674672891/09606231219,,"October 31, 2025"
Region 1,Mabuhay Accommodation,DOT-R01-MAB-01046-2022,NOE'S ARKO BEACH RESORT,Pangasinan,Bolinao,"Patar, Bolinao, Pangasinan",9178140674,,"October 31, 2026"
Region 1,Mabuhay Accommodation,DOT-R01-MAB-01071-2022,ZOHRA'S ROOM RENTAL,Pangasinan,Anda,"Purok 2, Tondol, Anda, Pangasinan",9274281789,,"October 31, 2026"
Region 1,Mabuhay Accommodation,DOT-R01-MAB-01042-2022,D' SIX L BEACH RESORT,Pangasinan,Burgos,"Sitio Cabongaoan, Brgy., Ilio Ilio, Burgos, Pangasinan",9556081722,,"October 31, 2025"
Region 1,Mabuhay Accommodation,DOT-R01-MAB-03021-2025,ROVEN'S PLACE BEACH RESORT,Pangasinan,Burgos,"Sitio Cabongaoan, Brgy., Ilio-Ilio, Burgos, Pangasinan",9279957606,,"October 31, 2025"
Region 1,Mabuhay Accommodation,DOT-R01-MAB-03035-2025,VILLA GARCIA BEACH HOUSE,Pangasinan,Anda,TONDOL ANDA PANGASINAN,9984559488,,"October 31, 2026"
Region 1,Mabuhay Accommodation,DOT-R01-MAB-03052-2025,AMIGOтАЩS RESORT,Pangasinan,Anda,"purok 2, Tondol, Anda, Pangasinan",9984312787,,"October 31, 2026"
Region 1,Mabuhay Accommodation,DOT-R01-MAB-03053-2025,JULIT BAY VIEW BEACH HOUSE,Pangasinan,Dasol,Tambobong dasol pangasinan,9460852936,,"October 31, 2025"
Region 1,Mabuhay Accommodation,DOT-R01-MAB-03080-2025,ZILLA'S GUEST HOUSE,Pangasinan,Bolinao,"BALINGASAY, BOLINAO, PANGASINAN",9567887929,,"October 31, 2026"
Region 1,Mabuhay Accommodation,DOT-R01-MAB-01577-2023,DE VERA'S RESORT,Pangasinan,Bolinao,"Purok 3, Ilogmalino, Bolinao, Pangasinan",9686815996,,"October 31, 2026"
Region 1,Mabuhay Accommodation,DOT-R01-MAB-03085-2025,DCD GOLDEN SANDS RESORT,Pangasinan,Bolinao,"golden sands resort, Patar, Bolinao, Pangasinan",9954201644,,"October 31, 2026"
Region 1,Mabuhay Accommodation,DOT-R01-MAB-03094-2025,BALAIVALENCIA BEACH HOUSE,Pangasinan,Bolinao,Patar Road Barangay Purok 3 Ilog Malino,9189497731,,"October 31, 2025"
Region 1,Resort,DOT-R01-RES-00566-2021,PANGIL BEACH RESORT,Ilocos Norte,Currimao,"Barangay 20, Pangil, Currimao, Ilocos Norte",(077) 600-4202,,"October 31, 2026"
Region 1,Resort,DOT-R01-RES-01653-2023,AMICI RESORT HOTEL,Ilocos Norte,Laoag,"Brgy. No. 41, Balacad, Laoag City, Ilocos Norte",9088960808,,"October 31, 2026"
Region 1,Resort,DOT-R01-RES-01208-2022,UKL EVER RESORT HOTEL,Ilocos Norte,Laoag,"Brgy. 46, Nalbo, Airport Road, Laoag City, Ilocos Norte",09084458117/09951973322,,"October 31, 2026"
Region 1,Resort,DOT-R01-RES-00399-2021,"FORT ILOCANDIA LAND DEVELOPMENT CO., LTD",Ilocos Norte,Laoag,"Bgy. No. 37, Calayab, Laoag City, Ilocos Norte",0917 599 4863,https://fortilocandia.com.ph/,"October 31, 2026"
Region 1,Resort,DOT-R01-RES-01385-2022,"ALTA VISTA ILOCANDIA, INC",Ilocos Norte,Pagudpud,"Sitio Ayoyo, Brgy. Caparispisan, Pagudpud, Ilocos Norte",9173089084,,"October 31, 2026"
Region 1,Resort,DOT-R01-RES-01268-2022,CASA VICTORIA RESORT AND RESTAURANT,Ilocos Norte,Pagudpud,"Sitio Del Mar, Brgy. Saud, Pagudpud, Ilocos Norte",09088696434/09175051462,,"October 31, 2026"
Region 1,Resort,DOT-R01-RES-01362-2022,PANNZIAN BEACH AND MOUNTAIN RESORT,Ilocos Norte,Pagudpud,"Brgy. Pancian, Pagudpud, Ilocos Norte",09209520662/ 0286469020 /09088823992,,"October 31, 2026"
Region 1,Resort,DOT-R01-RES-01711-2023,PAOAY LAKE JLP RESORT,Ilocos Norte,Paoay,"National Highway, Brgy. Suba, Paoay, Ilocos Norte",9541882991,,"October 31, 2026"
Region 1,Resort,DOT-R01-RES-00178-2021,BAN-AW RESORT,Ilocos Sur,Candon City,"Bagani Gabor, Candon City, Ilocos Sur",9177999181,http://www.banawresort.com,"October 31, 2026"
Region 1,Resort,DOT-R01-RES-00555-2021,ICHTHUS BEACH RESORT,Ilocos Sur,Magsingal,"Alangan, Magsingal, Ilocos Sur",9177777679,,"October 31, 2026"
Region 1,Resort,DOT-R01-RES-00211-2021,OVEMAR RESORT HOTEL INC,Ilocos Sur,Santa Catalina,"Paratong, Santa Catalina, Ilocos Sur",09177990506/ 6042400,,"October 31, 2026"
Region 1,Resort,DOT-R01-RES-00423-2021,VITALIS WHITESANDS,Ilocos Sur,Santiago,"Brgy. Sabangan, Santiago, Ilocos Sur",9778845527,http://vitaliswhitesands.com/,"October 31, 2026"
Region 1,Resort,DOT-R01-RES-03005-2025,VITALIS VILLAS,Ilocos Sur,Santiago,"Brgy. Sabangan, Santiago, Ilocos Sur",9165522794,,"October 31, 2026"
Region 1,Resort,DOT-R01-RES-00016-2020,C & A Paradiso Beach Resort,La Union,Aringay,Maryland,9276860249,,"October 31, 2026"
Region 1,Resort,DOT-R01-RES-00500-2021,SUNSET GERMAN BEACH RESORT & RESTAURANT,La Union,San Juan,290 Kingfisher Ili - Norte San Juan La - Union,99179212420,,"October 31, 2026"
Region 1,Resort,DOT-R01-RES-00020-2020,SAN LUIS DEL MAR,La Union,Bauang,"BACCUIT NORTE, BAUANG, LA UNION",09178507536 / (072) 607 9683,,"October 31, 2026"
Region 1,Resort,DOT-R01-RES-00054-2021,Villa Navarro Beach Resort.Village,La Union,Caba,"Santiago Norte, Caba, La Union",9175642513,,"October 31, 2026"
Region 1,Resort,DOT-R01-RES-00317-2021,K3MM CORPORATION,La Union,Pugo,"Pugo Resort and Adventure Park, Sitio Kagaling",9175066931,,"October 31, 2026"
Region 1,Resort,DOT-R01-RES-00013-2020,AUREO LA UNION,La Union,San Fernando City,SHIPSIDE HOUSING AREA,9178275799,http://www.aureohotels.com,"October 31, 2026"
Region 1,Resort,DOT-R01-RES-00329-2021,LA UNION BLUE MARLIN RESORT,La Union,San Fernando City,"Purok 4, Canaoay West, City of San Fernando, La Union",9954588313,,"October 31, 2026"
Region 1,Resort,DOT-R01-RES-00965-2022,YNAD'S PLACE HOTEL AND RESORT,La Union,San Fernando City,"BYPASS ROAD, PUROK 1",9288306350,,"October 31, 2026"
Region 1,Resort,DOT-R01-RES-00010-2020,"Kahuna Hotel, Cafe, and Restaurant, Inc.",La Union,San Juan,"National Highway, Brgy. Urbiztondo, San Juan, La Union, PHILIPPINES",9178300363,https://www.kahunaresort.com/,"October 31, 2026"
Region 1,Resort,DOT-R01-RES-02472-2024,P and M Final Option Beach Resort Inc.,La Union,San Juan,#320 Eagle Street,9294485505,,"October 31, 2026"
Region 1,Resort,DOT-R01-RES-00093-2021,SAN JUAN RESORT DEVELOPMENT AND MANAGEMENT CORPORATION,La Union,San Juan,"ILI SUR, SAN JUAN , LA UINON",072-6828396,,"October 31, 2026"
Region 1,Resort,DOT-R01-RES-00570-2021,COACH-KREEZ-PLACE AND RESORT,La Union,Bangar,"SECTOR 6, Brgy. Paratong",9541665166,,"October 31, 2026"
Region 1,Resort,DOT-R01-RES-02495-2024,JADE RESORT,La Union,Bauang,Brgy. Payocpoc Sur,9672701055,,"October 31, 2026"
Region 1,Resort,DOT-R01-RES-00174-2021,INFINITY GARDEN RESORT HOTEL AND PAVILLION,La Union,Agoo,"Infinity Garden Resort, Don Eufranio St., Brgy. San Nicolas East",9171503449,,"October 31, 2026"
Region 1,Resort,DOT-R01-RES-00244-2021,SOLARENA SEASIDE RESORT INC,La Union,Caba,"Manahan Compound, Coastal Road, Brgy. San Carlos, Caba, La Union",#ERROR!,,"October 31, 2026"
Region 1,Resort,DOT-R01-RES-01221-2022,HOTEL45 BEACH RESORT AND RESTAURANT,La Union,Bauang,"Mc Arthur Highway, Brgy. Paringao, Bauang, La Union",9178290075,,"October 31, 2026"
Region 1,Resort,DOT-R01-RES-00344-2021,KULTURA SPLASH WAVE,La Union,Pugo,"Km. 251. Brgy. Cares Pugo, La Union",9063319969,,"October 31, 2026"
Region 1,Resort,DOT-R01-RES-01579-2023,MARAND RESORT 2,La Union,Bauang,"BRGY. BACCUIT SUR, BAUANG , LA UNION",(072) 8881697,,"October 31, 2026"
Region 1,Resort,DOT-R01-RES-00247-2021,SEBAY RESORT & ENTERTAINMENT CENTER,La Union,San Juan,"URBIZTONDO, SAN JUAN, LA UNION",9176401118,,"October 31, 2026"
Region 1,Resort,DOT-R01-RES-00267-2021,GO RESORT,La Union,Bauang,"Purok 4, Brgy. Paringao, Bauang, La Union",9196107779,,"October 31, 2026"
Region 1,Resort,DOT-R01-RES-00051-2020,VILLA D' EL-LITA HOTEL AND RESTAURANT,La Union,Sudipen,"National Highway, Brgy. Ipet, Sudipen, La Union",0926-727-8726/0999-990-0386,,"October 31, 2026"
Region 1,Resort,DOT-R01-RES-02084-2024,ORDONO FARM RESORT,La Union,Balaoan,"Barangay Cabuaan, Balaoan, La Union",9209072984,,"October 31, 2026"
Region 1,Resort,DOT-R01-RES-01288-2022,THUNDERBIRD PILIPINAS HOTELS AND RESORTS INC.,La Union,San Fernando City,"VOA PENNSYLVANIA AVENUE, PORO POINT SAN FERNANDO , LA UNION",9178085045,,"October 31, 2026"
Region 1,Resort,DOT-R01-RES-02983-2025,VISTA LA VITA,La Union,San Fernando City,"California Ave., Canaoay, San Fernando City, La Union",09175000033/072-607-1469,,"October 31, 2026"
Region 1,Resort,DOT-R01-RES-00966-2022,VILLA APOLONIA RESORT HOTEL,La Union,San Juan,"Urbiztondo Surfing Area, Brgy. urbiztondo, San Juan, La Union",9690458847,,"October 31, 2026"
Region 1,Resort,DOT-R01-RES-03074-2025,MARITONI BALI SUITES & VILLAS,La Union,Bauang,"National Highway, paringao, Bauang, La Union",9177727151,,"October 31, 2026"
Region 1,Resort,DOT-R01-RES-00354-2021,ISLA BONITA BEACH RESORT,La Union,San Juan,"117 Velasco, Ili Sur (Pob.), San Juan, La Union",9989846420,,"October 31, 2026"
Region 1,Resort,DOT-R01-RES-01035-2022,SEA OF DREAMS BEACH RESORT,La Union,Caba,"Diego Silang Street, Santiago Norte, Caba, La Union",0977 238 8515,,"October 31, 2026"
Region 1,Resort,DOT-R01-RES-01203-2022,JG7 Bamboo-Paraiso Beach Resort,Pangasinan,Alaminos City,"Bolo II-Pandan, Alaminos City, Pangasinan",0917 800 1118 / 0966 499 1833,,"October 31, 2026"
Region 1,Resort,DOT-R01-RES-00023-2020,Maxine By The Sea Restaurant & Lodge,Pangasinan,Alaminos City,Boulevard Lucap Alaminos City Pangasinan,9216428551,,"October 31, 2026"
Region 1,Resort,DOT-R01-RES-00563-2021,Kokopeli Beach Resort,Pangasinan,Bolinao,#001,9065540743,http://kokopelibeachresort.business.site/,"October 31, 2026"
Region 1,Resort,DOT-R01-RES-00631-2021,SUNDOWNERS VACATION VILLAS,Pangasinan,Bolinao,"LUCIENTE 1ST., BOLINAO, PANGASINAN",9209650412,https://sundowners.ph,"October 31, 2026"
Region 1,Resort,DOT-R01-RES-00340-2021,Sirom Hospitality Group Incorporated,Pangasinan,Dasol,Purok 3 Tambobong Dasol Pangasinan,9294556102,http://www.sirombeachhouse.com,"October 31, 2026"
Region 1,Resort,DOT-R01-RES-01230-2022,KABALEYAN COVE RESORT INC.,Pangasinan,San Carlos City,No. 27-A.,9153872765,https://kabaleyancoveresort.ph/,"October 31, 2026"
Region 1,Resort,DOT-R01-RES-02070-2024,LAYLOW BEACH RESORT,Pangasinan,Alaminos City,"Brgy. Victoria, Alaminos City, Pangasinan",9639934208,,"October 31, 2026"
Region 1,Resort,DOT-R01-RES-02167-2024,YP4K PRIVATE RESORT,Pangasinan,Alaminos City,"Zone 6, Bued, Alaminos City, Pangasina",9053135494,,"October 31, 2026"
Region 1,Resort,DOT-R01-RES-00841-2022,CMAYA GARDEN RESORT,Pangasinan,Alaminos City,Brgy Bued Alaminos City pangasinan,9063836788,,"October 31, 2026"
Region 1,Resort,DOT-R01-RES-00790-2022,"VILLA SOLEDAD BEACH RESORT, CORP.",Pangasinan,Bolinao,"393 Brgy. Estanza, Patar Road, Bolinao, Pangasinan",09209092768 / 09151287785,,"October 31, 2026"
Region 1,Resort,DOT-R01-RES-00218-2021,EL PESCADOR RESORT HOTEL,Pangasinan,Bolinao,"#1 San Andres St. Barangay Germinal, Bolinao, Pangasinan",09999926184/ 075 6330527,,"October 31, 2026"
Region 1,Resort,DOT-R01-RES-00096-2021,PUERTO DEL SOL BEACH RESORT AND HOTEL CLUB,Pangasinan,Bolinao,ILOG MALINO BOLINAO PANGASINAN,9175542859,,"October 31, 2026"
Region 1,Resort,DOT-R01-RES-02615-2024,WESTMANOR RESORT HOTEL,Pangasinan,Sual,"National Road, Sitio Matalakitik, Brgy. Caoayan Sual, Pangasinan",9209451764,,"October 31, 2026"
Region 1,Resort,DOT-R01-RES-02643-2025,THE BLESSED PURPLE BAMBOO BEACH RESORT INC.,Pangasinan,Alaminos City,"Magamo-gamo street, Telbang, Alaminos City, Pangasinan",0956 697 8679,,"October 31, 2026"
Region 1,Resort,DOT-R01-RES-02817-2025,LADO DEL RIO VACATION VILLAS,Pangasinan,Bolinao,"Balingasay, Bolinao, Pangasinan",9065542733,,"October 31, 2026"
Region 1,Resort,DOT-R01-RES-02835-2025,THE YLANG YLANG EVENTS PLACE & RESORT,Pangasinan,Mangatarem,"Romulo Highway, Brgy. Bueno, Mangatarem, Pangasinan",9515588074,,"October 31, 2026"
Region 1,Resort,DOT-R01-RES-00973-2022,FIESTA GRANDE BEACH RESORT,Pangasinan,Dasol,"Purok Ylang-Ylang, Macalang, Dasol, Pangasinan",9185914091,,"October 31, 2026"
Region 1,Resort,DOT-R01-RES-02876-2025,FIVE LUCKY JADE DRAGONS INC. (SOLIMAR SEASIDE CABANAS),Pangasinan,Dasol,"Purok 5, Tambobong, Dasol, Pangasinan",9175555609,,"October 31, 2026"
Region 1,Resort,DOT-R01-RES-00370-2021,"STAR MONICA HOTEL, RESORT AND RESTAURANT",Pangasinan,Lingayen,"National Highway, Quibaol, Lingayen, Pangasinan",9062562576,,"October 31, 2026"
Region 1,Resort,DOT-R01-RES-00668-2021,SCL GARDEN RESORT,Pangasinan,Bolinao,"Brgy Ilog Malino, Bolinao, Pangasinan",09563009225/639687341388,,"October 31, 2026"
Region 1,Resort,DOT-R01-RES-02912-2025,"ROCK GARDEN HOTEL, RESORT AND RESTAURANT, INC",Pangasinan,Bolinao,"Barangay Arnedo, Bolinao, Pangasinan",9175382258,,"October 31, 2026"
Region 1,Resort,DOT-R01-RES-00345-2021,HOTEL G BEACH RESORT & RESTOBAR,Pangasinan,Bolinao,"BRGY. PATAR, BOLINAO, PANGASINAN",9176502939,,"October 31, 2026"
Region 1,Resort,DOT-R01-RES-00539-2021,RDT HOTEL AND SPA,Pangasinan,Pozzorubio,"Espiritu Street Poblacion, District 2, Poblacion II, Pozzorubio, Pangasinan",0917-179-9513,,"October 31, 2026"
Region 1,Resort,DOT-R01-RES-03023-2025,"AVELINO RESORT AND HOTEL,INC.",Pangasinan,Basista,"#206 Brgy.,Bayoyong,Basista Pangasinan",0917-512-9828,,"October 31, 2026"
Region 1,Resort,DOT-R01-RES-03054-2025,CORA'S MANOR AND GARDEN,Pangasinan,Mapandan,"CALAMANSI PIAS, MAPANDAN, PANGASINAN",9458007074,,"October 31, 2026"
Region 1,Resort,DOT-R01-RES-00657-2021,PUNTA RIVIERA DEL MAR INC.,Pangasinan,Bolinao,"PUROK 2 ILOG MALINO, Bolinao, Pangasinan",9994432940,,"October 31, 2026"
Region 1,Restaurant,DOT-R01-RST-03044-2025,PLANAXIS GRILL AND RESTAURANT INCORPORATED,Ilocos Norte,Bacarra,"Planaxis Building, Sitio 7. National Highway, Brgy. Buyon, Bacarra, Ilocos Norte",9951068381,,"June 13, 2026"
Region 1,Restaurant,DOT-R01-RST-01156-2022,LA PRECIOSA ILOCOS CORP,Ilocos Norte,Laoag,"Arabela Eventts Place, F. Julian St., Brgy. 2, Santa Joaquina, Laoag City, Ilocos Norte",9067635373,,"March 30, 2026"
Region 1,Restaurant,DOT-R01-RST-00871-2022,TARTARUGAS RESTAURANT,Ilocos Norte,Pagudpud,"BRGY. SAUD, PAGUPDUD, ILOCOS NORTE",9510140486,,"July 15, 2026"
Region 1,Restaurant,DOT-R01-RST-00926-2022,IKAN DAMPA SEAFOOD RESTAURANT,Ilocos Sur,Bantay,"St. Paul Avenue, Zone 4, Bantay, Ilocos Sur",9163945168,,"April 25, 2026"
Region 1,Restaurant,DOT-R01-RST-02998-2025,CEFERINOтАЩS RESTAURANT,Ilocos Sur,Candon,"Bypass Road, Bagani Ubbog, Candon City, Ilocos Sur",9661929907,,"April 25, 2026"
Region 1,Restaurant,DOT-R01-RST-02776-2025,LAMOT-TEK EATERY,Ilocos Sur,Candon,"15 Alvaro Street, Brgy. San Jose, Candon City, Ilocos Sur",9165135570,,"February 13, 2026"
Region 1,Restaurant,DOT-R01-RST-02734-2025,MANG ROMEO'S SEAFOOD AND GRILL,Ilocos Sur,Candon,"134 Abagatan, Bagar, Candon City, Ilocos Sur",9275801698,,"November 2, 2026"
Region 1,Restaurant,DOT-R01-RST-02488-2024,MINTY COFFEE SHOP,Ilocos Sur,Candon,"National Highway, Brgy. Tablac, Candon City, Ilocos Sur",9171361177,,"October 25, 2025"
Region 1,Restaurant,DOT-R01-RST-02770-2025,RM HICUPS CORPORATION,Ilocos Sur,Candon,"L.A.J. Comm'l. Bldg., Nat'l Highway, Brgy., Calaoa-an, Candon City, Ilocos Sur",9658149315,,"February 13, 2026"
Region 1,Restaurant,DOT-R01-RST-02772-2025,IHAWAN SA CAOAYAN,Ilocos Sur,Caoayan,"Don Alejandro Quirolgico (Pob.), Caoayan, Ilocos Sur",09175827444/09661594646,,"February 13, 2026"
Region 1,Restaurant,DOT-R01-RST-02848-2025,SEASIDE DE SAN JUAN GRILL HOUSE,Ilocos Sur,San Juan (Lapog),"Brgy. Sunggiam, San Juan, Ilocos Sur",9176892288,,"November 3, 2026"
Region 1,Restaurant,DOT-R01-RST-02894-2025,RICO'S BAR AND COCKTAIL LOUNGE,Ilocos Sur,Santo Domingo,"Evangelista Street, Poblacion, Santo Domingo, Ilocos Sur",9171032054,,"March 24, 2026"
Region 1,Restaurant,DOT-R01-RST-01430-2022,CAFE UNO - VIGAN,Ilocos Sur,Vigan,"Crisologo St., Brgy. I, Vigan City, Ilocos Sur",9177990121,,"October 23, 2025"
Region 1,Restaurant,DOT-R01-RST-01424-2022,CAFE UNO - VIGAN,Ilocos Sur,Vigan,"Bonifacio St., Brgy. II, Vigan City, Ilocos Sur",9536137894,,"October 23, 2025"
Region 1,Restaurant,DOT-R01-RST-02451-2024,COFFEE BREAK VIGAN CO.,Ilocos Sur,Vigan,"3 Casa Feril, Salcedo St. corner Crisologo St., Barangay 1, Vigan City, Ilocos Sur",09178714790/ 09175820101,,"October 23, 2025"
Region 1,Restaurant,DOT-R01-RST-02774-2025,GRACIAS AMIGO KITCHENETTE,Ilocos Sur,Vigan,"Quirino Blvd., Tamag, Vigan City, Ilocos Sur",9686314095,,"February 13, 2026"
Region 1,Restaurant,DOT-R01-RST-02738-2025,HIDDEN GARDEN LILONG AND LILANG RESTAURANT,Ilocos Sur,Vigan,"#56 Bulala, Vigan City, Ilocos Sur",9674426514,,"November 2, 2026"
Region 1,Restaurant,DOT-R01-RST-02737-2025,KARDO'S GRILL HOUSE,Ilocos Sur,Vigan,"Diversion Road, Cabalangegan, Vigan City, Ilocos Sur",09175827444/09565229911,,"November 2, 2026"
Region 1,Restaurant,DOT-R01-RST-02147-2024,NSCC BATH AND COFFEE,Ilocos Sur,Vigan,"Gov. A. Reyes St., Brgy. I, Vigan City, Ilocos Sur",9175076402,,"November 6, 2025"
Region 1,Restaurant,DOT-R01-RST-02892-2025,OLD SEOUL CAF├Й,Ilocos Sur,Vigan,"Calle Crisologo, Brgy. VI, Vigan City, Ilocos Sur",9609527000,,"March 24, 2026"
Region 1,Restaurant,DOT-R01-RST-02152-2024,STJ STEAK HOUSE,Ilocos Sur,Vigan,"Steak to Juan,Liberation Boulevard,Brgy. VIII, Vigan City, Ilocos Sur",9951367561,,"November 6, 2025"
Region 1,Restaurant,DOT-R01-RST-03108-2025,MAX'S RESTAURANT,Ilocos Sur,Vigan,"Barangay I (Pob.), Vigan City, Ilocos Sur",9565197440,,"August 6, 2026"
Region 1,Restaurant,DOT-R01-RST-03109-2025,CHAU RESTAURANT,Ilocos Sur,San Vicente,"Bayubay Norte, San Vicente, Ilocos Sur",9175425964,,"August 6, 2026"
Region 1,Restaurant,DOT-R01-RST-01335-2022,PANGANAN RESTAURANT,La Union,Luna,"Purok 6, Barrientos",09192248949 / 09692239005,,"September 11, 2025"
Region 1,Restaurant,DOT-R01-RST-01173-2022,UVAS CAFE,La Union,Bauang,"68, Urayong",(0967) 285 4121,,"September 10, 2025"
Region 1,Restaurant,DOT-R01-RST-01334-2022,STEAK TO JUAN,La Union,Luna,"Victoria, Luna, La Union",9690114158,,"September 10, 2025"
Region 1,Restaurant,DOT-R01-RST-01224-2022,GERMAN BISTRO,La Union,San Juan,"320 EAGLE STREET, Ili Norte (Pob.)",9294485505,,"October 13, 2025"
Region 1,Restaurant,DOT-R01-RST-02422-2024,R CAFE FOOD CORPORATION,La Union,Bauang,"R cafe, The R hub Building, Barangay Disso-or, Bauang, La Union",9171180066,,"October 13, 2025"
Region 1,Restaurant,DOT-R01-RST-02423-2024,TAMYAN REFRESHMENT,La Union,Naguilian,"E. Rimando St., Ortiz (Pob.)",9506676573,,"October 13, 2025"
Region 1,Restaurant,DOT-R01-RST-02426-2024,ARIANNA'S RESTO BAR,La Union,San Fernando City,"61 Dalumpinas Oeste, San Fernando City, La Union",0917 1692277,,"October 13, 2025"
Region 1,Restaurant,DOT-R01-RST-01348-2022,KUSINA DE LUNA RESTAURANT,La Union,Luna,"Purok 5, Nalvo Norte",9460722119,,"October 19, 2025"
Region 1,Restaurant,DOT-R01-RST-02494-2024,LU MIDTOWN FOOD PALACE INC.,La Union,San Fernando City,"QUEZON AVENUE, BRGY III, CITY OF SAN FERNANDO, LA UNION",9190666456,,"October 25, 2025"
Region 1,Restaurant,DOT-R01-RST-02517-2024,SAVIE'S RESTAURANT AND BAR,La Union,San Fernando City,"Lot No. 10 Poro Point Baywalk, Brgy. Poro",9458230050,,"November 8, 2025"
Region 1,Restaurant,DOT-R01-RST-02522-2024,DIONI'S DINER,La Union,San Fernando City,"110 JNB BLDG., MAC ARTHUR HIGHWAY, BRGY. LINGSAT",9178100879,,"November 8, 2025"
Region 1,Restaurant,DOT-R01-RST-02561-2024,WAVES POINT RESTO BAR,La Union,San Juan,"Waves Beach Club and Residences, Brgy. Panicsican",9077684819,,"November 26, 2025"
Region 1,Restaurant,DOT-R01-RST-00289-2021,TAIHAO RESTAURANT,La Union,Agoo,"1-National Highway, Brgy. San Jose Norte, Agoo, La Union",9175640800,,"December 10, 2025"
