Region,Enterprise Type,Accreditation No,Enterprise Name,Province,Municipality,Business Address,Contact Numbers,Business Website,Accreditation Validity
REGION 6,Land Transport Operator,DOT-R06-TTO-00239-2021,AEROSTAR1 TRANSPORT MPC,ILOILO CITY,ILOILO CITY,"ZONE 1, BUNTATALA, ILOILO CITY",0906-242-4534,,4/30/2026
REGION 6,Land Transport Operator,DOT-R06-TTO-02682-2024,ATM TOURS,AKLAN,ALTAVAS,"BRGY. POBLACION, ALTAVAS, AKLAN",0938-011-1133 / 0908-812-8253,,4/30/2026
REGION 6,Land Transport Operator,DOT-R06-TTO-04004-2025,BAMBOO-BORACAY TRANSPORT SERVICES,AKLAN,NABAS,"BRGY. UNION, NABAS, AKLAN",(036) 288-9813,,4/30/2026
REGION 6,Land Transport Operator,DOT-R06-TTO-01924-2023,BATANG'S CAR TOURISM CARRIER,AKLAN,LEZO,"D. TUPAS ST. BRGY. POBLACION, LEZO, AKLAN",9189407031,,4/30/2026
REGION 6,Land Transport Operator,DOT-R06-TTO-01764-2023,BENNCH TRANSPORT SERVICES,ILOILO CITY,ILOILO CITY,"BRGY. NORTH SAN JOSE,MOLO,ILOILO CITY",(033)336-6190,,4/30/2026
REGION 6,Land Transport Operator,DOT-R06-TTO-01661-2023,BORACAY 3J'S TOURS (DEMATE EMPIRE CORPORATION),AKLAN,KALIBO,"1000 OSMEÑA AVENUE, ESTANCIA, KALIBO, AKLAN",0963-105-2167,,4/30/2026
REGION 6,Land Transport Operator,DOT-R06-TTO-02853-2024,BORACAY LAND TRANSPORT MULTI-PURPOSE COOPERATIVE,BORACAY-AKLAN,MALAY,"SITIO TAMBISAAN, BRGY. MANOC-MANOC, BORACAY ISLAND, MALAY, AKLAN",0939-901-5976/ (036) 288-3271,,4/30/2026
REGION 6,Land Transport Operator,DOT-R06-TTO-00791-2022,CATICLAN-BORACAY TRANSPORT MULTI-PURPOSE COOPERATIVE (CBTMPC),AKLAN,MALAY,"CBTMPC MAIN BLDG., CBTMPC COMPOUND, BRGY. CATICLAN, MALAY, AKLAN",(036) 288-7101,,4/30/2026
REGION 6,Land Transport Operator,DOT-R06-TTO-03959-2025,DISCOVER BORACAY TRAVEL AND TOURS,AKLAN,KALIBO,"KALIBO AIRPORT ACCESS ROAD BRGY.POOK, KALIBO, AKLAN",036 2721188,,4/30/2026
REGION 6,Land Transport Operator,DOT-R06-TTO-03701-2025,"FIVE-O TRANSPORT SERVICE, INC.",ILOILO CITY,ILOILO CITY,"FUENTES-DELGADO STREETS, BRGY. SAN ANTONIO, ILOILO CITY",0908-897-7828,,4/30/2026
REGION 6,Land Transport Operator,DOT-R06-TTO-04179-2025,GIGANTES ISLAND TRANSPORT SERVICE COOPERATIVE,ILOILO,PAVIA,"MARIEL REFILLING STATION BLDG, BRGY. PAGSANGA-AN, PAVIA, ILOILO",9292645920,,4/30/2026
REGION 6,Land Transport Operator,DOT-R06-TTO-03297-2024,GUIMARAS TOURIST TRANSPORT COOPERATIVE,GUIMARAS,JORDAN,"BRGY. SAN MIGUEL, JORDAN, GUIMARAS",0918-963-5221,,4/30/2026
REGION 6,Land Transport Operator,DOT-R06-TTO-01996-2023,ISLAND ADVENTURE TOURS AND TRAVEL,ILOILO CITY,ILOILO CITY,"195, BRGY. BONIFACIO TANZA, ILOILO CITY",0916-430-1873,,4/30/2026
REGION 6,Land Transport Operator,DOT-R06-TTO-01017-2022,ISLAND STAR EXPRESS INC.,AKLAN,KALIBO,"BRGY. POOK, KALIBO, AKLAN",036-288-2097 / 288-6644,,4/30/2026
REGION 6,Land Transport Operator,DOT-R06-TTO-02268-2023,JMP TRAVEL TOURS,AKLAN,KALIBO,"BRGY. POOK, KALIBO, AKLAN",0920-526-9981,,4/30/2026
REGION 6,Land Transport Operator,DOT-R06-TTO-02630-2024,"KALIBO INTERNATIONAL AIRPORT TRANSPORT ASSOCIATION (KIATA), INC.",AKLAN,KALIBO,"KALIBO INTERNATIONAL AIRPORT, BRGY. POOK, KALIBO, AKLAN",0939-537-3975,,4/30/2026
REGION 6,Land Transport Operator,DOT-R06-TTO-02629-2024,L & A TRAVEL & TOURS,ILOILO,CABATUAN,"BRGY. DUYANDUYAN, CABATUAN, ILOILO",0919-898-2979,,4/30/2026
REGION 6,Land Transport Operator,DOT-R06-TTO-00822-2022,LAYOD'S TRANSPORT,AKLAN,NABAS,"NATIONAL HI-WAY, BRGY. UNION, NABAS, AKLAN",0908-874-1770,,4/30/2026
REGION 6,Land Transport Operator,DOT-R06-TTO-03716-2025,LE BORACAY TOURS,AKLAN,NUMANCIA,"050, BRGY. LAGUINBANUA EAST, NUMANCIA, AKLAN",0966-469-5026,,4/30/2026
REGION 6,Land Transport Operator,DOT-R06-TTO-02264-2023,LPJ TRANSPORT SERVICES CORP.,ILOILO,BADIANGAN,"SITIO TARA-TARA, BRGY. INILIGAN, BADIANGAN, ILOILO",0963-287-7310/0909-688-9652,,4/30/2026
REGION 6,Land Transport Operator,DOT-R06-TTO-01018-2022,M-V SHUTTLE VAN,AKLAN,KALIBO,"1322 BLISS SITE, POBLACION, KALIBO, AKLAN",0910-696-4616,,4/30/2026
REGION 6,Land Transport Operator,DOT-R06-TTO-02719-2024,MEL DIANE TRANSPORT AND SERVICES,NEGROS OCCIDENTAL,SAN CARLOS CITY,"MARGARITA VILLAGE, BRGY. II (POB.), SAN CARLOS CITY, NEGROS OCCIDENTAL",0917-777-6014,,4/30/2026
REGION 6,Land Transport Operator,DOT-R06-TTO-01986-2023,NGIP TRAVEL & TOURS,AKLAN,ALTAVAS,"GEN. LUNA ST., BRGY. POBLACION, ALTAVAS, AKLAN",0918-963-8526,,4/30/2026
REGION 6,Land Transport Operator,DOT-R06-TTO-01586-2022,NORTH-STAR-TRANS CORP.,AKLAN,NUMANCIA,"BRGY. POBLACION, NUMANCIA, AKLAN",9185627263,,4/30/2026
REGION 6,Land Transport Operator,DOT-R06-TTO-01281-2022,PARADISE ISLAND TRANSPORT AND MULTI-PURPOSE COOPERATIVE,AKLAN,KALIBO,"6111 MABINI STREET, BRGY. POBLACION, KALIBO, AKLAN",9380153168/273-31-33,,4/30/2026
REGION 6,Land Transport Operator,DOT-R06-TTO-02620-2024,RAJ & ROSE TOURS,ANTIQUE,SAN JOSE DE BUENAVISTA,"BRGY. ATABAY, SAN JOSE DE BUENAVISTA, ANTIQUE",0915-925-1245/0997-124-4672,,4/30/2026
REGION 6,Land Transport Operator,DOT-R06-TTO-02876-2024,REGIONAL TRANSPORT SERVICE COOPERATIVE (RETRANSCO),BACOLOD CITY,BACOLOD CITY,"LOT 235, JR TORRES AVENUE, AIRPORT SUBD., BRGY. SINGCANG-AIRPORT, BACOLOD CITY",0947-837-0004,,4/30/2026
REGION 6,Land Transport Operator,DOT-R06-TTO-02267-2023,RJ BORACAY TRAVEL AND TOURS,AKLAN,KALIBO,"KALIBO INTERNATIONAL AIRPORT, BRGY. POOK, KALIBO, AKLAN",0956-766-4616,,4/30/2026
REGION 6,Land Transport Operator,DOT-R06-TTO-00912-2022,RJ TRANSPORT SERVICES,ILOILO CITY,ILOILO CITY,"187-E, BRGY. LOPEZ JAENA SUR, LAPAZ, ILOILO CITY",(033)3200065 / 09298209909 / 09179811990,,4/30/2026
REGION 6,Land Transport Operator,DOT-R06-TTO-01845-2023,RJB STAR TRANSPORT SERVICE INC.,ILOILO CITY,ILOILO CITY,"1ST ST., LAWAAN VILLAGE, BRGY. BALANTANG, JARO, ILOILO CITY",0998-984-0673 & 0917-147-6016,,4/30/2026
REGION 6,Land Transport Operator,DOT-R06-TTO-02276-2023,RM BORACAY TRAVEL & TOURS,AKLAN,KALIBO,"KALIBO INTERNATIONAL AIRPORT, BRGY. POOK, KALIBO, AKLAN",9205269981,,4/30/2026
REGION 6,Land Transport Operator,DOT-R06-TTO-02994-2024,ROVY JR TRANSPORT SERVICES,ILOILO CITY,ILOILO CITY,"BRGY. M. V. HECHANOVA, ILOILO CITY",0960-876-4262/0912-990-4009,,4/30/2026
REGION 6,Land Transport Operator,DOT-R06-TTO-01070-2022,SOUTHWEST TOURS (BORACAY) INC.,AKLAN,KALIBO,"JNC MARTELINO ST., BRGY. ANDAGAW, KALIBO, AKLAN",(036) 268-6000,,4/30/2026
REGION 6,Land Transport Operator,DOT-R06-TTO-02310-2024,"SOUTHWEST TOURS (BORACAY), INC.",BACOLOD CITY,BACOLOD CITY,"DOOR 2 G/F MAINSTRIP TOURIST INN, LACSON HIGHWAY, BRGY. MANDALAGAN, BACOLOD CITY",(034) 469-6520 / 0936-900-0566,,4/30/2026
REGION 6,Land Transport Operator,DOT-R06-TTO-01588-2022,UMALI TOURS CORPORATION,AKLAN,KALIBO,"BRGY. POOK, KALIBO, AKLAN",0963-803-1176,,4/30/2026
REGION 6,Land Transport Operator,DOT-R06-TTO-03065-2024,WESTMINT CATICLAN TRANSPORT SERVICES CORP.,AKLAN,MALAY,"BRGY. CATICLAN, MALAY, AKLAN",0910-910-1236,,4/30/2026
REGION 6,Land Transport Operator,DOT-R06-TTO-00082-2021,"WESTMINT TRANSPORT ASSOCIATION, INC.",AKLAN,KALIBO,"L. BARRIOS CORNER N. ROLDAN ST., BRGY. POBLACION, KALIBO, AKLAN",0929-498-8589 / 0915-599-5600,,4/30/2026
,​,,,,,,,,
REGION 6,Water Transport Operator,DOT-R06-TWT-02731-2024,ABET TOURIST BOAT RENTAL/ MBCA BEBE DUCK,ILOILO,CARLES,"BANCAL PORT, BRGY. BANCAL, CARLES, ILOILO",0948-457-1353 / 0909-787-5997,,4/30/2026
REGION 6,Water Transport Operator,DOT-R06-TWT-02993-2024,"BEBING TOURIST BOAT RENTAL/MBCA ""CORONA DIAMOND""",ILOILO,CARLES,"BANCAL PORT, BRGY. BANCAL, CARLES, ILOILO",0963-935-9957,,4/30/2026
REGION 6,Water Transport Operator,DOT-R06-TWT-02721-2024,"BEBING TOURIST BOAT RENTAL/MBCA ""CORONA GARLAND""",ILOILO,CARLES,"BANCAL PORT, BRGY. BANCAL, CARLES, ILOILO",0963-935-9957,,4/30/2026
REGION 6,Water Transport Operator,DOT-R06-TWT-02764-2024,E ROBLES INTERISLAND WATER PASSENGER TRANSPORT/ MBCA TATA JAY,ILOILO,CARLES,"BANCAL PORT, BANCAL, CARLES, ILOILO",0912-892-1754,,4/30/2026
REGION 6,Water Transport Operator,DOT-R06-TWT-02986-2024,INDAY NANCY TOURIST BOAT RENTAL/ MBCA INDAY NANCY,ILOILO,CARLES,"BANCAL PORT, BRGY. BANCAL, CARLES, ILOILO",0998-981-6812,,4/30/2026
REGION 6,Water Transport Operator,DOT-R06-TWT-02763-2024,JE TOURIST BOAT RENTAL/ MBCA TATA JAY,ILOILO,CARLES,"BANCAL PORT, BANCAL, CARLES, ILOILO",0912-892-1754,,4/30/2026
REGION 6,Water Transport Operator,DOT-R06-TWT-02734-2024,KAMBAL TOURIST BOAT RENTAL/ MBCA KAMBAL,ILOILO,CARLES,"BANCAL PORT, BRGY. BANCAL, CARLES, ILOILO",0907-531-9850 / 0967-045-7550,,4/30/2026
REGION 6,Water Transport Operator,DOT-R06-TWT-04108-2025,LIAM AXL TOURIST BOAT RENTAL,ILOILO,CONCEPCION,"BRGY. TAMBALIZA, CONCEPCION, ILOILO",9186305515,,4/30/2026
REGION 6,Water Transport Operator,DOT-R06-TWT-04107-2025,MBC/A ISLA EXPRESS,ILOILO,CONCEPCION,"PUROK MANLOT, BRGY. MALANGABANG, CONCEPCION, ILOILO",9760081347,,4/30/2026
REGION 6,Water Transport Operator,DOT-R06-TWT-04073-2025,"MBCA ""JOY HOPE""",ILOILO,CONCEPCION,"BRGY. MALANGABANG, CONCEPCION, ILOILO",9287319526,,4/30/2026
REGION 6,Water Transport Operator,DOT-R06-TWT-02767-2024,"MBCA ""OX DRAGON""",ILOILO,CARLES,"GIGANTES NORTE, GRANADA, CARLES, ILOILO",0912-724-0081 / 0930-116-8116,,4/30/2026
REGION 6,Water Transport Operator,DOT-R06-TWT-04071-2025,"MBCA ""PRINCE NOA""",ILOILO,CONCEPCION,"SITIO PROPER BRGY. POLOPINA, CONCEPCION, ILOILO",0915-026-6291,,4/30/2026
REGION 6,Water Transport Operator,DOT-R06-TWT-04070-2025,"MBCA ""SON OF DAVID""",ILOILO,CONCEPCION,"PUROK BUDYONG, BRGY. MALANGABANG, CONCEPCION, ILOILO",0966-481-0390,,4/30/2026
REGION 6,Water Transport Operator,DOT-R06-TWT-04078-2025,MBCA ARIANNE JANE,ILOILO,CONCEPCION,"BRGY. TALOTU-AN, CONCEPCION, ILOILO",9212653570,,4/30/2026
REGION 6,Water Transport Operator,DOT-R06-TWT-04072-2025,MBCA BAGO SIPOL,ILOILO,CONCEPCION,"BRGY. MALANGABANG, CONCEPCION, ILOILO",9636394306,,4/30/2026
REGION 6,Water Transport Operator,DOT-R06-TWT-04105-2025,MBCA FRANCINE & FRANCINE 2,ILOILO,CONCEPCION,"D.B. OÑATE STREET, BRGY. POBLACION, CONCEPCION, ILOILO",0960-925-2823,,4/30/2026
REGION 6,Water Transport Operator,DOT-R06-TWT-04128-2025,MBCA HALLEL I & HALLEL III,ILOILO,CONCEPCION,"BRGY. TAMBALIZA, CONCEPCION, ILOILO",9150888116,,4/30/2026
REGION 6,Water Transport Operator,DOT-R06-TWT-04069-2025,MBCA HJ BALSAMO INC. / HJB PAN DE AZUCAR,ILOILO,CONCEPCION,"BRGY.POBLACION, CONCEPCION, ILOILO",9198695172,,4/30/2026
REGION 6,Water Transport Operator,DOT-R06-TWT-04149-2025,MBCA IAN AND AYESHA,ILOILO,CONCEPCION,"BRGY. TAMBALIZA, CONCEPCION, ILOILO",9631203855,,4/30/2026
REGION 6,Water Transport Operator,DOT-R06-TWT-04127-2025,MBCA JOHN LAWRENCE,ILOILO,CONCEPCION,"SITIO MALIPAYON BRGY. IGBON, CONCEPCION, ILOILO",9063351403,,4/30/2026
REGION 6,Water Transport Operator,DOT-R06-TWT-04077-2025,MBCA KURT RG TOURIST BOAT RENTAL,ILOILO,CONCEPCION,"BRGY. BAGONGON , CONCEPCION, ILOILO",0930-197-8161,,4/30/2026
REGION 6,Water Transport Operator,DOT-R06-TWT-04106-2025,MBCA LYSTER MARK,ILOILO,CONCEPCION,"BRGY. MACATUNAO, CONCEPCION, ILOILO",9481736958,,4/30/2026
REGION 6,Water Transport Operator,DOT-R06-TWT-04074-2025,MBCA MONA LIZA,ILOILO,CONCEPCION,"BRGY. MALANGABANG, CONCEPCION, ILOILO",9639040386,,4/30/2026
REGION 6,Water Transport Operator,DOT-R06-TWT-03001-2024,MBCA PRINCE AND MAE TOURIST BOAT RENTAL,ILOILO,CARLES,"BRGY. LANTANGAN, GIGANTE SUR, CARLES, ILOILO",0948-744-4284,,4/30/2026
REGION 6,Water Transport Operator,DOT-R06-TWT-02727-2024,MBCA PRINCESS NN1 TOURIST BOAT,ILOILO,CARLES,"BANCAL PORT, BRGY. BANCAL, CARLES, ILOILO",0930-127-8096,,4/30/2026
REGION 6,Water Transport Operator,DOT-R06-TWT-04076-2025,MBCA QUEENIE,ILOILO,CONCEPCION,"BRGY. POLOPIÑA, CONCEPCION, ILOILO",9150266291,,4/30/2026
REGION 6,Water Transport Operator,DOT-R06-TWT-04148-2025,MBCA RODNIE,ILOILO,CONCEPCION,"BRGY. POLIPIÑA, CONCEPCION, ILOILO",9630425458,,4/30/2026
REGION 6,Water Transport Operator,DOT-R06-TWT-04110-2025,MBCA SAND BAR,ILOILO,CONCEPCION,"BRGY. POLIPIÑA, CONCEPCION, ILOILO",9068197516,,4/30/2026
REGION 6,Water Transport Operator,DOT-R06-TWT-04075-2025,MBCA SAND BAR II,ILOILO,CONCEPCION,"BRGY. POLOPIÑA, CONCEPCION, ILOILO",9068197516,,4/30/2026
REGION 6,Water Transport Operator,DOT-R06-TWT-02728-2024,MBCA ZENY TOURIST TRANSPORT SERVICES,ILOILO,CARLES,"BANCAL PORT, BRGY. BANCAL, CARLES, ILOILO",0956-633-8846,,4/30/2026
REGION 6,Water Transport Operator,DOT-R06-TWT-02720-2024,"NAY LYD TOURIST BOAT RENTAL/""MBCA NAY LYD-GC""",ILOILO,CARLES,"BANCAL PORT, BRGY. BANCAL, CARLES, ILOILO",0963-428-0071,,4/30/2026
REGION 6,Water Transport Operator,DOT-R06-TWT-02766-2024,"NICCO TOURIST BOAT RENTAL/MBCA ""NICCO - 1""",ILOILO,CARLES,"BANCAL PORT, BANCAL, CARLES, ILOILO",0938-096-0706,,4/30/2026
REGION 6,Water Transport Operator,DOT-R06-TWT-02730-2024,NONO' APOLLO TOURIST BOAT RENTAL/ MBCA NONO APOLLO,ILOILO,CARLES,"BANCAL PORT, BRGY. BANCAL, CARLES, ILOILO",0998-981-6812,,4/30/2026
REGION 6,Water Transport Operator,DOT-R06-TWT-02768-2024,NONOY MARK 2 TOURIST BOAT RENTAL/ MBCA NONOY MARK 2,ILOILO,CARLES,"BANCAL PORT, BANCAL, CARLES, ILOILO",0998-981-6812,,4/30/2026
REGION 6,Water Transport Operator,DOT-R06-TWT-02733-2024,NONOY MARK TOURIST BOAT RENTAL/ MBCA NONOY MARK,ILOILO,CARLES,"BANCAL PORT, BRGY. BANCAL, CARLES, ILOILO",0998-981-6812,,4/30/2026
REGION 6,Water Transport Operator,DOT-R06-TWT-00884-2022,"OCEAN FAST FERRIES, INC.",BACOLOD CITY,BACOLOD CITY,"SIMPLICIO PALANCE SEAPORT TERMINAL, BREDCO PORT 2, RECLAMATION AREA, BRGY. 10 (POB.), BACOLOD CITY",(034) 461-9224,,4/30/2026
REGION 6,Water Transport Operator,DOT-R06-TWT-02995-2024,POL'ROWEN TOURIST BOAT RENTAL/ MBCA POL-ROWEN,ILOILO,CARLES,"BANCAL PORT, BRGY. BANCAL, CARLES, ILOILO",0998-981-6812,,4/30/2026
REGION 6,Water Transport Operator,DOT-R06-TWT-02723-2024,PRINCESS EN-EN TOURIST BOAT RENTAL,ILOILO,CARLES,"BANCAL PORT, BRGY. BANCAL, CARLES, ILOILO",0930-127-8096,,4/30/2026
REGION 6,Water Transport Operator,DOT-R06-TWT-02722-2024,"RF MATEO TOURIST BOAT RENTAL/ ""MBCA NONOY ROLEX""",ILOILO,CARLES,"BANCAL PORT, BRGY. BANCAL, CARLES, ILOILO",0919-992-0115,,4/30/2026
REGION 6,Water Transport Operator,DOT-R06-TWT-02729-2024,SALAO GIGANTES TOURIST TRANSPORT SERVICES,ILOILO,CARLES,"DAMPA KAINAN RESTAURANT, BANCAL PORT, BRGY. BANCAL CARLES, ILOILO",0917-167-7800,,4/30/2026
REGION 6,Water Transport Operator,DOT-R06-TWT-02765-2024,SHANIYAH TOURIST BOAT,ILOILO,CARLES,"SITIO PROPER, ASLUMAN, CARLES, ILOILO",0948-320-4909,,4/30/2026
,​,,,,,,,,
REGION 6,Air Transport Operator,DOT-R06-TAT-03064-2024,"BORACAY HELICOPTER ADVENTURES (LIONAIR, INC.)",BORACAY-AKLAN,MALAY,"SITIO ILIG-ILIGAN BRGY. YAPAK, BORACAY ISLAND, MALAY, AKLAN",0939-913-5663,,4/30/2026
,​,,,,,,,,
REGION 6,Resort,DOT-R06-RES-01265-2022,AGZAM RESORT AND SPA MANAGEMENT CORPORATION,AKLAN,KALIBO,"LIBERATO ROAD, BRGY. LINABUAN NORTE, KALIBO, AKLAN",9311838655,,10/31/2026
REGION 6,Resort,DOT-R06-RES-00091-2021,ALOBIJOD COVE RESORT,GUIMARAS,NUEVA VALENCIA,"BRGY. POBLACION, NUEVA VALENCIA, GUIMARAS",0945-697-1200 / 0916-570-7675,,10/31/2026
REGION 6,Resort,DOT-R06-RES-00004-2021,AMILA DIVE BEACH RESORT,NEGROS OCCIDENTAL,CAUAYAN,"PUROK 3, BRGY. BULATA, CAUAYAN, NEGROS OCCIDENTAL",0917-122-6362,,10/31/2026
REGION 6,Resort,DOT-R06-RES-02645-2024,ANDANA RESORT GUIMARAS,GUIMARAS,NUEVA VALENCIA,"BRGY. POBLACION, NUEVA VALENCIA, GUIMARAS",0919-418-2632,,10/31/2026
REGION 6,Resort,DOT-R06-RES-02977-2024,ANTIQUE AMOR BUNGALOWS & VILLAS,ANTIQUE,PANDAN,"BRGY. TINGIB, PANDAN, ANTIQUE",0949-886-0024,,10/31/2026
REGION 6,Resort,DOT-R06-RES-02873-2024,AVISTA GRANDE BEACH RESORT,GUIMARAS,NUEVA VALENCIA,"SITIO TALISAY, BRGY. POBLACION, NUEVA VALENCIA, GUIMARAS",0926-705-6409,,10/31/2026
REGION 6,Resort,DOT-R06-RES-03766-2025,AZUKI CROWN BEACH HOUSE,NEGROS OCCIDENTAL,HINOBA-AN,"NATIONAL ROAD, BRGY. PO-OK, HINOBA-AN, NEGROS OCCIDENTAL",0915-991-8000,,10/31/2026
REGION 6,Resort,DOT-R06-RES-00161-2021,BEARLAND PARADISE RESORT,ILOILO,TIGBAUAN,"BRGY. TANPAEL, TIGBAUAN, ILOILO",0917-159-3833,,10/31/2026
REGION 6,Resort,DOT-R06-RES-03352-2024,BEL-IS COVE BEACH RESORT,AKLAN,BURUANGA,"BRGY. BEL-IS, BURUANGA, AKLAN",9279115128,,10/31/2026
REGION 6,Resort,DOT-R06-RES-01850-2023,BRAZAVILLE BEACH RESORT,NEGROS OCCIDENTAL,HINOBA-AN,"NATIONAL HIGHWAY, BRGY. PO-OK, HINOBA-AN, NEGROS OCCIDENTAL",0998-550-0210,,10/31/2026
REGION 6,Resort,DOT-R06-RES-01620-2022,BUGANA BEACH & DIVE RESORT,NEGROS OCCIDENTAL,SIPALAY CITY,"CAMPOMANES BAY, BRGY. MARICALUM, SIPALAY CITY, NEGROS OCCIDENTAL",9176386891,,10/31/2026
REGION 6,Resort,DOT-R06-RES-01304-2022,CAMPUESTOHAN HIGHLAND RESORT,NEGROS OCCIDENTAL,TALISAY CITY,"SITIO CAMPUESTOHAN, BRGY. CABATANGAN, TALISAY CITY, NEGROS OCCIDENTAL",0917-300-5007,,10/31/2026
REGION 6,Resort,DOT-R06-RES-00308-2021,CAVELAND NATURE PARK,CAPIZ,DUMALAG,"SITIO SUHOT, BRGY. DOLORES, DUMALAG, CAPIZ",0967-215-0680,,10/31/2026
REGION 6,Resort,DOT-R06-RES-02822-2024,COOP OCEAN VIEW RESORT,ANTIQUE,BARBAZA,"PUNTA BANWA, POBLACION, BARBAZA, ANTIQUE",9997648653,,10/31/2026
REGION 6,Resort,DOT-R06-RES-03891-2025,COSTA AGUADA ISLAND RESORT (OPEN RESORT INC.),GUIMARAS,SIBUNAG,BRGY.INAMPOLOGAN SIBUNAG GUIMARAS,(344)344541,,10/31/2026
REGION 6,Resort,DOT-R06-RES-01621-2022,EASY DIVING AND BEACH RESORT,NEGROS OCCIDENTAL,SIPALAY CITY,"PUNTA BALLO, BRGY. 4 (POB.), SIPALAY CITY, NEGROS OCCIDENTAL",9173000381,,10/31/2026
REGION 6,Resort,DOT-R06-RES-03883-2025,EON CENTENNIAL RESORT HOTEL & WATERPARK,ILOILO CITY,ILOILO CITY,"MARIKUDO STREET, ALTA TIERRA VILLAGE, JARO, ILOILO CITY",0917-710-6696,,10/31/2026
REGION 6,Resort,DOT-R06-RES-01807-2023,ESPACIO VERDE RESORT,CAPIZ,ROXAS CITY,"BRGY. DAYAO, ROXAS CITY, CAPIZ",(036) 620-3734,,10/31/2026
REGION 6,Resort,DOT-R06-RES-03847-2025,FATIMA FARM RESORT,GUIMARAS,SAN LORENZO,"PUROK PROPER BRGY.SAN ENRIQUE, SAN LORENZO, GUIMARAS",0917-125-0016,,10/31/2026
REGION 6,Resort,DOT-R06-RES-02088-2023,GARINFARM AGRITOURISM PARK,ILOILO,SAN JOAQUIN,"PUROK 2, POBLACION, SAN JOAQUIN, ILOILO",0929-671-6789/0916-667-6851,,10/31/2026
REGION 6,Resort,DOT-R06-RES-03752-2025,"GRACELAND VIEW RESORT AND RESIDENCES, INC.",NEGROS OCCIDENTAL,MURCIA,"PNOC II, BRGY. MINOYAN, MURCIA, NEGROS OCCIDENTAL",(034) 700-9660,,10/31/2026
REGION 6,Resort,DOT-R06-RES-01674-2023,"GUIMARAS MOUNTAIN RESORT AND RESTAURANT, INC.",GUIMARAS,BUENAVISTA,"BRGY. DARAGAN, BUENAVISTA, GUIMARAS",0917-812-1081,,10/31/2026
REGION 6,Resort,DOT-R06-RES-00374-2021,HI-JO CAMPOQUINO BAY BEACH HOUSE,NEGROS OCCIDENTAL,SIPALAY CITY,"BRGY. 4 (POB.), SIPALAY CITY, NEGROS OCCIDENTAL",0951-750-9403,,10/31/2026
REGION 6,Resort,DOT-R06-RES-00609-2022,ISTORYA FOREST GARDEN INCORPORATED,CAPIZ,PANAY,"BRGY. POBLACION ILAYA, PANAY, CAPIZ",(036)6210773,,10/31/2026
REGION 6,Resort,DOT-R06-RES-01520-2022,JADE ENERGETIC PARADISE AND ADVENTURE CORPORATION,ILOILO,BADIANGAN,"BRGY. CABAYOGAN, BADIANGAN, ILOILO",9302697363,,10/31/2026
REGION 6,Resort,DOT-R06-RES-03269-2024,LAKAWON ISLAND RESORTS & SPA,NEGROS OCCIDENTAL,CADIZ CITY,"LAKAWON ISLAND, BRGY. CADIZ VIEJO, CADIZ CITY, NEGROS OCCIDENTAL",9472483676,,10/31/2026
,,,(HOME INVEST PARKS & DEVELOPMENT INC.),,,,,,
REGION 6,Resort,DOT-R06-RES-01698-2023,LAPUERTA EL PARAIZO BEACH RESORT,GUIMARAS,NUEVA VALENCIA,"BRGY. SAN ROQUE, NUEVA VALENCIA, GUIMARAS",0917-104-4181/0960-834-6509,,10/31/2026
REGION 6,Resort,DOT-R06-RES-02831-2024,MAGIC ISLAND RESORT,GUIMARAS,NUEVA VALENCIA,"BRGY. TANDO, NUEVA VALENCIA, GUIMARAS",0950-601-3365,,10/31/2026
REGION 6,Resort,DOT-R06-RES-02638-2024,MAMBUKAL RESORT AND WILDLIFE SANCTUARY,NEGROS OCCIDENTAL,MURCIA,"BRGY. MINOYAN, MURCIA, NEGROS OCCIDENTAL",4320029,,10/31/2026
REGION 6,Resort,DOT-R06-RES-00347-2021,MAMBUQUIAO RISE RESORT INC.,AKLAN,BATAN,"SITIO BAYBAY, BRGY. MAMBUQUIAO, BATAN, AKLAN",0908-243-6535 / 272-6936,,10/31/2026
REGION 6,Resort,DOT-R06-RES-00831-2022,MARCEILY POINT RESORT,GUIMARAS,SAN LORENZO,"BRGY.TAMBORONG SAN LORENZO, GUIMARAS",0970-096-4058,,10/31/2026
REGION 6,Resort,DOT-R06-RES-03028-2024,NANA'S PLACE RESORT,NEGROS OCCIDENTAL,BAGO CITY,"ARANETA STREET, BRGY. SAMPINIT, BAGO CITY, NEGROS OCCIDENTAL",0917-305-5700,,10/31/2026
REGION 6,Resort,DOT-R06-RES-00217-2021,"NATAASAN BEACH RESORT AND DIVE CENTER, INCORPORATED",NEGROS OCCIDENTAL,SIPALAY CITY,"PUNTA BALLO, BARANGAY 4 (POB.), SIPALAY CITY, NEGROS OCCIDENTAL",0999-344-1113,,10/31/2026
REGION 6,Resort,DOT-R06-RES-00089-2021,NATURE'S EYE BEACH RESORT,GUIMARAS,NUEVA VALENCIA,"BRGY. TANDO, NUEVA VALENCIA, GUIMARAS",9074847945,,10/31/2026
REGION 6,Resort,DOT-R06-RES-01303-2022,NATURE'S VILLAGE RESORT,NEGROS OCCIDENTAL,TALISAY CITY,"ZONE 15, TALISAY HIGHWAY, BRGY. ZONE 15 (POB.), TALISAY CITY, NEGROS OCCIDENTAL",(034) 495-0808,,10/31/2026
REGION 6,Resort,DOT-R06-RES-01552-2022,PALMAS DEL MAR CONFERENCE-RESORT-HOTEL,BACOLOD CITY,BACOLOD CITY,"J.R. TORRES AVENUE, BARANGAY TANGUB, BACOLOD CITY",034-4347971,,10/31/2026
REGION 6,Resort,DOT-R06-RES-04003-2025,PLAYA DE PARAISO,GUIMARAS,SAN LORENZO,"MANTASIK II BRGY.SAN ENRIQUE, SAN LORENZO, GUIMARAS",033-3220396,,10/31/2026
REGION 6,Resort,DOT-R06-RES-00662-2022,PROSPERIDAD HIGHLANDS MOUNTAIN RESORT,NEGROS OCCIDENTAL,SAN CARLOS CITY,"BRGY. PROSPERIDAD, SAN CARLOS CITY, NEGROS OCCIDENTAL",9173216704,,10/31/2026
REGION 6,Resort,DOT-R06-RES-03428-2024,PUNTA BULATA RESORT & SPA (FWZ LAND CORPORATION),NEGROS OCCIDENTAL,CAUAYAN,"BRGY. ELIHAN, CAUAYAN, NEGROS OCCIDENTAL",9177183558,,10/31/2026
REGION 6,Resort,DOT-R06-RES-03842-2025,"PUNTA VILLA RESORT, INC.",GUIMARAS,NUEVA VALENCIA,"BRGY. TANDO, NUEVA VALENCIA, GUIMARAS",0907-113-5990,,10/31/2026
REGION 6,Resort,DOT-R06-RES-00486-2021,RAYMEN BEACH RESORT CORP.,GUIMARAS,NUEVA VALENCIA,"SITIO ALUBIHOD, BRGY. POBLACION, NUEVA VALENCIA, GUIMARAS",0927-560-5107,,10/31/2026
REGION 6,Resort,DOT-R06-RES-04068-2025,ROJAS AGRO INDUSTRIAL DEVELOPMENT CORPORATION - RESORTS NEGRENSE,BACOLOD CITY,BACOLOD CITY,"BRGY. BAYANIHAN, PUNTA TAYTAY, BACOLOD CITY, NEGROS OCCIDENTAL",9772020531,,10/31/2026
REGION 6,Resort,DOT-R06-RES-01347-2022,SAN ANTONIO RESORT,CAPIZ,ROXAS CITY,"LAWIS, BRGY. BAYBAY, ROXAS CITY, CAPIZ",0908-883-8736,,10/31/2026
REGION 6,Resort,DOT-R06-RES-01619-2022,"SIPAWAY ISLAND RESORT, INC. (FORMER SIPAWAY WHISPERING PALMS ISLAND RESORT, INC.)",NEGROS OCCIDENTAL,SAN CARLOS CITY,"SITIO PITOGO, BRGY. SAN JUAN, SAN CARLOS CITY, NEGROS OCCIDENTAL",0929-873-1146,,10/31/2026
REGION 6,Resort,DOT-R06-RES-00543-2021,SOL Y MAR FAMILY BEACH RESORT,ILOILO,TIGBAUAN,"BRGY. NAMOCON, TIGBAUAN, ILOILO",0998-576-2737/0917-322-8269,,10/31/2026
REGION 6,Resort,DOT-R06-RES-02574-2024,SOLINA BEACH AND NATURE RESORT,ILOILO,CARLES,"BALASAN-CARLES PROVINCIAL ROAD, BRGY. GUINTICGAN, CARLES, ILOILO",9171896462,,10/31/2026
REGION 6,Resort,DOT-R06-RES-03569-2024,SUN SEA RESORT,GUIMARAS,NUEVA VALENCIA,"PUROK 2, BRGY. CANHAWAN, NUEVA VALENCIA, GUIMARAS",9199504174,,10/31/2026
REGION 6,Resort,DOT-R06-RES-03308-2024,VILCHES BEACH RESORT,GUIMARAS,SAN LORENZO,"BRGY. SAN ENRIQUE (LEBAS), SAN LORENZO, GUIMARAS",0915-671-1276,,10/31/2026
REGION 6,Resort,DOT-R06-RES-00004-2021,VILLA OROCEO-GUANCO RESORT CO.,CAPIZ,SAPI-AN,"BRGY. AGSILAB, SAPI-AN,CAPIZ",0916-355-4935/0921-661-7797,,10/31/2026
REGION 6,Resort,DOT-R06-RES-01266-2022,VISTA-VERANDA BEACH RESORT,ANTIQUE,SAN JOSE DE BUENAVISTA,"BRGY. MADRANGCA, SAN JOSE DE BUENAVISTA, ANTIQUE",0927-822-0171,,10/31/2026
REGION 6,Resort,DOT-R06-RES-01458-2022,VISTAPALOMA BEACH RESORT,ANTIQUE,BELISON,"BRGY. MARADIONA, BELISON, ANTIQUE",9171321743,,10/31/2026
REGION 6,Resort,DOT-R06-RES-04015-2025,WHITE BEACHFRONT AND COTTAGES,AKLAN,BURUANGA,"HINUGTAN BEACH BRGY. BEL-IS, BURUANGA, AKLAN",9174699395,,10/31/2026
REGION 6,Resort,DOT-R06-RES-00397-2021,"ZAYCOLAND RESORTS, INC.",NEGROS OCCIDENTAL,KABANKALAN CITY,"DON EMILIO VILLAGE, BRGY. 9 (POB.), KABANKALAN CITY, NEGROS OCCIDENTAL",(034)4712-880,,10/31/2026
REGION 6,Resort,DOT-R06-RES-04109-2025,DAMIRES HILLS FARM AND SPA RESORT,ILOILO,JANIUAY,"BRGY. DAMIRES, JANIUAY, ILOILO",9275794068,,10/31/2026
REGION 6,Resort,DOT-R06-RES-04243-2025,TQP FARM INC.,NEGROS OCCIDENTAL,BAGO CITY,"THE QUIET PLACE, KM. 14, SAN JUAN STREET, BRGY. TABUNAN, BAGO CITY, NEGROS OCCIDENTAL",9173025581,,10/31/2026
REGION 6,Resort,DOT-R06-RES-04249-2025,NAZARETH ACTIVITY HUB,BACOLOD CITY,BACOLOD CITY,"PUROK GUANZON, BRGY. MANSILINGAN, BACOLOD CITY, NEGROS OCCIDENTAL",9985668977,,10/31/2026
REGION 6,Resort,DOT-R06-RES-01433-2022,A AND A SURFSIDE RESORT AND TRAVEL CORPORATION/ SURFSIDE BORACAY RESORT AND SPA,BORACAY-AKLAN,MALAY,"SITIO ANGOL, BRGY. MANOC-MANOC, BORACAY ISLAND, MALAY, AKLAN",0939-922-5299,,10/31/2026
REGION 6,Resort,DOT-R06-RES-04005-2025,"AGLO GROUP OF COMPANIES, INC./BANANA BAY BORACAY",BORACAY-AKLAN,MALAY,"SITIO BULABOG, BRGY.BALABAG, BORACAY ISLAND, MALAY AKLAN",288-9555,,10/31/2026
REGION 6,Resort,DOT-R06-RES-03205-2024,ALTA BRIZA RESORT INC,BORACAY-AKLAN,MALAY,"BALABAG MAIN ROAD, BRGY. BALABAG, BORACAY ISLAND, MALAY, AKLAN",2882200,,10/31/2026
REGION 6,Resort,DOT-R06-RES-03633-2024,ALTA VISTA DE BORACAY/ DMCI-PDI HOTELS INC.,BORACAY-AKLAN,MALAY,"BRGY. YAPAK, BORACAY ISLAND, MALAY, AKLAN",9165767288,,10/31/2026
REGION 6,Resort,DOT-R06-RES-00124-2021,AMBASSADOR IN PARADISE RESORT CORP.,BORACAY-AKLAN,MALAY,"STATION 1, BRGY. BALABAG, BORACAY ISLAND, MALAY, AKLAN",(036) 288-5598,,10/31/2026
REGION 6,Resort,DOT-R06-RES-00450-2021,AQUA BORACAY HOTEL & RESORT INC.,BORACAY-AKLAN,MALAY,"ZONE IV, BOLABOG BEACH, BRGY. BALABAG, BORACAY ISLAND, MALAY, AKLAN",(036) 288-1999,,10/31/2026
REGION 6,Resort,DOT-R06-RES-01309-2022,ASTORIA BORACAY INC.,BORACAY-AKLAN,MALAY,"STATION 1, BRGY. BALABAG, BORACAY ISLAND, MALAY, AKLAN",(036) 288-1111,,10/31/2026
REGION 6,Resort,DOT-R06-RES-01201-2022,ASTORIA CURRENT,BORACAY-AKLAN,MALAY,"STATION 3, SITIO MANGGAYAD, BRGY. MANOC-MANOC, BORACAY ISLAND, MALAY, AKLAN",(036) 288-1818,,10/31/2026
REGION 6,Resort,DOT-R06-RES-01407-2022,BORACAY HOLIDAY RESORT,BORACAY-AKLAN,MALAY,"TIROL COR. - MAIN ROAD, STATION 2, SITIO MANGGAYAD, BRGY. BALABAG, BORACAY ISLAND, MALAY, AKLAN",936 288 4085,,10/31/2026
REGION 6,Resort,DOT-R06-RES-04131-2025,BORACAY OCEAN CLUB BEACH RESORT,BORACAY-AKLAN,MALAY,"STATION 3, BRGY. MANOC-MANOC , BORACAY ISLAND, MALAY AKLAN",036 2885058,,10/31/2026
REGION 6,Resort,DOT-R06-RES-01364-2022,BORACAY TROPICS INCORPORATED,BORACAY-AKLAN,MALAY,"SITIO MANGGAYAD, BRGY. BALABAG, BORACAY ISLAND, MALAY, AKLAN",362884034,,10/31/2026
